kind;outputdata;year;unused1;unused2;code;halfyear
14;"Новое в оперативно-розыскном законодательстве – возвращение к истокам  / В.С. Гайдельцов // Труды Института национальной безопасности Республики Беларусь : сб. науч. тр. – Минск, 2010. – № 29. – С. 87-92";2010;;;50;
14;"Допустимость тактических приемов в расследовании преступлений / М.В. Галезник // Проблемы управления : науч.-практ. журн. / Акад. упр. при Президенте Респ. Беларусь. – Минск, 2010. – № 1(34). – С. 169-172";2010;;;103;
14;"Криминалистическая характеристика способов совершения криминальных взрывов / М.В. Галезник // Труды Института национальной безопасности Республики Беларусь: сб. науч. тр. – Минск, 2010. – № 29. – С. 45-51";2010;;;105;
14;"Особенности тактики допроса по делам о разбоях / А.В. Дроздов // Вести Института современных знаний: науч.-теорет. журн. – Минск, 2009. – № 1. – С. 13-17";2009;;;118;
14;"О процессуальной сущности установления состояния опьянения в административном процессе / В.М. Логвин, Ю.А. Матвейчев // Законность и правопорядок: науч.-практ. журн. / Ген. Прокуратура Респ. Беларусь. – Минск, 2010. – № 1. – С. 35-39";2010;;;135;
14;"Риск в страховании / В.П. Шиенок, М.А. Раевская // Вестник Академии МВД Республики Беларусь : науч.-практ. журн. – Минск, 2007. – № 1(13). – С. 79-82";2007;;;168;
14;"Особенности первоначального этапа расследования разбоев / Г.В. Федоров, А.В. Дроздов // Вести Института современных знаний: науч.-теорет. журн. – Минск, 2007. – № 2. – С. 17-21";2007;;;171;
14;"Правовое регулирование использования криминалистических средств в противодействии преступности / Г.В. Федоров // Вести Института современных знаний: науч.-теорет. журн. – Минск, 2007. – № 3(32). – С. 3-7";2007;;;179;
14;"Взаимодействие следователя с международными и белорусскими неправительственными организациями при расследовании секс-траффикинга / М.П. Шруб // Сацыяльна-эканамічныя і прававыя даследаванні : навук.-практ. і інфарм.-метадыч. часоп. / Прыватная ўстанова адукацыі ""БІП – Інстытут правазнаўства"". – Минск, 2010. – № 1. – С. 108-116";2010;;;189;
14;"Проблемы сотрудничества жертв торговли людьми с правоохранительными органами / М.П. Шруб // Вести Института современных знаний: науч.-теорет. журн. – Минск, 2010. – № 2. – С. 3-7";2010;;;191;
14;"Организация и тактика проведения оперативного внедрения в преступные группы взяточников / В.Н. Крюков, С.П. Годунов // Вестник Академии МВД Республики Беларусь : науч.-практ. журн. – Минск, 2011. – № 1с(5). – С. 33-37";2011;;;213;1
14;"Проблемы правовой регламентации информационно-криминалистического обеспечения ОВД / А.П. Пацкевич // Проблемы правовой информатизации: науч.-практ. журн. / Нац. центр правовой информ. Респ. Беларусь. – Минск, 2007. – № 1(13). – С. 52-56";2007;;;291;
14;"Генезис и развитие автоматизированной дактилоскопической идентификационной системы (АДИС) / А.П. Пацкевич, С.Н. Стороженко // Вопросы криминологии, криминалистики и судебной экспертизы : сб. науч. тр. / Науч.-исслед. ин-т криминалистики и судебной экспертизы М-ва юстиции Респ. Беларусь. – Минск, 2007. – № 1(21). – С. 92-97";2007;;;292;
14;"Проблемы в расследовании преступлений, связанных с криминальными посягательствами на автотранспортные средства / А.В. Чирский, А.П. Пацкевич // Вопросы криминологии, криминалистики и судебной экспертизы : сб. науч. тр. / Центр судебных экспертиз и криминалистики М-ва юстиции Респ. Беларусь; редкол.: А.В. Дулов (гл. ред.) [и др.]. – Минск : Право и экономика, 2010. – № 1(27). – С. 89-95";2010;;;293;
14;"К вопросу о понятии розыскной деятельности следователя / А.П. Пацкевич, Т.М. Бешенкова // Вопросы криминологии, криминалистики и судебной экспертизы : сб. науч. тр. / Науч.-исслед. ин-т криминалистики и судебной экспертизы М-ва юстиции Респ. Беларусь. – Минск, 2008. – № 1(23). – С. 47-49";2008;;;296;
14;"Организация автоматизированной дактилоскопической идентификационной системы в органах внутренних дел на современном этапе развития / А.П. Пацкевич, С.Н. Стороженко // Вестник Полоцкого государственного университета = Веснік Полацкага дзяржаўнага універсітэта : науч.-теорет. ежемес. журн. – Серия D: Экономические и юридические науки = Серыя D: Эканамічныя і юрыдычныя навукі. – Полоцк, 2008. – № 4. – С. 170-173";2008;;;298;
14;"Проблемы использования информационных технологий в исследовании следов пальцев рук / А.П. Пацкевич, А.В. Водолазов // Вопросы криминологии, криминалистики и судебной экспертизы : сб. науч. тр. / Науч.-исслед. ин-т криминалистики и судебной экспертизы М-ва юстиции Респ. Беларусь. – Минск, 2007. – № 1(21). – С. 76-81";2007;;;303;
14;"Тактические особенности раскрытия, расследования и профилактики краж из автотранспортных средств / А.П. Пацкевич // Вопросы криминологии, криминалистики и судебной экспертизы : сб. науч. тр. / Центр судебных экспертиз и криминалистики М-ва юстиции Респ. Беларусь. – Минск, 2009. – № 1(25). – С. 106-112";2009;;;304;
14;"Международно-правовое сотрудничество государств по противодействию терроризму во второй трети XX - начале XXI века / А.Ф. Вишневский, А.А. Вишневский // Сацыяльна-эканамічныя і прававыя даследаванні : навук.-практ. і інфарм.-метадыч. часоп. / Прыватная ўстанова адукацыі ""БІП – Інстытут правазнаўства"". – Минск, 2010. – № 1(19). – С. 4-25";2010;;;305;
14;"Проблемы научно-методического обеспечения деятельности следственных подразделений органов внутренних дел Республики Беларусь / А.П. Пацкевич, С.Н. Стороженко // Вопросы криминологии, криминалистики и судебной экспертизы : сб. науч. тр. / Центр судебной экспертизы и криминалистики М-ва юстиции Респ. Беларусь. – Минск, 2009. – № 1(25). – С. 159-168";2009;;;311;
14;"Проблемы использования научно-технических средств и методов в розыскной деятельности следователя / А.П. Пацкевич, С.Н. Стороженко // Вопросы криминологии, криминалистики и судебной экспертизы : сб. науч. тр. / Науч.-исслед. ин-т криминалистики и судебной экспертизы М-ва юстиции Респ. Беларусь. – Минск, 2008. – № 2(24). – С. 126-131";2008;;;313;
14;"Криминолого-пенитенциарная характеристика лиц с аутодеструктивным поведением / В.Б. Шабанов, М.Ю. Кашинский // Законность и правопорядок: науч.-практ. журн. / Ген. Прокуратура Респ. Беларусь. – Минск, 2008. – № 4. – С. 62-68";2008;;;338;
14;"Проблемы предупреждения самоубийств - организационные и правовые аспекты / В.Б. Шабанов, М.Ю. Кашинский // Законность и правопорядок: науч.-практ. журн. / Ген. Прокуратура Респ. Беларусь. – Минск, 2010. – № 1(13). – С. 31-35";2010;;;348;
14;"Современные подходы к психолого-профессиональной подготовке депутатов парламента  / И.А. Кибак // Психологический журнал : ежекв. науч.-практ. изд. / Минский ин-т упр. – Минск, 2009. – № 4(24). – С. 137-142";2009;;;408;
14;"Парламентское мышление и законотворческая деятельность / И.А. Кибак // Вестник Академии МВД Республики Беларусь : науч.-практ. журн. – Минск, 2008. – № 1(15). – С. 226-231";2008;;;411;
14;"Психологические аспекты обеспечения безопасности сотрудников ОВД при задержании автотранспортного средства с вооруженными преступниками / И.А. Кибак, А.И. Скриганюк // Вестник Академии МВД Республики Беларусь : науч.-практ. журн. – Минск, 2008. – № 2(16). – С. 166-170";2008;;;412;
14;"Психологические аспекты прогнозирования в законотворческой деятельности / И.А. Кибак // Вестник Академии МВД Республики Беларусь : науч.-практ. журн. – Минск, 2008. – № 2(16). – С. 162-166";2008;;;413;
14;"Законотворческая деятельность : психологические подходы в укреплении законности / И.А. Кибак // Проблемы управления : науч.-практ. журн. / Акад. упр. при Президенте Респ. Беларусь. – Минск, 2009. – № 1(30). – С. 197-201";2009;;;415;
14;"Психологизация и содержания закона / И.А. Кибак // Проблемы управления : науч.-практ. журн. / Акад. упр. при Президенте Респ. Беларусь. – Минск, 2007. – № 3(24). – С. 158-161";2007;;;417;
14;"Психологическое воздействие в законотворческой деятельности / И.А. Кибак // Вестник Академии МВД Республики Беларусь : науч.-практ. журн. – Минск, 2007. – № 1(13). – С. 183-186";2007;;;419;
14;"Психология законотворческой деятельности / И.А. Кибак // Научный вестник Омской академии МВД России. – Омск, 2007.– № 3 (27). – С. 47-51";2007;;;420;
14;"Психотехника в законотворческой деятельности / И.А. Кибак // Вестник Академии МВД Республики Беларусь : науч.-практ. журн. – Минск, 2007. – № 2(14). – С. 223-228";2007;;;422;
14;"Психотехника речи: вербальные и невербальные средства выражения в законотворческой деятельности / И.А. Кибак // Мова і культура : навук. журн. / Київський націон. ун-т ім. Тараса Шевченка, ТОВ з обмеженою відповідальністю „Видавничий дім Дмитра Бураго”. – Киïв, 2007. – Вип. 9. – Т. II(90). Психологія мови і культури. Мова сучасного мастацтва. Міжкультурна комунікація. – С. 380-385";2007;;;423;
14;"Роль и место закона в психолого-правовой системе Республики Беларусь / И.А. Кибак // Сацыяльна-эканамічныя і прававыя даследаванні : навук.-практ. і інфарм.-метадыч. часоп. / Прыватная ўстанова адукацыі ""БІП – Інстытут правазнаўства"". – Минск, 2009. – № 2(16). – С. 82-96";2009;;;425;
14;"Соблюдение принципа законности в законотворческой деятельности / И.А. Кибак, Г.А. Зорин // Вестник Академии МВД Республики Беларусь : науч.-практ. журн. – Минск, 2007. – № 1(13). – С. 25-29";2007;;;426;
14;"Современные подходы к психолого-профессиональной подготовке депутатов Парламента / И.А. Кибак  // Психопедагогика в правоохранительных органах: науч.-практ. журн. / Омская акад. МВД России. – Омск, 2009. – № 4(39). – С. 12-16";2009;;;427;
14;"Теоретические основы изучения психологических технологий воздействия на личность подозреваемого / Д.В. Сакович // Гуманитарно-экономический вестник: науч.-теорет. журн. / Междунар. гуманитарно-экономический ин-т. – Минск, 2009. – № 2 – С. 111-117";2009;;;434;
14;"Эффективность психологической технологии диагностики истинности показаний подозреваемого / Д.В. Сакович // Гуманитарно-экономический вестник : науч.-теорет. журн. / Междунар. гуманитарно-экономический ин-т. – Минск, 2007. – № 3. – С. 71-77";2007;;;437;
14;"Интенсификация процесса обучения технико-тактическим приемам самообороны с использованием модульного подхода (на примере дисциплины ""Профессионально-прикладная физическая подготовка"" в учреждении образования ""Академия МВД Республики Беларусь"") / А.Ч. Марцулевич, Г.В. Антонов // Научные труды НИИ физической культуры и спорта Республики Беларусь : сб. науч. тр. / М-во спорта и туризма Респ. Беларусь; НИИ ФКиС Респ. Беларусь ; под ред. Н.Г. Кручинского. – Минск, 2010. – Вып. 9. – С. 179-185";2010;;;497;
14;"О сущности и содержании государственно-правовой политики Республики Беларусь по противодействию торговле людьми / О.И. Бахур, В.А. Ананич // Вестник Академии МВД Республики Беларусь : науч.-практ. журн. – Минск, 2008. – № 1(15). – С. 75-78";2008;;;579;
14;"О функции в уголовном процессе / Ю.С. Климович // Научные труды Академии управления при Президенте Республики Беларусь : сб. науч. ст. – Вып. 10 : в 3-х ч. / Акад. упр. при Президенте Респ. Беларусь. – Минск, 2008. – Ч. 2 : Право. – С. 46-55";2008;;;652;
14;"Прокурор в уголовном процессе / Л.И. Родевич, Т.А. Кокоринова // Законность и правопорядок: науч.-практ. журн. / Ген. Прокуратура Респ. Беларусь. – Минск, 2008. – № 1. – С. 26-30";2008;;;668;
14;"Об освидетельствовании потерпевшего и свидетеля / Л.И. Родевич, Ю.П. Шкаплеров // Законность и правопорядок: науч.-практ. журн. / Ген. Прокуратура Респ. Беларусь. – Минск, 2009. – № 1. – С. 59-62";2009;;;688;
14;"Право на возмещение вреда, причиненного незаконными действиями органа, ведущего уголовный процесс, в трудах русских юристов / О.В. Рожко // Научные труды Академии управления при Президенте Республики Беларусь : сб. науч. ст. – Вып. 10 : в 3-х ч. / Акад. упр. при Президенте Респ. Беларусь. – Минск, 2008. – Ч. 2 : Право. – С. 170-177";2008;;;692;
14;"Юридическая природа права на возмещение вреда, причиненного незаконными действиями органа, ведущего уголовный процесс / О.В. Рожко // Вести Института современных знаний : науч.-теорет. журн. – Минск, 2009. – № 1. – С. 8-12";2009;;;696;
14;"Право на возмещение вреда, причиненного незаконными действиями органа, ведущего уголовный процесс / И.В. Данько, О.В. Рожко // Законность и правопорядок: науч.-практ. журн. / Ген. Прокуратура Респ. Беларусь. – Минск, 2009. – № 1. – С. 63-68";2009;;;697;
14;"О функциях участников уголовного процесса / С.В. Рыбак // Научные труды Академии управления при Президенте Республики Беларусь : сб. науч. ст. – Вып. 10 : в 3-х ч. / Акад. упр. при Президенте Респ. Беларусь. – Минск, 2008. – Ч. 2 : Право. – С. 283-290";2008;;;702;
14;"Использование легендированных организаций для выявления взяточничества / В.Н. Крюков // Вестник Академии МВД Республики Беларусь : науч.-практ. журн. – Минск, 2011. – № 1с(5). – С. 29-33";2011;;;736;1
14;"Понятие и сущность осмотра как следственного действия  / Ю.П. Шкаплеров // Научные труды Академии управления при Президенте Республики Беларусь : сб. науч. ст. – Вып. 10 : в 3-х ч. / Акад. упр. при Президенте Респ. Беларусь. – Минск, 2008. – Ч. 2 : Право. – С. 215-216";2008;;;793;
14;"Женский алкоголизм и некоторые пути его преодоления / С.В. Ананич, С.М. Свило // Вопросы криминологии, криминалистики и судебной экспертизы : сб. науч. тр. / Науч.-исслед. ин-т криминалистики и судебной экспертизы М-ва юстиции Респ. Беларусь. – Минск, 2007. – № 1(21). – С. 42-47";2007;;;809;
14;"Взаимосвязь незаконной миграции и мошенничества / О.И. Бахур, Д.В. Ермолович // Вестник Академии МВД Республики Беларусь : науч.-практ. журн. – Минск, 2009. – № 2(18). – С. 72-76";2009;;;812;
14;"Организованные формы незаконной миграции в Республике Беларусь: проблемы уголовно-правового противодействия / О.И. Бахур // Вестник Академии МВД Республики Беларусь : науч.-практ. журн. – Минск, 2008. – № 2(16). – С. 65-70";2008;;;817;
14;"Уголовно-правовая оценка нарушений, связанных с трансплантацией органов или тканей человека / Э.А. Саркисова, Р.Н. Ключко // Юстыцыя Беларусі : юрыд. навук.-практ. часоп. / Администрация Президента Респ. Беларусь, М-во юстиции Респ. Беларусь, Респ. коллегия адвокатов. – Минск, 2010. – № 4 . – С. 29-34";2010;;;840;
14;"Содержание и элементы работы с семьей, оказавшейся в социально опасном положении / В.А. Ананич, С.М. Свило // Право.by : науч.-практ. журн. / Нац. центр правовой информ. Респ. Беларусь. – Минск, 2008. – № 1. – С. 167-171";2008;;;845;
14;"К вопросу об объектах криминологического исследования при проведении криминологической экспертизы проектов нормативных правовых актов / А.А. Сосновский // Право в современном белорусском обществе : сб. науч. тр. / Нац. центр законодательства и правовых исследований Респ. Беларусь; редкол.: В.И. Семенков (гл. ред.), Г.А. Василевич (зам. гл. ред.) [и др.]. – Минск : Право и экономика, 2010. – Вып. 5. – С. 591-600";2010;;;847;
14;"Типичные нарушения законности проведения оперативного эксперимента при раскрытии взяточничества / В.П. Шиенок, В.Н. Крюков // Вестник Академии МВД Республики Беларусь : науч.-практ. журн. – Минск, 2007. – № 2(14). – С. 144-149";2007;;;1058;
14;"Ограничение прав и свобод граждан при введении особых режимов / И.В. Козелецкий // Научные труды Академии управления при Президенте Республики Беларусь : сб. науч. ст. – Вып. 10 : в 3-х ч. / Акад. упр. при Президенте Респ. Беларусь. – Минск, 2008. – Ч. 2 : Право. – С. 56-64";2008;;;1067;
