kind;outputdata;year;unused1;unused2;code;halfyear
14;"Из истории создания административно-управленческих структур белорусских губерний (конец XVIII - первая половина XIX в.) / А. С. Жмуровский // Вестник Академии МВД Республики Беларусь. – 2016. – № 1(31). – С. 180–185.";2016;;;8946;1
14;"Асноўныя тэндэнцыi развiцця гiстарыяграфіі этнагенезу беларусаў у навуцы канца XVIII - пачатку ХХI ст. / А. М. Сувалаў (О. Н. Сувалов) // Вестник Академии МВД Республики Беларусь. – 2016. – № 1(31). – С. 185-189";2016;;;8947;1
14;"Стратегия и тактика политических партий России и Беларуси в выборе путей общественного и национального развития в 1917–1918 гг.: историографический аспект / Е. Н. Сувалова // Вестник Академии МВД Республики Беларусь. – 2016. – № 1(31). – С. 189–192.";2016;;;8948;1
14;"Семейное законодательство в сфере противодействия насилию в семье / В. И. Пенкрат // Вестник Академии МВД Республики Беларусь. – 2016. – № 1(31). – С. 156–161.";2016;;;8949;1
14;"Неприкосновенность личности: право, принцип, гарантия / А. А. Подупейко // Вестник Академии МВД Республики Беларусь. – 2016. – № 1(31). – С. 162–166.";2016;;;8950;1
14;"Гражданско-правовая ответственность за вред, причиненный малолетним жизни или здоровью гражданина / И. В. Савина // Вестник Академии МВД Республики Беларусь. – 2016. – № 1(31). – С. 166–169.";2016;;;8951;1
14;"Личностный аспект профессиональной деятельности и развития профессионализма / Т. В. Казак, С. А. Стулъба // Вестник Академии МВД Республики Беларусь. – 2016. – № 1(31). – С. 193–197.";2016;;;8952;1
14;"Методология криминальной психологии: развитие системы базовых положений / А. Н. Пастушеня // Вестник Академии МВД Республики Беларусь. – 2016. – № 1(31). – С. 201–207.";2016;;;8953;1
14;"Периодическая печать как средство правового воспитания / В. Г. Стуканов // Вестник Академии МВД Республики Беларусь. – 2016. – № 1(31). – С. 207–211.";2016;;;8954;1
14;"Психологические особенности профессиональной деятельности руководителей органов внутренних дел / С. А. Стульба // Вестник Академии МВД Республики Беларусь. – 2016. – № 1(31). – С. 211–214.";2016;;;8955;1
14;"Парадигма научного творчества основоположника сыскологии А. Ю. Шумилова / И. И. Басецкий // Вестник Академии МВД Республики Беларусь. – 2016. – № 1(31). – С. 215–219.";2016;;;8956;1
14;"Европейский опыт передачи лиц, осужденных к лишению свободы, для отбывания наказания в государства их гражданства / В. Б. Шабанов // Вестник института: преступление, наказание, исправление. – 2016. – № 1(33). – С. 11–13";2016;;;8967;1
14;"Исполнение международно-правовых обязательств по передаче осужденных компетентными органами Российской Федерации / В. Б. Шабанов // Вестник Кузбасского института. – 2016. – № 2(27). – С. 98–103";2016;;;8968;1
14;"Уголовно-правовые и процессуальные аспекты передачи несовершеннолетних, осужденных к лишению свободы, для отбывания наказания в государства их гражданства / В. Б. Шабанов, А. Л. Санташов // Закон и право. – 2016. – № 4. – С. 29–31";2016;;;8969;1
14;"Наградные листы как источники по истории военного духовенства Российской империи в годы Первой мировой войны (по материалам Российского государственного исторического архива) / А. В. Кащеев // Вестн. БГУ. Сер. 3, История. Экономика. Право. – 2016. – № 2. – С. 77–80.";2016;;;8976;2
14;"Административные правонарушения против экологической безопасности как вид экологических правонарушений / А. С. Кривонощенко // Вестник Академии МВД Республики Беларусь. – 2016. – № 2(32). – С. 10–13.";2016;;;9133;2
14;"Пути совершенствования мер административной ответственности / Д. П. Семенюк // Вестник Академии МВД Республики Беларусь. – 2016. – № 2(32). – С. 19–24.";2016;;;9134;2
14;"Административная ответственность за правонарушения против собственности физических и юридических лиц, ее понятие и признаки / С. А. Старовойт // Вестник Академии МВД Республики Беларусь. – 2016. – № 2(32). – С. 24–28.";2016;;;9135;2
14;"Аспекты оснований применения и использования оружия сотрудниками органов внутренних дел / Р. Е. Чернецкий // Вестник Академии МВД Республики Беларусь. – 2016. – № 2(32). – С. 28–33.";2016;;;9136;2
14;"Типичные способы совершения преступлений в сфере закупок представителями заказчика / А. В. Башан, А. М. Шинкевич // Вестник Академии МВД Республики Беларусь. – 2016. – № 2(32). – С. 34–39.";2016;;;9137;2
14;"Характеристика входных огнестрельных повреждений в зависимости от угла встречи пули с преградой / А. О. Гусенцов // Вестник Академии МВД Республики Беларусь. – 2016. – № 2(32). – С. 44–47.";2016;;;9139;2
14;"Содействие граждан в решении задач оперативно-розыскной профилактики органами внутренних дел / Д. Н. Лахтиков // Вестник Академии МВД Республики Беларусь. – 2016. – № 2(32). – С. 47–50.";2016;;;9140;2
14;"Современные подходы к пониманию теории субъектов и участников оперативно-розыскной деятельности и их значение для юридической практики / В. Ч. Родевич // Вестник Академии МВД Республики Беларусь. – 2016. – № 2(32). – С. 56–59.";2016;;;9141;2
14;"Совершенствование организационного обеспечения выявления экономических преступлений / А. Н. Толочко, С. В. Пилюшин // Вестник Академии МВД Республики Беларусь. – 2016. – № 2(32). – С. 59–64.";2016;;;9142;2
14;"Особенности расследования хищений в строительстве / А. В. Яскевич, А. В. Дешук // Вестник Академии МВД Республики Беларусь. – 2016. – № 2(32). – С.64–68.";2016;;;9143;2
14;"Экономическая безопасность государства: понятие и этапы формирования механизма административно-правового обеспечения / А. А. Вишневский // Вестник Академии МВД Республики Беларусь. – 2016. – № 2(32). – С 69–73.";2016;;;9144;2
14;"Перспективные направления деятельности правоохранительных органов Республики Беларусь и Российской Федерации по обеспечению экономической безопасности государства (окончание) / А. А. Вишневский, А. Г. Сачек, А. А. Крылов, Ю. А. Болт // Вестник Академии МВД Республики Беларусь. – 2016. – № 2(32). – С. 73–76.";2016;;;9145;2
14;"Особенности правового регулирования мер поощрения и взыскания, применяемых к осужденным к ограничению свободы без направления в исправительное учреждение открытого типа / С. В. Казак // Вестник Академии МВД Республики Беларусь. – 2016. – № 2(32). – С. 81–85.";2016;;;9146;2
14;"Об объективной стороне преступлений, предметом которых являются документы / В. А. Кашевский // Вестник Академии МВД Республики Беларусь. – 2016. – № 2(32). – С. 85–88.";2016;;;9147;2
14;"Понятие и криминологическая характеристика организованной преступности / И. А. Шаматульский // Вестник Академии МВД Республики Беларусь. – 2016. – № 2(32). – С. 101–105.";2016;;;9148;2
14;"Международный переговорный процесс: проявление договорной инициативы / А. И. Бородич // Вестник Академии МВД Республики Беларусь. – 2016. – № 2(32). – С. 106–110.";2016;;;9149;2
14;"Полномочия представителей международных организаций на заключение международных договоров / В. Н. Вежновец // Вестник Академии МВД Республики Беларусь. – 2016. – № 2(32). – С. 111–114.";2016;;;9150;2
14;"Принцип баланса интересов в системе мер государственного принуждения в гражданском праве / Е. М. Ефременко // Вестник Академии МВД Республики Беларусь. – 2016. – № 2(32). – С. 119–122.";2016;;;9151;2
14;"Исчисление выслуги лет государственной службы сотрудникам органов внутренних дел / Е. Н. Мазаник, Г. Г. Рыхлицкий // Вестник Академии МВД Республики Беларусь. – 2016. – № 2(32). – С. 122–126.";2016;;;9152;2
14;"Некоторые аспекты недействительности сделки при нарушении преимущественного права покупки акций закрытого акционерного общества / Л. М. Орлова // Вестник Академии МВД Республики Беларусь. – 2016. – № 2(32). – С. 127–130.";2016;;;9153;2
14;"Общая характеристика концессионного договора как способа осуществления инвестиций на территории Республики Беларусь: теоретико-правовой взгляд на проблему / В. В. Паращенко // Вестник Академии МВД Республики Беларусь. – 2016. – № 2(32). – С. 130–135.";2016;;;9154;2
14;"Некоторые аспекты правового регулирования достоинства личности / А. А. Подупейко // Вестник Академии МВД Республики Беларусь. – 2016. – № 2(32). – С. 135–139.";2016;;;9155;2
14;"Неприкосновенность личности в деятельности органов внутренних дел: правовое регулирование / А. А. Подупейко, Д. Н. Лычковский // Вестник Академии МВД Республики Беларусь. – 2016. – № 2(32). – С. 139–143.";2016;;;9156;2
14;"Методологическое значение общей теории государства и права и некоторые инновационные подходы к ее изучению / А. Ф. Вишневский // Вестник Академии МВД Республики Беларусь. – 2016. – № 2(32). – С. 144–150.";2016;;;9157;2
14;"Особенности становления, функционирования и развития органов внутренних дел на территории Беларуси (1917 – конец 20-х гг .ХХ в.) / А. В. Григорьев // Вестник Академии МВД Республики Беларусь. – 2016. – № 2(32). – С 153–158.";2016;;;9158;2
14;"Некоторые аспекты организации режима в детских колониях БССР в послевоенные годы (1945–1953 гг.) / В. А. Данилов // Вестник Академии МВД Республики Беларусь. – 2016. – № 2(32). – С. 158–162.";2016;;;9159;2
14;"Конфессиональный фактор организации управления военного духовенства Российской империи накануне Первой мировой войны / А. В. Кащеев // Вестник Академии МВД Республики Беларусь. – 2016. – № 2(32). – С. 162–167.";2016;;;9160;2
14;"Категория справедливости в политико-правовой мысли Древней Греции / А. А. Козел // Вестник Академии МВД Республики Беларусь. – 2016. – № 2(32). – С. 167–170.";2016;;;9161;2
14;"Создание и деятельность школы милиции в Минске в первой половине 20-х гг. ХХ в. (Часть 1) / С. Ф. Лапанович // Вестник Академии МВД Республики Беларусь. – 2016. – № 2(32). – С. 170–175.";2016;;;9162;2
14;"Производство дознания по уголовным делам о кражах личного имущества на объектах железнодорожного транспорта / О. И. Левшук, М. А. Кравцова // Вестник Академии МВД Республики Беларусь. – 2016. – № 2(32). – С. 175–180.";2016;;;9163;2
14;"Учреждения уголовно-исполнительной системы: единство медицинской и психологической составляющих / Е. В. Лемешко // Вестник Академии МВД Республики Беларусь. – 2016. – № 2(32). – С. 181–185.";2016;;;9164;2
14;"Психологичеcкий анализ мотивов преступлений в контексте учета при назначении наказания / А. Н. Пастушеня // Вестник Академии МВД Республики Беларусь. – 2016. – № 2(32). – С. 185–190.";2016;;;9165;2
14;"О повышении эффективности образовательного процесса в системе повышения квалификации и переподготовки руководящих кадров органов внутренних дел Республики Беларусь / Ю. Л. Сиваков // Вестник Академии МВД Республики Беларусь. – 2016. – № 2(32). – С. 190–194.";2016;;;9166;2
14;"Генезис, диалектика сыска, оперативно-розыскной деятельности, системы сыска и сыскологии / И. И. Басецкий // Вестник Академии МВД Республики Беларусь. – 2016. – № 2(32). – С. 198–202.";2016;;;9168;2
14;"О проблемах ведения административного процесса по части 2 статьи 9.1 Кодекса Республики Беларусь об административных правонарушениях / В. В. Коляго, О. Г. Каразей // Право.by. – 2015. – № 6. – С. 74–80.";2015;;;9169;2
14;"Административно-правовое регулирование профилактики правонарушений в Республике Беларусь / В. В. Коляго // Юрид. наука и практика : Вестн. Нижегор. академии МВД России. – 2016. – № 3. – С. 239– 242.";2016;;;9170;2
14;"Критерии оценки деятельности субъектов профилактики правонарушений / В. В. Коляго // Сацыяльна-эканамічныя і прававыя даследаванні. – 2016. № 2. – С. 40–52.";2016;;;9171;2
14;"Расходы на сохранение средней заработной платы лицам, вызываемым в орган, ведущий уголовный процесс, как вид процессуальных издержек / Н. А. Суховенко // Законность и правопорядок. – 2016. – №1. – С. 48–52.";2016;;;9185;1
14;"Современное состояние и перспективы законодательного регламентирования отношений товарного кредитования физических лиц банками и торговыми предприятиями / В. Ф. Ермолович, Ю. В. Михайловская // Труд. Профсоюзы. Общество. – 2016 – № 1 (51). – С. 73–76.";2016;;;9186;1
14;"Признаки преступления как составляющая предмета доказывания на стадии возбуждения уголовного дела / О. В. Колесникова // Вестн. Полоц. гос. ун-та. Сер. D, Экон. и юрид. науки. – 2016. – № 5. – С. 208–213.";2016;;;9187;2
14;"Правовые и организационные аспекты предупреждения посягательств на жизнь новорожденных детей посредством системы «Бэби-бокс» / М. Ю. Кашинский, Ю. Ф. Машталер // Наука и жизнь Казахстана. – 2016. – № 3 (38). – С. 64–69.";2016;;;9188;2
14;"Криминалистическая характеристика общественно опасного деяния как элемент противодействия преступности / В. Л. Григорович // Проблемы правоохранительной деятельности: международный научно-теоретический журнал / Белгородский юридический институт МВД Российской Федерации им. И.Д. Путилина. – Белгород: Бел ЮИ МВД РФ им. И.Д. Путилина. – 2016. – № 2. – С. 41–46.";2016;;;9189;2
14;"Концептуальные подходы к определению и классификации основных подразделений органов пограничной службы Республики Беларусь / В. Ф. Ермолович, В. Н. Будько // Труд. Профсоюзы. Общество. – Минск, 2016. – № 2. – С. 52–57.";2016;;;9190;2
14;"Сущностные подходы к пониманию человека на примере современной криминологии: индивидуальная душа и ее информационное поле / В. П. Шиенок // Труд. Профсоюзы. Общество. – Минск, 2016. – № 3. – С. 75–79.";2016;;;9191;2
14;"Перспективные направления функционально-целевого обеспечения расследования преступлений / М. В. Савич // Вестн. Акад. МВД Респ. Беларусь. – 2016. – № 2 (32). – С.39–44.";2016;;;9192;2
14;"Закрытая тема / В. Н. Радоман, А. В. Яскевич // Труды Ин-та нац. безопасности Респ. Беларусь. – № 41. – 2016.– С.87–96.";2016;;;9193;2
14;"Миграция населения: история и современные тенденции / И. Н. Бобкова // Гуманiтарно-эканамiчны вестнiк. –2016. – № 3 (64). – С. 103–108.";2016;;;9194;2
14;"Теории государственного регулирования системы налогообложения / Л. П. Пацкевич // Гуманiтарно-эканамiчны вестнiк. –2016. – № 3 (64). – С. 3–13.";2016;;;9195;2
14;"Закон Республики Беларусь «О военном положении»: пути совершенствования / В. И. Стельмах, Е. В. Стельмах // Труды  Ин-та нац. безопасности Респ. Беларусь. – 2016. – № 40. – С. 332–341.";2016;;;9196;1
14;"Правовое обеспечение экологической безопасности в чрезвычайных экологических ситуациях / В. И. Стельмах // Труды Ин-та нац. безопасности Респ. Беларусь. – 2016. – № 41. – С. 116–123.";2016;;;9197;2
14;"Трагедия рядового солдата Второй мировой войны в ранних произведениях Генриха Бёлля / Е.П. Синяк //Весці БДПУ. – Серыя 1. – 2016. - №1. – С. 96–100.";2016;;;9204;1
14;"Особенности профессиональной мотивации руководителей органов внутренних дел / С. А. Стульба // Вестн. Акад. МВД Респ. Беларусь. – 2016. – №2(32). – С.194–197.";2016;;;9205;2
14;"Византийское каноническое право в контексте проблемы определения путей рецепции римского права на Руси / В. И. Павлов // EVROPSKA REVIJAС. Naučni časopis Evropskog univerziteta Brčko distrikta (Republika Bosna i Hercegovina). – Br.2 (4), 2016. – S. 116–125.";2016;;;9224;2
14;"Особенности формирования византийской правовой системы и византийского канонического права в контексте проблемы определения путей рецепции римского права на Руси / В. И. Павлов // Право в современном белорусском обществе: сб. науч. тр. / Нац. центр законодательства и правовых исследований Респ. Беларусь; редкол.: Н.А. Карпович (гл. ред.) [и др.]. – Минск: СтройМедиаПроект, 2016. – Вып. 11. – С. 62–71.";2016;;;9225;2
14;"Соотношение права и законодательства как проблема современной юриспруденции (Начало) / А. Ф. Вишневский, В. А. Кучинский // Право.by. – 2016. – № 5. – С. 10–15";2016;;;9226;2
14;"Соотношение права и законодательства как проблема современной юриспруденции (Окончание) / А. Ф. Вишневский, В. А. Кучинский // Право.by. – 2016. – № 6. – С. 10–14";2016;;;9227;2
