kind;outputdata;year;unused1;unused2;code;halfyear
10;"Функционирование системы менеджмента качества в Академии МВД Республики Беларусь / Н. И. Орловская // Организация образовательного процесса : информ.-метод. сб. ; редкол.: А. В. Башан [и др.] ; учреждение образования «Акад. М-ва внутр. дел Респ. Беларусь». – Минск, 2016. – № 16. – С. 58–61";2016;;;9238;2
10;"Организация и использование в образовательном процессе учреждения образования «Академия Министерства внутренних дел Республики Беларусь» электронных учебно-методических комплексов по учебным дисциплинам / Н. В. Крынская, О. З. Рыбаключева // Организация образовательного процесса : информ.-метод. сб. ; редкол.: А. В. Башан [и др.] ; учреждение образования «Акад. М-ва внутр. дел Респ. Беларусь». – Минск, 2016. – № 16. – С. 49–53";2016;;;9261;2
10;"Отдельные аспекты использования активных методов обучения в образовательном процессе / Д. Н. Лахтиков // Организация образовательного процесса : информ.-метод. сб. / М-во внутр. дел Респ. Беларусь, Акад. М-ва внутр. дел Респ. Беларусь ; редкол.: А. В. Башан [и др.]. – Минск, 2016. – № 16 – С. 61-64.";2016;;;9320;2
10;"Совершенствование методики преподавания учебных дисциплин кафедры оперативно-розыскной деятельности с использованием компьютерного полигона кафедры / А. Н. Тукало // Организация образовательного процесса : информ.-метод. сб. / М-во внутр. дел Респ. Беларусь, Акад. М-ва внутр. дел Респ. Беларусь ; редкол.: А. В. Башан [и др.]. – Минск, 2016. – № 16 – С. 74-78";2016;;;9321;2
10;"Модельное регулирование на пространстве СНГ в области обеспечения безопасности критически важных объектов информационно-коммуникационной инфраструктуры / Д. В. Перевалов, А. Н. Лепехин // Стратегический вектор обеспечения международной информационной безопасности : сб. / Сост. : М. А. Вус, О. С. Макаров. – СПб. : СПИИРАН, 2016. – Гл. 5. – С. 66–81.";2016;;;9424;2
10;"Совершенствование и гармонизация законодательства в сфере эксплуатации открытых телекоммуникационных сетей для предупреждения их использования в террористических и иных противоправных целях / Д. В. Перевалов, А. Н. Лепехин // Стратегический вектор обеспечения международной информационной безопасности : сб. / Сост. : М. А. Вус, О. С. Макаров. – СПб. : СПИИРАН, 2016. – Гл. 6. – С. 82–88.";2016;;;9425;2
10;"Особенности методики преподавания на второй ступени высшего образования / А. Н. Пастушеня // Организация образовательного процесса : информ.-метод. сб. / М-во внутр. дел Респ. Беларусь, Акад. Мин-ва внутр. дел Респ. Беларусь ; редкол.: А. В. Башан [и др.]. – Минск, 2016. – № 16 – С. 64-70.";2016;;;9433;2
10;"Результаты образовательной деятельности Академии МВД Республики Беларусь в 2015/16 учебном году и основные направления совершенствования подготовки кадров для органов внутренних дел / А. В. Башан // Организация образовательного процесса : информ.-метод. сб. ; редкол.: А. В. Башан [и др.] ; учреждение образования «Акад. М-ва внутр. дел Респ. Беларусь». – Минск, 2016. – № 16. – С. 36–44";2016;;;9477;2
10;"Использование в образовательном процессе криминологических полигонов при проведении учебных занятий по учебной дисциплине «Криминалистика / И. В. Пашута // Организация образовательного процесса : информ.-метод. сб. ; редкол.: А. В. Башан [и др.] ; учреждение образования «Акад. М-ва внутр. дел Респ. Беларусь». – Минск, 2016. – № 16. – С. 70–74";2016;;;9478;2
10;"Научно-исследовательская деятельность профессорско-преподавательского состава: особенности индивидуального планирования / Е. В. Сакулевич, Т. М. Фицук // Организация образовательного процесса : информ.-метод. сб. ; редкол.: А. В. Башан [и др.] ; учреждение образования «Акад. М-ва внутр. дел Респ. Беларусь». – Минск, 2016. – № 16. – С. 78–86";2016;;;9479;2
10;"Милиции Беларуси: 100 лет. История и современность / В. А. Ананич, В. В. Бачила, А. Ф. Вишневский, В. А. Данилов, А. С. Жмуровский, Ю. В. Курьянович, С. Ф. Лапанович, А. И. Мурашко, В. И. Павлов, А. Н. Сапогин, А. В. Шарков ; под общ. ред. И. А. Шуневича. – Минск : Беларусь, 2016. – 191 с.";2016;;;9500;2
10;"Сравнительный анализ институтов амнистии и помилования в Российской Федерации и Республике Беларусь / Н. В. Кийко, Т. Г. Терещенко, Д. В. Горбач [и др.]. – Рязань : Академия ФСИН России, 2016. – 53 с.";2016;;;9523;2
10;"Взлет и падение Лаврентия Цанавы / А. В. Шарков, Ю. Бествицкий // Милиция Беларуси. – 2016. – № 6 (66). – С. 44–45";2016;;;9524;2
10;"Милиция Беларуси : 100 лет. История и современность / В. А. Ананич, А. Ф. Вишневский, В. А. Данилов, А. С. Жмуровский, С. Ф. Лапанович, А. И. Мурашко, В. И. Павлов, А. Н. Сапогин, А. В. Шарков ; под общей редакцией И. А. Шуневича. – Минск : Беларусь, 2016. – 191 с.";2017;;;9614;1
10;"Уголовный процесс. Особенная часть: ответы на экзамен. вопросы / М. А. Шостак. – 5-е изд., перераб. и доп. – Минск : Тетралит, 2017. – 256 с.";2017;;;9654;1
10;"Сравнительный анализ институтов амнистии и помилования в Российской Федерации и Республике Беларусь / Н. В. Кийко, Д. В. Горбач [и др.]. – Рязань : Академия ФСИН России, 2016. – 53 с.";2016;;;9664;2
10;"Результаты образовательной деятельности учреждения образования «Академия Министерства  внутренних дел Республики  Беларусь» в I семестре 2016/17 учебного года и основные направления совершенствования подготовки кадров для органов внутренних дел / А. В. Башан // Организация образовательного процесса : информ.-метод. сб. ; редкол.: А. В. Башан [и др.] ; учреждение образования «Акад. М-ва внутр. дел Респ. Беларусь». – Минск, 2017. – № 17. – С. 30–38";2017;;;9705;1
10;"Сравнительный анализ уровня усвоения знаний при использовании традиционных форм обучения, компьютерных программных средств и мультимедийных обучающих комплексов / П. Л. Боровик, Е. В. Чистая, В. Ф. Кетурко // Организация образовательного процесса : информ.-метод. сб. ; редкол.: А. В. Башан [и др.] ; учреждение образования «Акад. М-ва внутр. дел Респ. Беларусь». – Минск, 2017. – № 17. – С. 39–52";2017;;;9706;1
10;"Практические подходы реализации методики развития творческого потенциала обучающихся в процессе преподавания юридических дисциплин / О. В. Кононенко, Т. В. Палиева // Организация образовательного процесса : информ.-метод. сб. ; редкол.: А. В. Башан [и др.] ; учреждение образования «Акад. М-ва внутр. дел Респ. Беларусь». – Минск, 2017. – № 17. – С. 53–62";2017;;;9707;1
10;"Повышение эффективности самоорганизации и оценки обучающихся при проведении лабораторных занятий / Р. М. Ропот // Организация образовательного процесса : информ.-метод. сб. ; редкол.: А. В. Башан [и др.] ; учреждение образования «Акад. М-ва внутр. дел Респ. Беларусь». – Минск, 2017. – № 17. – С. 62–68";2017;;;9708;1
10;"Педагогическое сотрудничество: пути установления / В. Л. Голубев // Организация образовательного процесса : информ.-метод. сб. ; редкол.: А. В. Башан [и др.] ; учреждение образования «Акад. М-ва внутр. дел Респ. Беларусь». – Минск, 2017. – № 17. – С. 69–70";2017;;;9709;1
10;"Методика проведения практического занятия по учебной  дисциплине«Административно-деликтное и процессуально-исполнительное право» / В. В. Зиновенко // Организация образовательного процесса : информ.-метод. сб. ; редкол.: А. В. Башан [и др.] ; учреждение образования «Акад. М-ва внутр. дел Респ. Беларусь». – Минск, 2017. – № 17. – С. 71–75";2017;;;9710;1
10;"Предметное моделирование как перспективное направление развития концепции криминалистических полигонов / Р. В. Скачек // Организация образовательного процесса : информ.-метод. сб. ; редкол.: А. В. Башан [и др.] ; учреждение образования «Акад. М-ва внутр. дел Респ. Беларусь». – Минск, 2017. – № 17. – С. 75–81";2017;;;9711;1
10;"Кейс-метод и его использование в образовательном процессе / О. Э. Схопчик // Организация образовательного процесса : информ.-метод. сб. ; редкол.: А. В. Башан [и др.] ; учреждение образования «Акад. М-ва внутр. дел Респ. Беларусь». – Минск, 2017. – № 17. – С. 82–85";2017;;;9712;1
10;"Алгоритм проверки первичной информации о сбыте наркотиков в сети Интернет / Д. Л. Харевич // Вестн. ГУУР МВД Респ. Беларусь. – 2017. – № 24. – С. 15–25";2017;;;10268;2
10;"Использование методики «цветок лотоса» как интерактивного метода в преподавании дисциплины «Административное право» / С. С. Касьянчик // Организация образовательного процесса : информ.-метод. сб. / учреждение образования ""Акад. М-ва внутр. дел Респ. Беларусь"". – Минск : Академия МВД, 2017. – № 18. – С. 34–38";2017;;;10400;2
10;"О применении технологий развития критического мышления в образовательном процессе / Г. Г. Рыхлицкий // Организация образовательного процесса : информ.-метод. сб. / учреждение образования ""Акад. М-ва внутр. дел Респ. Беларусь"". – Минск : Академия МВД, 2017. – № 18. – С. 52–57";2017;;;10401;2
10;"Использование методики «Цветок лотоса» при актуализации опорных знаний обучающихся / О. В. Гиммельрейх // Организация образовательного процесса : информ.-метод. сб. / учреждение образования ""Акад. М-ва внутр. дел Респ. Беларусь"". – Минск : Академия МВД, 2017. – № 18. – С. 23–26";2017;;;10402;2
10;"Учет криминологических особенностей структуры личности преступника при организации исправительного процесса в исправительных учреждениях / Т. Г. Терещенко // Информ. бюллетень Департамента исполнения наказаний МВД Респ. Беларусь. – 2017. – № 7. – С. 48–50";2017;;;10474;2
10;"Обеспечение правового положения осужденных как фактор эффективности деятельности исправительных учреждений / Н. В. Кийко, С. И. Проценко // Информ. бюллетень Департамента исполнения наказаний МВД Респ. Беларусь. – 2017. – № 7. – С. 45-47";2017;;;10475;2
10;"Развитие собственной активности осужденных в исправительном процессе позволит повысить его результативность / А. Н. Пастушеня // Информационный бюллетень ДИН МВД. – Минск, 2017. – С. 28–34";2017;;;10545;2
10;"Научное наследие профессора Л.Д. Гауфмана. Лекции по уголовному праву для адъюнктов, аспирантов и соискателей / А. В. Ковальчук, С. В. Борисов ; учреждение образования «Акад. М-ва внутр. дел Респ. Беларусь». – Минск : Академия МВД, 2018. – 118, [2] с.";2018;;;10824;1
10;"От школы начинающих преподавателей к занятиям по криминалистике / В. И. Елётнов // Организация образовательного процесса : информ.-метод. сб. ; редкол.: А. В. Башан [и др.] ; учреждение образования «Акад. М-ва внутр. дел Респ. Беларусь». – Минск, 2017. – № 18. – С. 29–30";2017;;;10848;2
10;"Результаты образовательной деятельности учреждения образования «Академия Министерства  внутренних дел Республики Беларусь» в 2016/17 учебном году и основные направления совершенствования подготовки кадров для органов внутренних дел / А. В. Башан // Организация образовательного процесса : информ.-метод. сб. ; редкол.: А. В. Башан [и др.] ; учреждение образования «Акад. М-ва внутр. дел Респ. Беларусь». – Минск, 2017. – № 18. – С. 3–9";2017;;;10849;1
10;"Управление рисками в учреждении высшего образования (на примере Академии МВД Республики Беларусь) / Н. И. Орловская // Организация образовательного процесса : информ.-метод. сб. ; редкол.: А. В. Башан [и др.] ; учреждение образования «Акад. М-ва внутр. дел Респ. Беларусь». – Минск, 2018. – № 17. – С. 10–12";2017;;;10850;2
10;"Использование современных методов анализа хозяйственных операций в подготовке кадров для органов внутренних дел / М. А. Балухтин // Организация образовательного процесса : информ.-метод. сб. ; редкол.: А. В. Башан [и др.] ; учреждение образования «Акад. М-ва внутр. дел Респ. Беларусь». – Минск, 2017. – № 18. – С. 16–19";2017;;;10851;2
10;"Комплексное использование различных методов обучения на занятиях по учебной дисциплине «Общая теория права» / Д. А. Воропаев // Организация образовательного процесса : информ.-метод. сб. ; редкол.: А. В. Башан [и др.] ; учреждение образования «Акад. М-ва внутр. дел Респ. Беларусь». – Минск, 2017. – № 18. – С. 19–23";2017;;;10852;2
10;"Использование методики «Цветок лотоса» при актуализации опорных знаний обучающихся / О. В. Гиммельрейх // Организация образовательного процесса : информ.-метод. сб. ; редкол.: А. В. Башан [и др.] ; учреждение образования «Акад. М-ва внутр. дел Респ. Беларусь». – Минск, 2017. – № 18. – С. 23–26";2017;;;10853;2
10;"Возможности использования видеозадач в образовательном процессе / Ю. Е. Духовник // Организация образовательного процесса : информ.-метод. сб. ; редкол.: А. В. Башан [и др.] ; учреждение образования «Акад. М-ва внутр. дел Респ. Беларусь». – Минск, 2017. – № 18. – С. 26–28";2017;;;10854;2
10;"Использование интерактивной доски в образовательном процессе Академии МВД Республики Беларусь / П. А. Кайбелев // Организация образовательного процесса : информ.-метод. сб. ; редкол.: А. В. Башан [и др.] ; учреждение образования «Акад. М-ва внутр. дел Респ. Беларусь». – Минск, 2017. – № 18. – С. 31–34";2017;;;10855;2
10;"Использование методики «Цветок лотоса» как интерактивного метода в преподавании дисциплины «Административное право» / С. С. Касьянчик // Организация образовательного процесса : информ.-метод. сб. ; редкол.: А. В. Башан [и др.] ; учреждение образования «Акад. М-ва внутр. дел Респ. Беларусь». – Минск, 2017. – № 18. – С. 34–38";2017;;;10856;2
10;"О некоторых аспектах активизации работы обучающихся при проведении семинарских занятий / С. В. Кодавбович // Организация образовательного процесса : информ.-метод. сб. ; редкол.: А. В. Башан [и др.] ; учреждение образования «Акад. М-ва внутр. дел Респ. Беларусь». – Минск, 2017. – № 18. – С. 38–42";2017;;;10857;2
10;"О совершенствовании методики обучения навыкам применения и использования оружия сотрудниками органов внутренних дел / А. А. Козлов // Организация образовательного процесса : информ.-метод. сб. ; редкол.: А. В. Башан [и др.] ; учреждение образования «Акад. М-ва внутр. дел Респ. Беларусь». – Минск, 2017. – № 18. – С. 42–44";2017;;;10858;2
10;"Отдельные аспекты изучения учебной дисциплины «Баллистика и баллистическая экспертиза» / Е. А. Лаппо // Организация образовательного процесса : информ.-метод. сб. ; редкол.: А. В. Башан [и др.] ; учреждение образования «Акад. М-ва внутр. дел Респ. Беларусь». – Минск, 2017. – № 18. – С. 44–46";2017;;;10859;2
10;"Преодоление ошибки «ожидание выстрела» на занятиях по огневой подготовке / Н. Е. Матюшенко // Организация образовательного процесса : информ.-метод. сб. ; редкол.: А. В. Башан [и др.] ; учреждение образования «Акад. М-ва внутр. дел Респ. Беларусь». – Минск, 2017. – № 18. – С. 47–48";2017;;;10860;2
10;"Совершенствование методики преподавания учебных дисциплин с использованием возможностей полигона кафедры оперативно-розыскной деятельности / С. В. Пилюшин // Организация образовательного процесса : информ.-метод. сб. ; редкол.: А. В. Башан [и др.] ; учреждение образования «Акад. М-ва внутр. дел Респ. Беларусь». – Минск, 2017. – № 18. – С. 48–51";2017;;;10861;2
10;"О применении технологии развития критического мышления в образовательном процессе / Г. Г. Рыхлицкий // Организация образовательного процесса : информ.-метод. сб. ; редкол.: А. В. Башан [и др.] ; учреждение образования «Акад. М-ва внутр. дел Респ. Беларусь». – Минск, 2017. – № 18. – С. 52–57";2017;;;10862;2
10;"Использование игрового метода обучения в образовательном процессе / С. А. Старовойт // Организация образовательного процесса : информ.-метод. сб. ; редкол.: А. В. Башан [и др.] ; учреждение образования «Акад. М-ва внутр. дел Респ. Беларусь». – Минск, 2017. – № 18. – С. 58–60";2017;;;10863;2
