kind;outputdata;year;unused1;unused2;code;halfyear
6;"Специальная техника органов внутренних дел : базовая учеб. программа по курсу / В.В. Бачила, С.В. Бородич, В.Е. Козлов ; под ред. В.В. Бачилы. – Минск : Акад. МВД Респ. Беларусь, 2007. – 23 с.";2007;;;2540;
6;"Оперативно-розыскная деятельность органов внутренних дел : учеб. программа по специальности 1-24 01 02 «Правоведение» / И.И. Басецкий, В.В. Бачила, В.Б. Шабанов [и др.]. – Минск : Акад. МВД Респ. Беларусь, 2007. – 58 с.";2007;;;2541;
6;"Специальная техника органов внутренних дел : учеб. программа для специальности 1-23 01 02 «Судебная экспертиза» / В.В. Бачила, С.В. Бородич, В.Е. Козлов. – Минск : Акад. МВД Респ. Беларусь, 2008. – 27 с.";2008;;;2542;
6;"Специальная техника органов внутренних дел : учеб. программа для специальности 1-24 01 02 «Правоведение» / В.В. Бачила, С.В. Бородич, В.Е. Козлов. – Минск : Акад. МВД Респ. Беларусь, 2008. – 27 с.";2008;;;2543;
6;"Образцы документов, оформляемых при проведении оперативно-розыскного мероприятия «проверочная закупка» : практ. руководство / Сост. В.В. Бачила ; М-во внутрен. дел Респ. Беларусь, Акад. МВД. – Минск : Акад. МВД Респ. Беларусь, 2006. – 28 с.";2006;;;2545;
6;"Образцы документов, оформляемых при проведении оперативно-розыскного мероприятия «оперативный эксперимент» : практ. руководство / В.В. Бачила ; М-во внутрен. дел Респ. Беларусь, Акад. МВД. – Минск : Акад. МВД Респ. Беларусь, 2006. – 34 с.";2006;;;2546;
6;"Уголовно-исполнительное право : программа по курсу / В.Б. Шабанов, А.В. Шарков, В.Н. Руткевич ; М-во внутрен. дел Респ. Беларусь, Акад. МВД. – Минск : Акад. МВД Респ. Беларусь, 1997. – 31 с.";1997;;;2868;
6;"Уголовно-исполнительное право : рабоч. учеб. программа / А.В. Шарков, В.Б. Шабанов, В.Н. Руткевич ; М-во внутрен. дел Респ. Беларусь, Акад. МВД. – Минск : Акад. МВД Респ. Беларусь, 1996. – 42 с.";1996;;;2869;
6;"Организация борьбы с организованной рецидивной преступностью : учеб. программа / В.П. Ашитко, В.Б. Шабанов, А.В. Шарков [и др.]; М-во внутрен. дел Респ. Беларусь, Акад. МВД. – Минск : Акад. МВД Респ. Беларусь, 1999. – 8 с.";1999;;;2870;
6;"Организация режима отбывания наказания : рабоч. программа / В.П. Ашитко, В.Б. Шабанов, А.А. Кот ; М-во внутрен. дел Респ. Беларусь, Акад. МВД. – Минск : Акад. МВД Респ. Беларусь, 1999. – 9 с.";1999;;;2871;
6;"Основы управления в ИТУ : рабоч. программа / В.П. Ашитко, В.Б. Шабанов, А.А. Кот ; М-во внутрен. дел Респ. Беларусь, Акад. МВД. – Минск : Акад. МВД Респ. Беларусь, 1999. – 14 с.";1999;;;2872;
6;"Уголовно-исполнительное право : учеб. программа / А.В. Шарков, В.Б. Шабанов, О.В. Смирнов [и др.] ; М-во внутрен. дел Респ. Беларусь, Акад. МВД. – Минск : Акад. МВД Респ. Беларусь, 2001. – 48 с.";2001;;;2873;
6;"Оперативно-розыскная деятельность органов внутренних дел : базов. учеб. программа / В.В. Бачила, В.Б. Шабанов, В.Н. Лепешко [и др]; М-во внутрен. дел Респ. Беларусь, Акад. МВД ; под общ. ред. И.И. Басецкого, В.В. Бачилы. – Минск : Акад. МВД Респ. Беларусь, 2002. – 67 с.";2002;;;2874;
6;"Организация режима отбывания наказания : базов. учебная программа / В.Б. Шабанов, В.С. Красиков ; М-во внутрен. дел Респ. Беларусь, Акад. МВД. – Минск : Акад. МВД Респ. Беларусь, 2003. – 20 с.";2003;;;2875;
6;"Оперативно-розыскная деятельность в ИТУ : рабоч. программа / В.П. Ашитко, В.Б. Шабанов, А.А. Кот ; М-во внутрен. дел Респ. Беларусь, Акад. МВД. – Минск : Акад. МВД Респ. Беларусь, 1997. – 48 с.";1997;;;2876;
6;"Организация режима в исправительных учреждениях : учеб. программа / В.Б. Шабанов, Н.В. Кийко ; М-во внутрен. дел Респ. Беларусь, Акад. МВД. – Минск : Акад. МВД Респ. Беларусь, 2008. – 14 с.";2008;;;2877;
6;"Предотвращение проникновения в ИТУ запрещенных предметов. Организационно-правовые меры : учеб.-метод. пособие / С.А. Кадушкин, В.Б. Шабанов, А.А. Кот ; М-во внутрен. дел Респ. Беларусь, Акад. МВД.– Минск : Акад. МВД Респ. Беларусь, 1999. – 41 с.";1999;;;2880;
6;"Особенности формирования и причины противоправного поведения несовершеннолетних : учеб.-метод. пособие / В.Б. Шабанов, С.А. Кадушкин, Е.А. Никишин. – Минск : Бестпринт, 2001. – 54 с.";2001;;;2881;
6;"Психология профессиональной деятельности юриста : учеб.-метод. пособие для студентов психологических, юридических специальностей / В.Б. Шабанов, А.Л. Лукьянович ; БИП - Институт правоведения. – Минск : БИП-С плюс, 2006. – 78 с.";2006;;;2882;
6;"Планы проведения занятий со старшими оперуполномоченными и оперуполномоченными исправительных учреждений на ФПК / В.Б. Шабанов, А.А. Будкевич ; М-во внутрен. дел Респ. Беларусь, Акад. МВД, каф. оперативно-розыскной деятельности. – Минск : Акад. МВД Респ. Беларусь, 2007. – 27 с.";2007;;;2883;
6;"Планы проведения занятий со старшими оперуполномоченными и оперуполномоченными исправительных учреждений открытого типа на ФПК / В.Б. Шабанов, А.А. Будкевич ; М-во внутрен. дел Респ. Беларусь, Акад. МВД, каф. оперативно-розыскной деятельности. – Минск : Акад. МВД Респ. Беларусь, 2007. – 15 с.";2007;;;2884;
6;"Уголовно-исполнительное право : учеб.-метод. рекоменд. для слушателей заочн. формы обуч. / В.Б. Шабанов, Н.Ф. Ахраменка, И.И. Куценков ; М-во внутрен. дел Респ. Беларусь, Акад. МВД. – Минск : Акад. МВД Респ. Беларусь, 1997. – 32 с.";1997;;;2885;
6;"Оперативно-розыскная деятельность органов внутренних дел (Общая часть) : метод. рекоменд. по проведению занятий с курсантами дневной формы обучения / В.Б. Шабанов, А.А. Будкевич ; М-во внутрен. дел Респ. Беларусь, Акад. МВД, каф. оперативно-розыскной деятельности. – Минск : Акад. МВД Респ. Беларусь, 2006. – 154 с.";2006;;;2886;
6;"Методические рекомендации по подготовке курсовых работ для курсантов уголовно-исполнительного факультета / В.Б. Шабанов, А.А. Будкевич ; М-во внутрен. дел Респ. Беларусь, Акад. МВД, каф. оперативно-розыскной деятельности. – Минск : Акад. МВД Респ. Беларусь, 2007. – 85 с.";2007;;;2887;
6;"Методические рекомендации по проведению занятий со старшими оперуполномоченными и оперуполномоченными исправительных учреждений на ФПК / В.Б. Шабанов, А.А. Будкевич ; М-во внутрен. дел Респ. Беларусь, Акад. МВД, каф. оперативно-розыскной деятельности. – Минск : Акад. МВД Респ. Беларусь, 2007. – 41 с.";2007;;;2888;
6;"Методические рекомендации по проведению занятий со старшими оперуполномоченными и оперуполномоченными исправительных учреждений открытого типа на ФПК / В.Б. Шабанов, А.А. Будкевич ; М-во внутрен. дел Респ. Беларусь, Акад. МВД, каф. оперативно-розыскной деятельности. – Минск : Акад. МВД Респ. Беларусь, 2007. – 24 с.";2007;;;2889;
6;"Оперативно-розыскная деятельность органов внутренних дел (Особенная часть) : планы проведения занятий с курсантами дневной формы обучения/ Авт.-сост.: В.Б. Шабанов, А.А. Будкевич ; М-во внутрен. дел Респ. Беларусь, Акад. МВД, каф. оперативно-розыскной деятельности. – Минск : Акад. МВД Респ. Беларусь, 2007. – 89 с.";2007;;;2890;
6;"Философия : метод. пособие для студентов технических и экономических специальностей / Л.Е. Лойко (вопрос 13) [и др.] ; под общ. ред. А.И. Лойко. – Минск : БНТУ, 2010. – 202 с.";2010;;;2945;
6;"Начальная профессиональная подготовка. Введение в специальность: метод. материалы для курсантов 1-го курса / авт.-сост. А.В. Лубенков, В.Н. Крюков, О.И. Левшук,  В.А. Русак, А.А. Тариков ; Акад. М-ва внутрен. дел Респ. Беларусь. – Минск : Акад. МВД, 2010. – 52 с.";2010;;;2967;
6;"Основы экономической теории : типовая учеб. программа для учреждений, обеспеч. получение сред. спец. образования / А.И. Авраменко, А.Я. Коховец ; М-во образования Респ. Беларусь, РИПО. – Минск, 2010. – 15 с.";2010;;;3134;
6;"Защита населения и объектов от чрезвычайных ситуаций : учеб.-метод. пособие по дисциплине ""Защита населения и объектов от чрезвычайных ситуаций. Радиационная безопасность"" / М-во образования Респ. Беларусь, учреждение образования ""Белорусский государственный педагогический университет им. М. Танка"" ; С.Н. Чигирь, В.П. Сытый, Я.Ф. Комяк [и др.] ; под общ. ред. В.П. Сытого. – Минск : БГПУ, 2010. – 172 c.";2010;;;3293;
6;"Английский язык для студентов специальности «Дизайн» = English for Design Students : учеб.-метод. пособие / сост.: Т.И. Сугоняко, М.А. Андарало [и др.] ; под общ. ред. Т.И. Сугоняко. – Минск : БГУ, 2010. – 143 с.";2010;;;3356;
6;"Современные информационные технологии (в т.ч. делопроизводство) : метод. рекоменд. : заоч. форма обучения / Акад. МВД Респ. Беларусь, Каф. правовой информатики ; авт.-сост. Н.М. Бобович, П.Л. Боровик. – Минск : Акад. МВД Респ. Беларусь, 2009. – 49 с.";2009;;;3608;
6;"Гражданский процесс: учеб.-метод. пособие : в 2 ч. / В.Н. Паращенко, В.В. Паращенко. – Минск : БИП-С Плюс, 2011. – Ч. 1. – 264 с.";2011;;;3708;1
6;"Гражданский процесс: учеб.-метод. пособие : в 2 ч. / В.Н. Паращенко, В.В. Паращенко. – Минск : БИП-С Плюс, 2011. – Ч. 2. – 144 с.";2011;;;3709;2
6;"Сборник образцов уголовно-процессуальных документов : Возбуждение уголов. дела и предварит. расследование : учеб.-метод. пособие / Акад. МВД; авт.-сост.: Г.Н. Васильев, М.И. Ешманский, Е.И. Климова, П.В. Мытник [и др.] ; под науч. ред. М.А. Шостака. – Минск : Акад. МВД, 2002. – 591 с.";2002;;;3717;
6;"План семинарских занятий по уголовному процессу: учеб.-метод. пособие / П.В. Мытник. – Минск : Акад. МВД Респ. Беларусь, 2004. – 52 с.";2004;;;3719;
6;"Уголовный процесс: план семинарских занятий : учеб.-метод. пособие / авт.-сост.: П.В. Мытник, Л.И. Родевич, П.В. Гридюшко. – Минск: Акад. МВД Респ. Беларусь, 2005. – 60 с.";2005;;;3720;
6;"Уголовный процесс : рабочая учеб. программа по специальности 1­24 01 02 Правоведение / П.В. Мытник. – Минск : Акад. МВД Респ. Беларусь, 2004. – 68 с.";2004;;;3721;
6;"Судоустройство : учеб. программа по специальности 1­24 01 02 Правоведение / П.В. Мытник. – Минск : Акад. МВД Респ. Беларусь, 2009. – 40 с.";2009;;;3722;
6;"Специальная техника органов внутренних дел : учеб. программа для специальности 1–24 01 02 Правоведение / В.В. Бачила, С.В. Бородич, В.Е. Козлов ; М-во внутр. дел Респ. Беларусь, учреждение образования «Акад. М-ва внутр. дел Респ. Беларусь». – Минск : Акад. МВД Респ. Беларусь, 2011. – 31 с.";2011;;;3809;2
6;"Экспертиза в психиатрии (трудовая, военно-врачебная, судебная, экспертиза алкогольного и наркотического опьянения) : учеб.-метод. пособие / М.М. Скугаревская, М.Ю. Кашинский ; Белорус. гос. мед. ун-т, каф. психиатрии и мед. психологии. – Минск : БГМУ, 2011. – 24 с.";2011;;;3963;2
6;"Философия : метод. пособие для студентов технических и экономических специальностей / Л.Е. Лойко, А.И. Лойко, Л.В. Уваров, В.А. Семенюк. – Минск : БНТУ, 2011. – 215 с.";2011;;;4016;2
6;"История международного публичного права: учеб.-метод. пособие / А.В. Гурин ; Акад. упр. при Президенте Респ. Беларусь. – Минск, 2012. – 76 с.";2012;;;4394;1
6;"Правовое обеспечение хозяйственной деятельности : (в вопросах и ответах) : учеб.-метод. пособие / Н.И. Рудович ; Частн. ин-т упр. и предпринимат. – Минск : Частн. ин-т упр. и предпринимат., 2012. – 68 с.";2012;;;4395;1
6;"Организация охраны общественного порядка подразделениями органов внутренних дел при проведении массовых мероприятий : учеб. пособие / Авт.-сост. В.С. Климченя, В.В. Чудаков ; М-во внутр. дел Респ. Беларусь, учреждение образования «Акад. М-ва внутр. дел Респ. Беларусь». – Минск : Акад. МВД, 2012. – 40 с.";2012;;;4409;1
6;"Практикум по оперативно-розыскной деятельности органов внутренних дел : метод. разраб. для проведения практических занятий темы 1-15 для проф.-преп. состава каф. ОРД факультета милиции / С.П. Годунов, В.Ч. Родевич ; М-во внутр. дел Респ. Беларусь, учреждение образования ""Акад. М-ва внутр. дел Респ. Беларусь"", каф. ОРД. – Минск: Акад. МВД, 2012. – 92 с.";2012;;;4516;1
6;"Оперативно-розыскная деятельность органов внутренних дел. Общая часть : метод. рекоменд. для курсантов факультета милиции специальность 1-24 01 02 Правоведение специализация: 1-24 01 02 18 ""Административно-правовая деятельность"" / А.Н. Тукало, А.А. Дедковский, А.Н. Толочко ; М-во внутр. дел Респ. Беларусь, учреждение образования ""Акад. М-ва внутр. дел Респ. Беларусь"", каф. ОРД. – Минск: Акад. МВД, 2012. – 59 с.";2012;;;4517;1
6;"Оперативно-розыскная деятельность органов внутренних дел. Общая часть : метод. рекоменд. для курсантов факультета милиции дневной формы обучения / А.Н. Тукало, А.А. Дедковский, А.Н. Толочко ; М-во внутр. дел Респ. Беларусь, учреждение образования ""Акад. М-ва внутр. дел Респ. Беларусь"", каф. ОРД. – Минск: Акад. МВД, 2012. – 138 с.";2012;;;4518;1
6;"Оперативно-розыскная деятельность органов внутренних дел. Особенная часть : метод. рекоменд. для курсантов факультета милиции дневной формы обучения / А.Н. Тукало, А.А. Дедковский, А.Н. Толочко ; М-во внутр. дел Респ. Беларусь, учреждение образования ""Акад. М-ва внутр. дел Респ. Беларусь"", каф. ОРД. – Минск: Акад. МВД, 2012. – 75 с.";2012;;;4519;1
6;"Оперативно-розыскная деятельность органов внутренних дел. Общая часть : метод. разраб. для проф.-преп. состава каф. ОРД факультета милиции / А.Н. Тукало, А.А. Дедковский, А.Н. Толочко ; М-во внутр. дел Респ. Беларусь, учреждение образования ""Акад. М-ва внутр. дел Респ. Беларусь"", каф. ОРД. – Минск: Акад. МВД, 2012. – 102 с.";2012;;;4520;1
6;"Оперативно-розыскная деятельность органов внутренних дел. Особенная часть : метод. разраб. для проф.-преп. состава каф. ОРД факультета милиции / А.Н. Тукало, А.А. Дедковский, А.Н. Толочко ; М-во внутр. дел Респ. Беларусь, учреждение образования ""Акад. М-ва внутр. дел Респ. Беларусь"", каф. ОРД. – Минск: Акад. МВД, 2012. – 83 с.";2012;;;4521;1
6;"Организация и тактика деятельности оперативных подразделений ОВД (специализация уголовный розыск) : метод. рекоменд. для проведения лекционных, семинарских и практических занятий темы № 1-18 для курсантов факультета милиции / В.Ч. Родевич, А.Н. Тукало, А.А. Дедковский, И.Г. Мухин, А.Н. Толочко ; М-во внутр. дел Респ. Беларусь, учреждение образования ""Акад. М-ва внутр. дел Респ. Беларусь"", каф. ОРД. – Минск: Акад. МВД, 2012. – 63 с.";2012;;;4522;1
6;"Организация и тактика деятельности оперативных подразделений ОВД (специализация уголовный розыск) : метод. разраб. для проведения лекционных, семинарских и практических занятий темы № 1-18 для проф.-преп. состава каф. ОРД факультета милиции / В.Ч. Родевич, А.Н. Тукало, А.А. Дедковский, И.Г. Мухин, А.Н. Толочко ; М-во внутр. дел Респ. Беларусь, учреждение образования ""Акад. М-ва внутр. дел Респ. Беларусь"", каф. ОРД. – Минск: Акад. МВД, 2012. – 83 с.";2012;;;4523;1
6;"Римское частное право : учеб.-метод. комплекс : [для студ.] / Н.Л. Бондаренко, О.В. Кондакова, Т.В. Абарович ; Частное учреждение образования «Минский институт управления». – Минск : МИУ, 2012. – 126 с.";2012;;;4806;2
6;"Практикум по оперативно-розыскной деятельности органов внутренних дел : метод. разработки для специальности 1-24 01 02 Правоведение; специализация: 1-24 01 02 10 Оперативно-розыскная деятельность / С.П. Годунов, В.Ч. Родевич ; М-во внутр. дел Респ. Беларусь, учреждение образования «Акад. М-ва внутр. дел Респ. Беларусь». – Минск : Акад. МВД Респ. Беларусь, 2012. – 97 с.";2012;;;4880;2
6;"Практикум по оперативно-розыскной деятельности органов внутренних дел : метод. рекомендации для специальности 1-24 01 02 Правоведение; специализация: 1-24 01 02 10 Оперативно-розыскная деятельность / С.П. Годунов, В.Ч. Родевич ; М-во внутр. дел Респ. Беларусь, учреждение образования «Акад. М-ва внутр. дел Респ. Беларусь». – Минск : Акад. МВД Респ. Беларусь, 2012. – 31 с.";2012;;;4882;2
6;"Аграрное право : учеб.-метод. комплекс  / О.С. Буйкевич. – Минск : Изд-во МИУ, 2012. – 118 с.";2012;;;4931;2
6;"Экологическое право : учеб.-метод. комплекс / Н.Г. Цыпарков. – Минск : МИУ, 2012. – 452 с.";2012;;;4932;2
