kind;outputdata;year;unused1;unused2;code;halfyear
4;"Римское гражданское право : курс лекций / Е.В. Лобатенко ; М-во внутрен. дел Респ. Беларусь, Акад. МВД. – Минск : Акад. МВД Респ. Беларусь, 2009. – 119 с.";2009;;;8;
4;"Правовое регулирование оперативно-розыскной деятельности : курс лекций / В.С. Гайдельцов. – Минск : ИНБ Респ. Беларусь, 2007. – 110 с.";2007;;;36;
4;"Международное частное право : курс лекций: [для курсантов, студентов и слушателей] / Н.И. Рудович, М.Л. Чудаева ; М-во внутрен. дел Респ. Беларусь, Акад. МВД. – Минск : Акад. МВД Респ. Беларусь, 2008. – 119 с.";2008;;;65;
4;"Криминалистическая тактика : конспект лекций / Г.В. Фёдоров, В.Л. Григорович, И.И. Лузгин ; под ред. Г.В. Федорова. – Новополоцк : ПГУ, 2010. – 176 с.";2010;;;83;
4;"Конституционное право Республики Беларусь : курс лекций / А.А. Подупейко ; М-во внутрен. дел Респ. Беларусь, Акад. МВД. – Минск : Акад. МВД Респ. Беларусь, 2008. – 255 с.";2008;;;87;
4;"Основы юридической психологии : курс лекций / А.А. Урбанович. – Минск : ФУАинформ, 2009. – 448 с.";2009;;;391;
4;"Управление органами внутренних дел : курс лекций / А.П. Леонов ;  М-во внутрен. дел Респ. Беларусь, Акад. МВД. – Минск : Акад. МВД Респ. Беларусь, 2007. – 323 с.";2007;;;1046;
4;"Управление органами внутренних дел : курс лекций: [для курсантов, обучающихся по специальности ""Правоведение""] : в 2 т. / А.П. Леонов ;  М-во внутрен. дел Респ. Беларусь, Акад. МВД. – 2-е изд., перераб. и доп. – Минск : Акад. МВД Респ. Беларусь, 2009. – Т. 1. – 219 с.; – Т. 2. – 239 с.";2009;;;1116;
4;"Раскрытие экономических преступлений : курс лекций / А.В. Башан, В.Н. Каленик ; М-во внутрен. дел Респ. Беларусь, Акад.МВД. – Минск : Акад.МВД Респ. Беларусь, 2009. – 104 с.";2009;;;1314;
4;"Экологическое право Республики Беларусь : курс лекций : [для курсантов Акад. МВД Респ. Беларусь] / А.Н. Сапогин ; М-во внутрен. дел Респ. Беларусь, Акад. МВД. – Минск : Акад. МВД Респ. Беларусь, 2007. – 267 с.";2007;;;1392;
4;"Хозяйственное право : курс лекций / А.Г. Сачек, В.С. Гальцов, В.Н. Радоман, А.В. Сальникова. – Минск : Тесей, 2008. – 344 с.";2008;;;1418;
4;"Экологическое право Республики Беларусь : Особенная часть : курс лекций / А.Н. Сапогин ; М-во внутрен. дел Респ. Беларусь, Акад. МВД. – Минск : Акад. МВД Респ. Беларусь, 2009. – 199 с.";2009;;;1451;
4;"Криминалистика. Методика расследования отдельных видов преступлений : конспект лекций / А.И. Костров, В.В. Печерский, Н.Г. Цыпарков ; Минский ин-т упр. – Минск : Издательство МИУ, 2009. – 355 с.";2009;;;1452;
4;"Делопроизводство и режим секретности : курс лекций / Н.М. Бобович ; М-во внутрен. дел Респ. Беларусь, Акад. МВД. – Минск : Акад. МВД Респ. Беларусь, 2008. – 85 с.";2008;;;1497;
4;"Организация изобретательской работы : курс лекций / Б.Л. Кулаковский, А.В. Кузнецов. – Минск : КИИ МЧС Республики Беларусь, 2008. – 80 с.";2008;;;1549;
4;"Общая теория государства и права : курс лекций [для студентов юридических вузов] / А.Ф. Вишневский. – 2-е изд., исправленное и дополненное. – Минск : Тесей, 2007. – 352 с.";2007;;;1611;
4;"Формальная логика для юристов : курс лекций / В.А. Галенок. – Минск : Тесей, 2008. – 400 с.";2008;;;1714;
4;"Гражданский процесс : курс лекций : в 2 т. / Т.М. Фицук (лекции 2.2; 2.3; 5; 6; 7; 8.2; 9; 10; 11; 12) ; С.С. Волчкова (лекция 13) ; Т.В. Лисичникова (лекции 1; 2.1; 3; 4; 8.1) ; С.М. Скобля (лекция 14) / Акад. М-ва внутрен. дел Респ. Беларусь. – Минск : Акад. МВД, 2010. – Т. 1. – 190 с.";2010;;;2015;
4;"Гражданский процесс : курс лекций : в 2 т. / Т.М. Фицук (лекция 17.1) ; С.С. Волчкова (лекции 15; 16; 17.2, 17.3; 20; 21; 26) ; Т.В. Лисичникова (лекция 25) ; Р.И. Филипчик (лекции 18; 19; 22; 23; 24) / Акад. М-ва внутрен. дел Респ. Беларусь. – Минск : Акад. МВД, 2010. – Т. 2. – 207 с.";2010;;;2016;
4;"Основы топографии в деятельности органов внутренних дел : курс лекций / А.В. Долидович, А.Н. Морозов ; М-во внутрен. дел Респ. Беларусь, Акад. МВД. – Минск : Акад. МВД Респ. Беларусь, 2008. – 122 с.";2008;;;2206;
4;"Правовая информатика : курс лекций / Н.А. Аникеева, Т.Г. Чудиловская ; М-во внутрен. дел Респ. Беларусь, Акад. МВД. – Минск : Акад. МВД Респ. Беларусь, 2006. – 145 с.";2006;;;2277;
4;"Юридическая статистика : конспект лекций / Н.М. Бобович ; М-во внутрен. дел Респ. Беларусь, Акад. МВД. – Минск : Акад. МВД Респ. Беларусь, 2006. – 60 с.";2006;;;2278;
4;"История исправительно-трудовых учреждений Беларуси : курс лекций / А.В. Шарков, В.Б. Шабанов, А.В. Вениосов [и др.]; М-во внутрен. дел Респ. Беларусь, Акад. МВД. – Минск : Акад. МВД Респ. Беларусь, 1999. – 223 с.";1999;;;2878;
4;"Правовое регулирование медико-социальной реабилитации хронических алкоголиков и наркоманов в Республике Беларусь : курс лекций / А.В. Шарков, В.Б. Шабанов, В.В. Трифонов, С.А. Кадушкин [и др.]. – Минск : Акад. МВД Респ. Беларусь, 2000. – 71 с.";2000;;;2879;
4;"Особенности предупреждения, выявления и пресечения правонарушений в органах и учреждениях уголовно-исполнительной системы : курс лекций. В 2 ч. / В.Б. Шабанов (лекции 16.1; 17.1;) ; С.В. Бородич (предусловие, лекции 3.1; 4.1; 4.2; 5.1; 6; 7.1; 10.2) ; А.А.Будкевич (лекции 3.2; 4.3; 5.2; 5.3; 7.3; 9.2; 10.3; 11.2; 12; 13; 15.3) ; Г.С. Соркин (лекции 8.4; 8.5; 8.6) ; под общ. ред. В.Б. Шабанова ; М-во внутр. дел. Респ. Беларусь, учреждение образования ""Акад. М-ва внутр. дел Респ. Беларусь"". – Минск : Акад. МВД, 2010. – Ч. 1. – 235 с.";2010;;;2894;
4;"Особенности предупреждения, выявления и пресечения правонарушений в органах и учреждениях уголовно-исполнительной системы : курс лекций. В 2 ч. / В.Б. Шабанов (лекции 1; 2; 7.2; 8.1; 8.3; 9.1; 10.1; 11.1; 14; 15.1) ; С.В. Бородич (предусловие, лекции 3.1; 4.1; 4.2; 5.1; 6; 7.1; 10.2) ; А.А.Будкевич (лекции 3.2; 4.3; 5.2; 5.3; 7.3; 9.2; 10.3; 11.2; 12; 13; 15.3) ; Г.С. Соркин (лекции 8.4; 8.5; 8.6) ; под общ. ред. В.Б. Шабанова ; М-во внутр. дел. Респ. Беларусь, учреждение образования ""Акад. М-ва внутр. дел Респ. Беларусь"". – Минск : Акад. МВД, 2010. – Ч. 2. – 227 с.";2010;;;2895;
4;"Педагогика высшей школы : курс лекций / И.А. Андарало ; М-во внутр. дел Респ. Беларусь, учреждение образования ""Акад. М-ва внутр. дел Респ. Беларусь"". – Минск : Акад. МВД, 2010. – 139 с.";2010;;;2899;
4;"Криминалистическое обеспечение предварительного расследования. Общая часть : курс лекций / А.П. Пацкевич ; М-во внутр. дел Респ. Беларусь, учреждение образования ""Акад. М-ва внутр. дел Респ. Беларусь"". – Минск : Акад. МВД, 2011. – 171 с.";2011;;;2902;1
4;"История органов внутренних дел Беларуси : курс лекций / А.Ф. Вишневский (предисловие, лекции 2, 3, 4), В.А. Данилов (лекции 7, 8), А.С. Жмуровский (лекции 1, 4, 10), С.Ф. Лапанович (лекция 6), А.А. Радоман (лекция 1), С.А. Семенова (лекция 3, 5), А.Н. Юшкевич (лекция 9) ; под ред. А.Ф. Вишневского ; М-во внутрен. дел Респ. Беларусь, учреждение образования «Акад. М-ва внутрен. дел Респ. Беларусь». – Минск : Акад. МВД, 2010. – 218 с.";2010;;;2943;
4;"Участие специалиста в следственных действиях : курс лекций / О.В. Маркова (введение, лекции 1, 2, 5-8); И.А. Анищенко (лекции 3, 4); М.В. Галезник (лекции 1, 2) ; под. общ. ред. О.В. Марковой ; М-во внутр. дел Респ. Беларусь, учреждение образования «Акад. МВД Респ. Беларусь». – Минск : Акад. МВД, 2010. – 111 с.";2010;;;3279;
4;"Общая теория государства и права : курс лекций / А.Ф. Вишневский. –  4-е изд., перераб. и доп. – Минск : Тесей, 2010. – 304 с.";2010;;;3323;
4;"Общая теория государства и права : курс лекций : [для студентов юридических вузов] / А.Ф. Вишневский. – 5-е изд., уточненное и доп. – Минск : Тесей, 2011. – 365, [1] с.";2011;;;3469;2
4;"Международное публичное право (особенная часть) : курс лекций / А.В. Гурин ; Акад. упр. при Президенте Респ. Беларусь. – Минск : Акад. упр. при Президенте Респ. Беларусь, 2010. – 176 с.";2010;;;3548;
4;"Криминалистическая тактика : курс лекций / Г.В. Фёдоров, В.Л. Григорович. – Минск : Тесей, 2011. – 176 с.";2011;;;3558;2
4;"Судебная бухгалтерия (включая бухгалтерский учет и аудит) : курс лекций / Н.Г. Цыпарков, И.В. Сауткин ; М-во внутр. дел Респ. Беларусь, учреждение образования «Акад. М-ва внутр. дел Респ. Беларусь». – Минск : Акад. МВД, 2011. – 242 с.";2011;;;3786;2
4;"Делопроизводство и режим секретности : курс лекций / Н.М. Бобович, П.Л. Боровик, А.П. Жалов ; М-во внутр. дел Респ. Беларусь, учреждение образования «Акад. М-ва внутр. дел Респ. Беларусь». – Минск : Акад. МВД, 2011. – 199 с.";2011;;;3805;2
4;"Экологическая деятельность органов внутренних дел : курс лекций / А.Н. Сапогин ; М-во внутр. дел Респ. Беларусь, учреждение образования ""Акад. М-ва внутр. дел Респ. Беларусь"". – Минск : Акад. МВД, 2011. – 87 с.";2011;;;3816;1
4;"Римское частное право : курс лекций / Д.А. Колбасин, Е.В. Лобатенко ; М-во внутр. дел Респ. Беларусь, учреждение образования «Акад. М-ва внутр. дел Респ. Беларусь». – Минск : Акад. МВД, 2011. – 206 с.";2011;;;3819;2
4;"Философия : курс лекций / Л.Е. Лойко ; М-во внутр. дел Респ. Беларусь, учреждение образования «Акад. М-ва внутр. дел Респ. Беларусь. – Минск : Акад. МВД, 2011. – 245 с.";2011;;;3891;2
4;"Организация управления уголовно-исполнительной системой : курс лекций / А.В. Шарков, В.И. Степаненко, А.И. Гладкевич ; М-во внутр. дел Респ. Беларусь, учреждение образования «Акад. М-ва внутр. дел Респ. Беларусь». – Минск : Акад. МВД, 2012. – 134 с.";2012;;;4272;1
4;"Финансовое право : курс лекций / А.А. Вишневский, И.В. Сауткин, С.М. Тихоненко ; под общ. ред. А.А. Вишневского ; М-во внутр. дел Респ. Беларусь, учреждение образования ""Акад. М-ва внутр. дел Респ. Беларусь"". – Минск : Акад. МВД, 2012. – 267 с.";2012;;;4362;1
4;"Правовое регулирование оперативно-розыскной деятельности таможенных органов : курс лекций / В.С. Гайдельцов ; Институт нац. безопасности. – Минск, 2012. – 77 с.";2012;;;4393;1
4;"Общие положения криминалистики и криминалистическая техника : курс лекций / В.Л. Григорович, Г.В. Фёдоров, И.И. Лузгин ; под ред. Г.В. Фёдорова. – Новополоцк : ПГУ, 2012. – 272 с.";2012;;;4425;1
4;"Криминология и профилактика преступлений. Общая часть : курс лекций / О.П. Колченогова, И.И. Куценков, Н.А. Легенченко, С.Ю. Часнок ; М-во внутр. дел Респ. Беларусь, учреждение образования «Акад. М-ва внутр. дел Респ. Беларусь». – Минск : Акад. МВД, 2012. – 231 с.";2012;;;4453;1
4;"Общая теория  государства и права : курс лекций / А.Ф. Вишневский. – 6-е изд. перераб. и доп. – Минск :Тесей, 2012. – 370 с.";2012;;;4530;1
4;"Международное публичное право : курс лекций / А.А. Подупейко, Н.И. Рудович [и др.]; под ред. А.А. Подупейко ; М-во внутр. дел Респ. Беларусь, учреждение образования «Акад. М-ва внутр. дел Респ. Беларусь». – Минск : Акад. МВД, 2012. – 398, [1] с.";2012;;;4833;2
4;"Судебная медицина : курс интенсивной подготовки / Ю.В. Кухарьков, А.О. Гусенцов, М.Ю. Кашинский. – Минск : ТетраСистемс, 2012. – 160 с.";2012;;;5026;2
4;"Теория судебной экспертизы : курс лекций / Е.Ю. Горошко, И.А. Анищенко ; М-во внутр. дел Респ. Беларусь, учреждение образования «Акад. М-ва внутр. дел Респ. Беларусь». – Минск : Акад. МВД, 2013. – 219 с.";2013;;;5078;1
4;"Основы охраны общественного порядка : курс лекций / И.В. Козелецкий, А.К. Ситко ; М-во внутр. дел Респ. Беларусь, учреждение образования «Акад. М-ва внутр. дел Респ. Беларусь». – Минск : Акад. МВД, 2013. – 147 с. (Гриф МВД Республики Беларусь)";2013;;;5551;2
4;"Краткий курс лекций по криминологии : Общая часть : учеб. пособие / В.А. Кашевский, Н.Ф. Ахраменка. – Минск : БНИП, 1996. – 102 с.";1996;;;5998;
4;"Правовая информатика : курс лекций / Н.А. Аникеева [и др.]; под общ. ред. А.Н. Лепёхина. – М-во внутр. дел Респ. Беларусь, учреждение образования «Акад. М-ва внутр. дел Респ. Беларусь». – Минск : Акад. МВД, 2013. – 207 с.";2013;;;6244;2
4;"Профилактика преступлений : курс лекций / О.П. Колченогова, Н.А. Легенченко ; учреждение образования «Акад. М-ва внутр. дел Респ. Беларусь». – Минск : Акад. МВД, 2014. – 106, [2] с. (Гриф МВД)";2014;;;6783;1
4;"Административная деятельность органов внутренних дел : курс лекций : в 2 ч. / А.А. Постникова; М-во внутр. дел Респ. Беларусь, учреждение образования «Акад. М-ва внутр. дел Респ. Беларусь». – Минск: Акад. МВД, 2014. – Ч. 2. – 234 с.";2014;;;7076;1
4;"Криминалистическая методика : курс лекций для студентов специальности 1-24 01 02 «Правоведение» / В.Л. Григорович, И.И. Лузгин; под ред. В.Л. Григоровича. – Новополоцк : ПГУ, 2014. – 292 с.";2014;;;7370;2
4;"Общая теория криминалистики и криминалистическая техника : курс лекций / В.Л. Григорович. – Минск : Тетралит, 2014. – 304 с.";2014;;;7371;2
4;"Введение в криминологию: лекции / В.А. Ананич ; учреждение образования ""Акад. М-ва внутр. дел Респ. Беларусь"". – Минск : Акад. МВД, 2014. – 159 с.";2014;;;7429;2
4;"Педагогика и психология высшей школы : курс лекций / И.А. Андарало ; М-во внутр. дел Респ. Беларусь, учреждение образования «Акад. М-ва внутр. дел Респ. Бела-русь». – Минск : Акад. МВД, 2013. – 123 с.";2013;;;7468;2
4;"Информатика и математика : курс лекций / Т.Г. Чудиловская ; учреждение образования «Акад. М-ва внутр. дел Респ. Беларусь». – Минск : Акад. МВД, 2015. – 235, [1] с.";2015;;;7720;1
4;"Психодиагностика : курс лекций : в 2 ч. / А. Н. Пастушеня [и др.]. – Рязань : Акад. ФСИН России, 2017. – Ч. 2. – 150 с.";2017;;;11349;2
4;"Психодиагностика. Психометрические основы психодиагностики : курс лекций / А. Н. Пастушеня [и др.]. – Рязань : Акад. ФСИН России, 2017. – 92 с.";2017;;;11350;2
