kind;outputdata;year;unused1;unused2;code;halfyear
10;"Психолого-педагогические технологии в образовательном процессе / В.Н. Кивайко, Ю.Р. Тихонов // Организация образовательного процесса : информ.-метод. сб. / М-во внутрен. дел Респ. Беларусь, Акад. МВД. – Минск : Акад. МВД Респ. Беларусь, 2010. – № 7. – С. 166-168.";2010;;;2011;
10;"Оптимизация и психологизация учебного процесса как условие эффективного развития цельной и мобильной личности для работы в органах внутренних дел / П.Д. Горбарук // Организация образовательного процесса : информ.-метод. сб. / М-во внутрен. дел Респ. Беларусь, Акад. МВД. – Минск : Акад. МВД Респ. Беларусь, 2010. – № 7. – С. 168-172";2010;;;2012;
10;"Следственные действия : лекция / П.В. Мытник ; Акад. М-ва внутрен. дел Респ. Беларусь, каф. уголов. процесса. – Минск : Акад. МВД, 2010. – 135 с.";2010;;;2013;
10;"Контроль знаний как показатель качества обучения / А.Я. Коховец // Организация образовательного процесса : информ.-метод. сб. / М-во внутрен. дел Респ. Беларусь, Акад. МВД. – Минск : Акад. МВД Респ. Беларусь, 2008. – № 4(2). – С. 130-132";2008;;;2074;
10;"Формы организации самостоятельной работы курсантов Академии МВД Республики Беларусь / Е.В. Котенко // Организация образовательного процесса : информ.-метод. сб. / М-во внутрен. дел Респ. Беларусь, Акад. МВД. – Минск : Акад. МВД Респ. Беларусь, 2008. – № 3(1). – С. 169-173";2008;;;2200;
10;"Рекомендации для самостоятельных занятий по силовой подготовке / Д.Н. Савич // Организация образовательного процесса : информ.-метод. сб. / М-во внутрен. дел Респ. Беларусь, Акад. МВД. – Минск : Акад. МВД Респ. Беларусь, 2008. – № 3(1). – С. 189-194";2008;;;2201;
10;"Авария на Чернобыльской АЭС и ее последствия для Республики Беларусь : лекция / А.В. Долидович ; М-во внутрен. дел Респ. Беларусь, Акад. МВД. – Минск : Акад. МВД Респ. Беларусь, 2008. – 28 с.";2008;;;2205;
10;"Профессионализм как компетентность / П.Д. Горбарук // Организация образовательного процесса : информ.-метод. сб. / М-во внутрен. дел Респ. Беларусь, Акад. МВД. – Вып. 6. – Минск : Акад. МВД Респ. Беларусь, 2006. – С. 57-61";2006;;;2208;
10;"Направления работы куратора (наставника) в современных условиях с курсантами Академии МВД (в копилку куратора) / И.А. Кибак // Организация образовательного процесса : информ.-метод. сб. / М-во внутрен. дел Респ. Беларусь, Акад. МВД. – Минск : Акад. МВД Респ. Беларусь, 2006. – Вып. 6. – С. 12-36";2006;;;2209;
10;"Педагогическая самооценка преподавателя вуза / В.Л. Голубев // Организация образовательного процесса : информ.-метод. сб. / М-во внутрен. дел Респ. Беларусь, Акад. МВД. – Минск : Акад. МВД Респ. Беларусь, 2007. – № 1(1). – С. 107-111";2007;;;2232;
10;"О некоторых результатах и перспективах входного компьютерного тестирования по информатике курсантов Академии МВД / Н.М. Бобович, Е.П. Синькова // Организация образовательного процесса : информ.-метод. сб. / М-во внутрен. дел Респ. Беларусь, Акад. МВД. – Минск : Акад. МВД Респ. Беларусь, 2007. – № 2(2). – С. 47-51";2007;;;2233;
10;"Внеаудиторные практические занятия как элемент повышения эффективности учебного процесса / О.П. Колченогова, И.И. Куценков // Организация образовательного процесса : информ.-метод. сб. / М-во внутрен. дел Респ. Беларусь, Акад. МВД. – Минск : Акад. МВД Респ. Беларусь, 2007. – № 2(2). – С. 61-62";2007;;;2234;
10;"Методика подготовки педагогических заданий и оценивания учебных достижений курсантов и слушателей Академии МВД Республики Беларусь / А.И. Авраменко, А.Я. Коховец // Организация образовательного процесса : информ.-метод. сб. / М-во внутрен. дел Респ. Беларусь, Акад. МВД. – Вып. 5. – Минск : Акад. МВД Респ. Беларусь, 2006. – С. 76-84";2006;;;2235;
10;"Кафедральный конфликт : способы разрешения / В.Л. Голубев // Организация образовательного процесса : информ.-метод. сб. / М-во внутрен. дел Респ. Беларусь, Акад. МВД. – Вып. 5. – Минск : Акад. МВД Респ. Беларусь, 2006. – С. 85-93";2006;;;2236;
10;"Педагогика высшей школы на марше ХХІ в. / П.Д. Горбарук // Организация образовательного процесса : информ.-метод. сб. / М-во внутрен. дел Респ. Беларусь, Акад. МВД. – Вып. 5. – Минск : Акад. МВД Респ. Беларусь, 2006. – С. 94-101";2006;;;2237;
10;"Информационные технологии в цикле неинформационных дисциплин / В.П. Шибут // Организация образовательного процесса : информ.-метод. сб. / М-во внутрен. дел Респ. Беларусь, Акад. МВД. – Вып. 5. – Минск : Акад. МВД Респ. Беларусь, 2006. – С. 116-125";2006;;;2238;
10;"Использование специальных знаний в раскрытии и расследовании преступлений. Тактика назначения и проведения судебной экспертизы: лекция / В.К. Кирвель ; М-во внутрен. дел Респ. Беларусь,  учреждение образования ""Акад. М-ва внутрен. дел Респ. Беларусь"". – Минск : Акад. МВД, 2010. – 40 с.";2010;;;2956;
10;"Шэдэўры літаратурнай спадчыны Беларусі [Электронны рэсурс] / склад.: І.І. Зайцаў, В.П. Русак, А.А. Суша ; Нацыянальная бібліятэка Беларусі, 2007. – 1 электрон. апт. дыск (CD-ROM). (Навуковае суправаджэнне: Галенчанка Г.Я., Мароз В.К. (Мороз В.К.), Мархель У.І., Чамярыцкі В.А.)";2007;;;2979;
10;"[Рэцэнзiя] / В.К. Мароз (В.К. Мороз) // З беларуска-ўкраінскіх кантактаў // Весці Нацыянальнай акадэміі навук Беларусі Известия Национальной академии наук Беларуси Procedings of National academy of sciences of the Republic of Belarus. Сер. гуманітарных навук. – Мінск : Беларус. навука, 2009. – № 2. – С. 121-122. – Рец. на : Півторак, Г. П. Білорусько-український словник / Г.П. Півторак,  О.Ї. Скопненко; За ред. Г. П. Півторака. – К.: Довіра, 2006. – 723 с.";2006;;;3009;
10;"Производство предварительного следствия и дознания по уголовным делам о преступлениях против жизни и здоровья : лекция / Ю.М. Юбко ; М-во внутр. дел Респ. Беларусь, учреждение образования ""Акад. М-ва внутр. дел Респ. Беларусь"". – Минск : Акад МВД, 2010. – 39 с.";2010;;;3028;
10;"Юстиция зарубежных государств : лекция / С.В. Рыбак ; М-во внутр. дел Респ. Беларусь, учреждение образования ""Акад. М-ва внутр. дел Респ. Беларусь"". – Минск : Акад МВД, 2011. – 31 с.";2011;;;3029;1
10;"Экология: важная сфера ответственности / Н.Г. Цыпарков // На страже. – 2010. – 2 июля. – С. 18.";2010;;;3136;
10;"Обязательства вследствие причинения вреда : лекция / Н.Н. Ермолкевич ; М-во внутр. дел Респ. Беларусь, учреждение образования ""Акад. М-ва внутр. дел Респ. Беларусь"". – Минск : Акад. МВД, 2011. – 47 с.";2011;;;3377;1
10;"История становления и развития криминалистики. Дискуссионные вопросы определения предмета и системы криминалистики : лекция / Г.Н. Мухин ; М-во внутр. дел Респ. Беларусь, учреждение образования «Акад. М-ва внутр. дел Респ. Беларусь». – Минск : Акад. МВД, 2011. –  67 с.";2011;;;3378;1
10;"Административно-правовое принуждение как средство борьбы с совершением административных правонарушений. Административная ответственность : лекция / А.И. Сухаркова ; М-во внутр. дел Респ. Беларусь, учреждение образования ""Акад. М-ва внутр. дел Респ. Беларусь"". – Минск : Акад. МВД, 2011. – 147 с.";2011;;;3435;1
10;"Особенности расследования уголовных дел о безвестном исчезновении граждан : лекция / Н.И. Лагун ; М-во внутрен. дел Респ. Беларусь, учреждение образования «Акад. М-ва внутрен. дел Респ. Беларусь». – Минск : Акад. МВД, 2010. – 59 с.";2010;;;3466;
10;"Органы внутренних дел Беларуси в Великой Отечественной войне 1941-1945 гг. / А.В. Шарков ; Респ. гос. обществ. объединение ""Белорус. об-во ""Знание"". – Минск : РИВШ, 2009. – 35 с.";2009;;;3606;
10;"История о подделке Российских асегнаций Наполеоном в ходе войны 1812 г. / А.С. Жмуровский // Милиция Беларуси : правовой литер.-публиц. журн. / МВД Респ. Беларусь. – 2011. – № 3.– С. 120-130";2011;;;3618;1
10;"Уголовный процесс: Судебные стадии: лекции / П.В. Мытник. – Минск : Тесей, 2001. – 288 с.";2001;;;3716;
10;"Академия : международная деятельность : сб. материалов / В.В. Бачила, А.А. Подупейко, А.А. Кравченко ; М-во внутр. дел Респ. Беларусь, учреждение образования «Акад. М-ва внутр. дел Респ. Беларусь». – Минск : Акад. МВД, 2011. – 104 с.";2011;;;3811;2
10;"Академия : международная деятельность : сб. материалов / В.В. Бачила, А.А. Подупейко, А.А. Кравченко ; М-во внутр. дел Респ. Беларусь, Акад. МВД. – Минск : Акад. МВД Респ. Беларусь, 2011. – Вып. 2. – 136 с.";2011;;;3812;2
10;"Социально ориентированная рыночная экономика Республики Беларусь в условиях глобализации : лекция / И.Н. Бобкова ; М-во внутр. дел Респ. Беларусь, учреждение образования «Акад. М-ва внутр. дел Респ. Беларусь». – Минск : Акад. МВД, 2011. – 28 с.";2011;;;3820;1
10;"Организация расследования хищений, совершаемых путем злоупотребления служебными полномочиями, присвоения и растраты : лекция / А.А. Климов, Е.И. Климова ; М-во внутр. дел Респ. Беларусь, учреждение образования «Акад. М-ва внутр. дел Респ. Беларусь». – Минск : Акад. МВД, 2011. – 55 с.";2011;;;3889;2
10;"Действовали грамотно, задачи выполнили успешно / В.А. Ананич // 25 годовщина аварии на ЧАЭС. Специальный выпуск. – Минск : Акад. МВД Респ. Беларусь, 2011. – С. 18-22";2011;;;4032;1
10;"«Фальшивая» интервенция императора / А.С. Жмуровский // Милиция Беларуси : правовой литер.-публиц. журн. / МВД Респ. Беларусь – 2011. – № 3. – С. 48-49";2011;;;4057;1
10;"Квалификационные требования к должностным категориям руководящего состава органов внутренних дел : в 2 ч. / С.В. Добриян, Р.А. Середа, Д.В. Гвоздев, А.И. Федорако, И.Л. Федчук ; М-во внутр. дел Респ. Беларусь, учреждение образования «Акад М-ва внутр. дел Респ. Беларусь». – Минск : Акад. МВД, 2011. – 875 с.";2011;;;4070;2
10;"Оперативный эксперимент по делам о взяточничестве : дис. … канд. юрид. наук : 12.00.09  ; защ. 21.01.11 : утв. 27.04.11 / В.Н. Крюков ; науч. рук. В.П. Шиенок  ; Учреждение образования ""Акад. М-ва внутр. дел Респ. Беларусь"". – Минск, 2010. – 145 л.";2010;;;4261;
10;"Реализация криминологического прогнозирования в предупреждении преступности : дис. … канд. юрид. наук : 12.00.08 ; защ. 21.04.11 ; утв. 22.06.11 / Н.А. Аникеева ; науч. рук. В.А. Ананич ; Учреждение образования ""Акад. М-ва внутр. дел Респ. Беларусь"". – Минск, 2011. – 170, [1]  л.";2011;;;4263;1
10;"Криминалистическая фотография и видеозапись : лекция / В.К. Кирвель ; М-во внутр. дел Респ. Беларусь, учреждение образования «Акад. М-ва внутр. дел Респ. Беларусь». – Минск : Акад. МВД, 2012. – 35 с.";2012;;;4273;1
10;"Международная правовая помощь по уголовным делам : лекция / И.В. Данько, Ю.П. Шкаплеров ; М-во внутр. дел Респ. Беларусь, учреждение образования ""Могилев. высш. колледж М-ва внутр. дел Респ. Беларусь"". – Минск : Акад. МВД, 2011. – 47, [1] с.";2011;;;4275;2
10;"Ускоренное производство : лекция / И.В. Данько, О.В. Рожко ; М-во внутр. дел Респ. Беларусь, учреждение образования ""Акад. М-ва внутр. дел Респ. Беларусь"". – Минск : Акад. МВД 2012. – 30 с.";2012;;;4459;1
10;"Статус и предназначение философии в жизни общества : лекция / Л.Е. Лойко ; М-во внутр. дел Респ. Беларусь, учреждение образования «Акад. М-ва внутр. дел Респ. Беларусь» ; ред. кол.: А.Л. Савенок (отв. ред.) [и др.]. – Минск : Акад. МВД, 2012. – 95 с.";2012;;;4617;2
10;"Организация образовательного процесса с использованием электронных учебно-методических комплексов / А.А. Сёмин // Актуальные проблемы юридического образования : тез. докл. Междунар. науч.-метод. конф. (Минск, 1 нояб. 2012 г.) / М-во внутр. дел Респ. Беларусь, учреждение образования «Акад. М-ва внутр. дел Респ. Беларусь» ; ред. кол.: А.Л. Савенок (отв. ред.) [и др.]. – Минск : Акад. МВД, 2012. – С. 154-156";2012;;;4624;2
10;"Правовые и организационные основы участия специалиста в производстве следственных действий : лекция / В.П. Егоров ; М-во внутр. дел Респ. Беларусь, учреждение образования «Акад. М-ва внутр. дел Респ. Беларусь». – Минск : Акад. МВД, 2012. – 30 с.";2012;;;4634;1
10;"Основы компьютерно-технической экспертизы : лекция / Е.Ю. Грошко ; М-во внутр. дел Респ. Беларусь, учреждение образования «Акад. М-ва внутр. дел Респ. Беларусь». – Минск : Акад. МВД, 2012. – 23 с.";2012;;;4636;1
10;"Уголовно-процессуальное право : лекция / И.В. Данько ; М-во внутр. Дел Респ. Беларусь, учреждение образования «Акад. М-ва внутр. дел Респ. Беларусь». – Минск : Акад. МВД, 2012. – 43 с.";2012;;;4637;1
10;"Методы аналитической химии в криминалистической экспертизе : лекция / Г.А. Мельникова ; М-во внутр. дел Респ. Беларусь, учреждение образования «Акад. М-ва внутр. дел Респ. Беларусь». – Минск : Акад. МВД, 2012. – 47 с.";2012;;;4640;1
10;"Предисловие к книге / А.В. Шарков  // ОУН-УПА в Беларуси. 1939-1953 гг. : докум. и материалы. – 2-е изд. / сост. В.И.Адамушко [и др.]. – Мінск : Вышэйшая школа, 2012. – С. 3-10";2012;;;4951;2
10;"Интервью: Как женщины убивают мужчин / С.М. Свило // Салiдарнасць. – 2012. – 11 мая. – № 19/506. – С. 16";2012;;;4981;1
10;"Зарплата «в конверте» – 2. За барьером коллизий / А.И. Лукашов // Экономическая газета. – 2012. – 18 мая. –  № 36 . – С. 3-4";2012;;;4982;1
10;"«Штрафные удары» отбивать все сложнее. Политика установления и применения административных штрафных санкций требует корректировки / А.И. Лукашов  // Белорусы и рынок. – 2012. – 24 мая. – № 20. – С. 19";2012;;;4983;1
10;"Неподтвержденная обязанность / А.И.Лукашов // Белорусы и рынок. – 2012. – 29 июля. – № 27. – С. 1";2012;;;4985;2
10;"Поручение выполнено. Вопросы остаются / А.И. Лукашов // Белорусы и рынок. –  2012. – 10 нояб. –  № 33. – С. 19";2012;;;4986;2
10;"Конституционное право и другие дисциплины: проблема повтора учебного материала / Л.В. Саленик // Организация образовательного процесса : информ.-метод. сб. ; М-во внутр. дел Респ. Беларусь, учреждение образования «Акад. М-ва внутр. дел Респ. Беларусь». – Минск : Акад. МВД, 2013. – № 9. – С. 84-87";2013;;;5245;1
10;"Ходатайства и жалобы в уголовном процессе : лекция / И.В. Данько, Ю.С. Климович ; М-во внутр. дел Респ. Беларусь, учреждение образования ""Акад. М-ва внутр. дел Респ. Беларусь"". – Минск : Акад. МВД, 2013. – 28 с.";2013;;;5247;1
10;"Взыскание дохода в бюджет: расходы и налоги вычитаем / А.И. Лукашов // Экономическая газета. – 2013. – 19 февраля. – № 13. – С. 23";2013;;;5401;1
10;"Родители в ответе за детей / А.И. Лукашов // На страже. – 2013. – 25 апреля. – № 21. – С. 7";2013;;;5407;1
10;"Двойное правонарушение / А.И. Лукашов // На страже. – 2013. – 25 апреля. – № 21. – С. 7";2013;;;5408;1
10;"Правовые акты управления в механизме административно-правового регулирования общественных отношений : лекция. / А.А. Абдурахманов ; М-во внутр. дел Рос. Федерации, гос. учреждение «Всерос. науч.-исслед. ин-т». – М.: ВНИИ МВД России, 2006. – 39 с.";2006;;;5486;1
10;"Производство по возмещению вреда, причиненного незаконными действиями органа, ведущего уголовный процесс : лекция / О. В. Рожко, В. П. Ашитко; М-во внутр. дел Респ. Беларусь, учреждение образования ""Акад. М-ва внутр. дел Респ. Беларусь"". – Минск : Акад. МВД, 2013. – 38, [1] с.";2013;;;5569;1
10;"Использование метода ролевой игры при проведении практических и семинарских занятий / Е.В. Лексина // Организация образовательного процесса : информ.-метод. сб. / М-во внутрен. дел Респ. Беларусь, Акад. МВД. – Минск : Акад. МВД Респ. Беларусь, 2008. – № 3(1). – С. 177-182";2008;;;5744;
10;"Методические указания по содержанию и порядку оформления основных видов учебно-методических материалов по дисциплине / Е.В. Котенко // Организация образовательного процесса : информ.-метод. сб. / М-во внутрен. дел Респ. Беларусь, Акад. МВД. – Минск : Акад. МВД Респ. Беларусь, 2008. – № 3(1). – С. 20-109";2008;;;5761;
10;"Особенности актуализации опорных знаний на практическом занятии / С.М. Казакевич // Организация образовательного процесса : информ.-метод. сб. / М-во внутрен. дел Респ. Беларусь, Акад. МВД. – Минск : Акад. МВД Респ. Беларусь, 2008. – № 3(1). – С. 166-169";2008;;;5843;
