kind;outputdata;year;unused1;unused2;code;halfyear
14;"Теоретико-правовая идентификация суверенитета в системе права и законодательства / А.В. Шавцова // Право и демократия : сб. науч. тр. / Белорус. гос. ун-т; редкол. : В.Н. Бибило (гл. ред.) [и др.]. – Минск : БГУ, 2013. – Вып. 24. – 2013. – С.103-123";2013;;;6361;2
14;"Биомеханические особенности формирования подготовительных к отталкиванию шагов разбега прыгуньями в длину различной квалификации / Э.П. Позюбанов., Н.Б. Сотский, М.М. Макась, И.А. Костенко // Вісник  Чернiгівського національного педагогічного універсітету ім. Т.Г. Шевченка. – Сер.: Пед. науки. – Чернiгiв, 2013. – Вип. 112. – Т. 1. – С. 261-266";2013;;;6369;2
14;"Реформирование стадии возбуждения уголовного дела: теоретические рассуждения или назревшая необходимость? / С.В. Рыбак, О.Г. Каразей // Законность и правопорядок : науч.-практ. журн. / Ген. прокуратура Респ. Беларусь. – Минск, 2013. – № 4. – С. 35-40";2013;;;6372;2
14;"Природа и перспективы развития следственной функции в уголовном процессе / Ю.С. Климович // Законность и правопорядок : науч.-практ. журн. / Ген. прокуратура Респ. Беларусь. – Минск, 2013. – № 4. – С. 52-56";2013;;;6373;2
14;"Проблемы реализации меры пресечения «отдача несовершеннолетнего под присмотр / М.М. Якубель // Вопросы криминологии, криминалистики и судебной экспертизы : сб. науч. тр. / ГУ «Науч.-практ. центр Гос. комитета судеб. экспертиз Респ. Беларусь» ; редкол.: А.В. Дулов (гл. ред.) [и др.]. – Минск : Право и экономика, 2013. – № 2(34). – С. 33-37";2013;;;6374;2
14;"Теоретико-прикладные аспекты определения вредных последствий от осуществления лжепредпринимательства / С.В. Валежанин // Законность и правопорядок : науч.-практ. журн. / Ген. прокуратура Респ. Беларусь. – Минск, 2013. – № 3(27). – С. 58-62";2013;;;6381;2
14;"Типичные оперативно-розыскные и следственные ситуации первоначального этапа расследования криминальных взрывов / А.В. Яскевич, И.В. Пашута // Вестник Академии МВД Республики Беларусь : науч.-практ. журн. – Минск, 2013. – № 1с(6). – С. 46-50";2013;;;6385;1
14;"Умышленное причинение тяжкого телесного повреждения, совершенное повторно либо в отношении двух или более лиц: вопросы квалификации / Т.Г. Терещенко // Веснік Магілёўскага дзяржаўнага унiверсiтэта імя А.А. Куляшова : навук. и метад. часоп. – Сер. Д. Эканоміка, Сацыялогія. Права. – Могилев, 2013. – № 1(41). – С. 53-61";2013;;;6394;2
14;"Психическое расстройство (заболевание) как признак тяжкого телесного повреждения / Т.Г. Терещенко // Веснік Гродзенскага дзяржаўнага універсітэта імя Янкі Купалы : навук.-тэарэт. часоп. – Серыя 4 : Правазнаўства. – Гродна, 2013. –- № 2(150). – С. 92-97";2013;;;6395;1
14;"Неизгладимое обезображение лица или шеи как признак тяжкого телесного повреждения / Т.Г. Терещенко // Веснік Гродзенскага дзяржаўнага універсітэта імя Янкі Купалы : навук.-тэарэт. часоп. – Серыя 4 : Правазнаўства. – Гродна, 2013. –- №1(146). – С. 48-53";2013;;;6396;1
14;"Определение беспомощного состояния потерпевшего как квалифицирующего признака умышленного причинения тяжкого телесного повреждения / Т.Г. Терещенко // Законность и правопорядок : науч.-практ. журн. / Ген. прокуратура Респ. Беларусь. – Минск, 2013. – № 1. – С. 50-56";2013;;;6397;1
14;"Виктимологическая профилактика умышленного причинения тяжких телесных повреждений / Т.Г. Терещенко // Вопросы криминологии, криминалистики и судебной экспертизы : сб. науч. тр. / ГУ «Науч.-практ. центр Гос. комитета судеб. экспертиз Респ. Беларусь» ; редкол.: А.В. Дулов (гл. ред.) [и др.]. – Минск : Право и экономика, 2013. – № 1(33). – С. 37-40";2013;;;6398;1
14;"Опасность для жизни как признак умышленного причинения тяжкого телесного повреждения / Т.Г. Терещенко // Вестник Полоцкого государственного университета = Веснік Полацкага дзяржаўнага універсітэта : науч.-теорет. ежемес. журн. – Серия D: Экономические и юридические науки = Серыя D: Эканамічныя і юрыдычныя навукі. – Новополоцк : ПГУ, 2013. – № 5 – С. 51-56";2013;;;6399;2
14;"Объект умышленного причинения тяжкого телесного повреждения / Т.Г. Терещенко // Известия Гомельского государственного университета имени Ф. Скорины: науч. и произв.-практ. журн. – Гомель, 2013. – № 2(77). – С. 161-166";2013;;;6400;1
14;"Социальный механизм профессиональной адаптации в системе подготовки кадров для силовых структур Республики Беларусь / Е.Н. Мисун // Гуманитарно-экономический вестник: науч.-теорет. журн. / Междунар. гуманитарно-экономический ин-т. – Минск, 2013. – № 2 – С. 64-71";2013;;;6404;1
14;"Антикриминальная устойчивость личности: структурно содержательный аспект / А.Н. Пастушеня // Прикладная юридическая психология : психология профессиональной среды : реценз. науч. журн. / Акад. ФСИН России, Высшая школа психологии. – Рязань, 2013. – № 2. – С. 52-59";2013;;;6416;1
14;"Законодательная техника в законотворческой деятельности / И.А. Кибак // Вестник Московского университета МВД России : реценз. науч. журн. / Моск. ун-т МВД России. – М., 2013. – № 1. – С. 214-222";2013;;;6417;1
14;"Организация и методика парламентского психологического сопровождения депутатов / И.А. Кибак // Психопедагогика в правоохранительных органах : реценз. науч. журн. / Омская акад. МВД России. – Омск, 2013. – № 1(52). – С.13-16";2013;;;6418;1
14;"Инновационные предложения и формирование позитивного мнения о работе законодательного органа в общественном сознании / И.А. Кибак // Вестник Российской правовой академии : науч.-практ. журн. / Рос. правовая акад. Минюста России. – М., 2013. – № 1. – С. 10-14";2013;;;6419;1
14;"Законотворческая деятельность в Республике Беларусь: изучение общественного мнения / И.А. Кибак // Адукацыя і выхаванне : навук.-тэарэт. і навук.-метад. часоп. / Изд-во «Адукацыя і выхаванне». – Минск, 2013. – № 3 . – С. 3-7";2013;;;6420;1
14;"Психологическая культура как основа повышения эффективности  законотворческой деятельности / И.А. Кибак // Право.by : науч.-практ. журн. / Нац. центр правовой информ. Респ. Беларусь. – Минск, 2013. – № 2(22). – C. 112-117";2013;;;6421;1
14;"Формирование общественного мнения о депутатском коллективе / И.А. Кибак // Юристъ-правоведъ: журн. / Ростовский юрид. ин-т МВД России. – Ростов, 2013. – № 1(56). – С. 19-24";2013;;;6422;1
14;"Использование в законотворческой деятельности результатов изучения общественного мнения / И.А. Кибак // Труды Академии управления МВД России : реценз. науч.-практ. журн. / Акад. упр. МВД России. – М., 2013. – № 3(27). – С. 17-21";2013;;;6423;1
14;"Использование социолога в качестве специалиста и консультанта в законотворческом процессе / И.А. Кибак // Психопедагогика в правоохранительных органах : реценз. науч. журн. / Омская акад. МВД России. – Омск, 2013. – № 4(55). – С. 18-24";2013;;;6424;2
14;"Мониторинговая оценка законопроекта / И.А. Кибак // Вестник БГУ : науч.-теорет. журн. Белорус. гос. ун-та. – Серия III : История. Философия. Психология. Политология. Социология. Экономика. Право. – Минск, 2013. – № 2. – С. 62-65";2013;;;6425;1
14;"Общественное мнение как критерий оценки эффективности законотворческой деятельности / И.А. Кибак // Веснік Гродзенскага дзяржаўнага універсітэта імя Янкі Купалы : навук.-тэарэт. часоп. – Серыя 5 : Эканоміка. Сацыялогія. Біялогія. – Гродна, 2013. –- № 2(156). – С. 14-19";2013;;;6426;1
14;"Участие социолога в проведении научно-практической экспертизы законопроекта (экспертиза законопроекта с участием социолога) / И.А. Кибак // Вісник Національного університету оборони України : зб. наук. пр. / Нац. ун-т оборони України. – Київ, 2013. – № 5(36). – С. 341-347";2013;;;6427;2
14;"Основные принципы парламентского психологического сопровождения депутатов / И.А. Кибак // Юридическая наука и практика: Вестник Нижегородской академии МВД России : реценз. науч. журн. / Нижегородская акад. МВД России. – Н. Новгород, 2013. – № 21. – С. 86-91";2013;;;6433;1
14;"Современные аспекты габитоскопии / А.В. Дроздов // Вопросы криминологии, криминалистики и судебной экспертизы : сб. науч. тр. / ГУ «Науч.-практ. центр Гос. комитета судеб. экспертиз Респ. Беларусь» ; редкол.: А.В. Дулов (гл. ред.) [и др.]. – Минск : Право и экономика, 2013. – Вып. 1(33). – С. 88-93";2013;;;6465;1
14;"Понятие и структура административно-правовых режимов Республики Беларусь / В.Ф. Ермолович // Сацыяльна-эканамічныя і прававыя даследаванні : навук.-практ. і інфарм.-метадыч. часоп. / Прыватная ўстанова адукацыі «БІП – Інстытут правазнаўства». – Минск, 2013. – № 1 (27). – С. 67-77";2013;;;6466;1
14;"Специальная комплексная проверка Комитета государственного контроля Республики Беларусь деятельности юридического лица, индивидуального предпринимателя / В.Ф. Ермолович, А.В. Денисевич // Проблемы управления : науч.-практ. журн. / Акад. упр. при Президенте Респ. Беларусь. – Минск, 2013. – № 1 (45). – С. 52-61";2013;;;6467;1
14;"Система типовых следственных ситуаций, возникающих по уголовным делам о преступлениях транснационального характера / О.В. Маркова, А.И. Куликовская // Право.by : науч.-практ. журн. / Нац. центр правовой информ. Респ. Беларусь. – Минск, 2013. – № 2. – С. 70-76";2013;;;6468;1
14;"К вопросу о сущности поисково-познавательной деятельности в расследовании преступлений / О.В. Маркова, В.В. Кулакевич // Труды Института национальной безопасности Республики Беларусь : сб. науч. тр. – Минск, 2013. – № 34. – С. 3-11";2013;;;6469;1
14;"Развитие правовых взглядов на понятие и содержание криминалистического обеспечения расследования преступлений / А.В. Дроздов // Кріминалістичный вісник : наук.-практ. зб. / ДНДЕКЦ МВД Украины ; НАВС ; редкол.: В.В. Коваленко (галов. ред.) [та ін.]. – Київ, 2013. – № 1 (19). – С. 63-70";2013;;;6486;1
14;"Динамика состояния нервно-мышечного аппарата спортсменов под влиянием вибрационных упражнений / Н.А. Михеев // Научные труды НИИ физической культуры и спорта Республики Беларусь : сб. науч. тр. / М-во спорта и туризма Респ. Беларусь ; НИИ ФКиС Респ. Беларусь ; редкол.: А.А. Михеев (гл. ред.) [и др.]. – Вып. 12. – Минск, 2013. – С. 72-79";2013;;;6488;2
14;"Оценка психологического состояния лиц, содержащихся под стражей, с кардиологической патологией / Е.В. Лемешко // Лечебное дело : науч.-практ. журн. – Минск, 2013. – № 1 (29). – С. 56-59";2013;;;6492;1
14;"Голографические средства в собирании и исследовании доказательств / В.Л. Григорович //  Вестник Полоцкого государственного университета = Веснік Полацкага дзяржаўнага універсітэта : науч.-теорет. ежемес. журн. – Серия D: Экономические и юридические науки = Серыя D: Эканамічныя і юрыдычныя навукі. – Новополоцк : ПГУ, 2013. – № 6. – С. 206-211";2013;;;6505;1
14;"Применение мер по обеспечению безопасности к лицам, которые сотрудничают с органами, осуществляющими оперативно-розыскную деятельность (по законодательству Республики Беларусь) / В.М. Логвин, Ю.А. Матвейчик // Международное уголовное право и международная юстиция : науч.-практ. и информ. журн. / МГИМО. – М., 2013. – № 4. – С. 23-25";2013;;;6506;1
14;"Основные этапы генезиса высшего педагогического образования Украины в постсоветский период (1990–2010 гг.) / М.А. Бутько (М.А. Андарало) // Весці БДПУ : навук.-метад. часоп. / Беларус. дзярж. пед.ун-т ім. Максіма Танка. – Сер. 1. Педагогіка. Псіхалогія. Філалогія. – 2013. – № 1. – С. 16-20";2013;;;6535;1
14;"Международно-правовые меры борьбы с торговлей женщинами на рубеже XIX–XX вв. / Н.И. Ретнёва // Вестник Академии МВД Респ. Беларусь : науч.-теорет. журн. – Минск, 2003. – № 2. – С. 51-53";2003;;;6709;
14;"Торговля людьми: имплементация международно-правовых норм в национальное законодательство / Н.И. Ретнёва // Веснік Канстытуцыйнага Суда Рэспублікі Беларусь Вестник Конституционного Суда Республики Беларусь = Bulletin of the Constitutional Courf of the Republic of Belarus / Конст. Суд Респ. Беларусь. – Минск, 2004. – № 3. – С. 106–112";2004;;;6710;
14;"Уголовно-правовой компромисс в деятельности правоохранительных органов зарубежных государств / А.А. Сёмин // Вопросы криминологии, криминалистики и судебной экспертизы : сб. науч. тр. / Науч.-исслед. ин-т проблем криминологии, криминалистики и судеб. экспертизы М-ва юстиции Респ. Беларусь. – Минск, 1999. – № 14. – С. 241-242";1999;;;6724;
14;"Развитие идей компромисса в отечественных уголовно-правовой науке и законодательстве / А.А. Сёмин // Вестник Академии МВД Республики Беларусь : науч.-теорет. журн. – Минск, 2001. – № 1(1). – С.158-160";2001;;;6728;
14;"О социальной и правовой природе норм уголовного законодательства, предполагающих компромисс / А.А. Сёмин // Вестник Полоцкого государственного университета = Веснік Полацкага дзяржаўнага універсітэта : науч.-теорет. ежемес. журн. – Серия D: Экономические и юридические науки = Серыя D: Эканамічныя і юрыдычныя навукі. – Полоцк, 2006. – № 8. – С. 226-230";2006;;;6736;
14;"О правовой природе и значении уголовно-правовых норм, предполагающих компромисс / А.А. Сёмин // Известия Гомельского государственного университета имени Ф. Скорины: науч. и произв.-практ. журн. – Гомель, 2006. – № 5. – С. 177-183";2006;;;6737;
14;"Особенности социально-экономических детерминант женской преступности в Республике Беларусь / С.М. Свило // Вестник Академии МВД Республики Беларусь : науч.-практ. журн. – Минск, 2005. – № 2(10). – С. 137-142";2005;;;6746;
14;"Возникновение и развитие теоретических взглядов на проблему женской преступности / С.М. Свило // Научные труды Академии управления при Президенте Республики Беларусь : сб. науч. ст. / Акад. упр. при Президенте Респ. Беларусь. – Минск, 2006. – Вып. 8. – С. 435-444";2006;;;6752;
14;"О применении нового Трудового кодекса Республики Беларусь к трудовым отношениям отдельных категорий работников / А.А. Греченков  // Вестник Академии МВД Республики Беларусь. – 2001. – № 1. – С. 150–152";2001;;;6773;
14;"Отзыв официального оппонента на диссертацию Андрея Петровича Скибы на тему «Исполнение уголовных наказаний в отношении больных осужденных: теоретико-прикладное исследование» на соискание ученой степени доктора юридических наук по специальности 12.00.08 – уголовное право и криминология; уголовно-исполнительное право / В.Б. Шабанов // Юрист Юга России и Закавказья : науч.-практ. журн. / Акад. права и управления ФСИН России, Донской юрид. ин-т. – Ростов-на-Дону, 2013. – № 2–3 (3–4). – С. 57-63";2013;;;6786;2
14;"Особенности проведения в Республике Беларусь оперативно-розыскного мероприятия «слуховой контроль» / В.В. Бачила // Оперативник (сыщик) : Всеросс. период. вневедомств. науч.-практ. и информ. изд. / гл. ред. А. Шумилов. – Москва, 2010. – № 4 (25). – С. 51–56.";2010;;;6826;2
14;"Современное состояние и пути совершенствования образовательного процесса в Академии МВД Республики Беларусь / В.В. Бачила, О.З. Рыбаключева // Вестник Академии МВД Республики Беларусь : науч.-практ. журн. – Минск, 2014. – № 1(27). – С. 5-13";2014;;;6827;1
14;"Системы подготовки полицейских кадров / В.В. Бачила // Вестник Академии МВД Республики Беларусь : науч.-практ. журн. – Минск, 2014. – № 1(27). – С. 190-193";2014;;;6828;1
14;"Оценка достоверности судебных экспертиз и создание системы судебно-экспертного обеспечения правоприменительной деятельности / А.С. Рубис // Законность и правопорядок : науч.-практ. журн. / Ген. Прокуратура Респ. Беларусь. – 2014. – № 1 (29). – С. 36-41";2014;;;6835;1
14;"О проблемах правового регулирования субъектов оперативно-розыскной деятельности / В.Ч. Родевич, Л.И. Родевич // Вестник Академии МВД Республики Беларусь : науч.-практ. журн. – Минск, 2014. – № 1(27). – С. 60-63";2014;;;6852;1
