kind;outputdata;year;unused1;unused2;code;halfyear
6;"Уголовное право Республики Беларусь. Общая часть : учеб.-метод. пособие / В.Ф. Ермолович, В.Б. Шабанов. – Минск : Междунар. ун-т «МИТСО», 2013. – 144 с. (Гриф БГУ)";2013;;;5070;1
6;"Аграрное право : учеб.-метод. комплекс / О.С. Кондаревич; Минский ин-т упр. – Минск: Изд-во МИУ, 2004. – 82 с.";2004;;;5579;
6;"Аграрное право : учеб.-метод. комплекс / О.С. Кондаревич; Минский ин-т упр.– 2-е издание. – Минск: Изд-во МИУ, 2004.– 92 с.";2004;;;5580;
6;"Аграрное право : учеб.-метод. комплекс / О.С. Кондаревич; Минский ин-т упр. – 2-е изд., стериотипное. – Минск: Изд-во МИУ, 2005. – 92 с.";2005;;;5581;
6;"Земельное право : учеб.-метод. комплекс / О.А. Бакиновская, О.С. Кондаревич; Минский ин-т упр. – Минск: Изд-во МИУ, 2005. – 136/35 с.";2005;;;5582;
6;"Хозяйственное право : учеб.-метод. комплекс / Л.В. Калита, О.С. Кондаревич, О.Н. Литягина, П.И. Лещинский; под. ред Л.В. Калиты; Минский ин-т упр. – Минск: Изд-во МИУ, 2006. – 212/48 с.";2006;;;5583;
6;"Аграрное право : учеб.-метод. комплекс / О.С. Кондаревич; Минский ин-т упр. – 3-е изд., перераб. и доп. – Минск: Изд-во МИУ, 2006. – 112 с.";2006;;;5584;
6;"Хозяйственное право : учеб.-метод. комплекс / Ю.А. Амельченя, Л.В. Калита, О.С. Кондаревич, О.Н. Литягина, П.И. Лещинский; под. ред Л.В. Калиты. – 2-е изд., перераб. и доп. – Минск: Изд-во МИУ, 2007. – 232/51 с.";2007;;;5585;
6;"Аграрное право : учеб.-метод. комплекс / О.С. Кондаревич; Минский ин-т упр. – 4-е изд., перераб. и доп.– Минск: Изд-во МИУ, 2008. – 116 с.";2008;;;5586;
6;"Хозяйственное право : учеб.-метод. комплекс / Ю.А. Амельченя, Л.В. Калита, О.А. Бакиновская, О.С. Буйкевич, О.Н. Литягина, П.И. Лещинский; под. ред Л.В. Калиты. – Минск: Изд-во МИУ, 2010. – 352/51 с.";2010;;;5587;
6;"Хозяйственное право : учеб.-метод. комплекс / Л.В. Калита, О.С. Кондаревич, О.Н. Литягина, П.И. Лещинский; под. ред Л.В. Калиты. Минский ин-т упр. – Минск: Изд-во МИУ, 2006. – 212/48 с.";2006;;;5623;
6;"Вялікая Айчынная вайна савецкага народа (у кантэксце Другой сусветнай вайны): Вуч.-метад. дапам. для курсантаў I курса дзённай формы навучання / Аўт.-склад. І.А. Саракавік, С.Ф. Лапановіч (С.Ф. апанович). – Минск: Акад. МУС Рэсп. Беларусь, 2006. – 32 с.";2006;;;5628;
6;"Сборник задач по уголовному праву. Особенная часть : учеб.-метод. пособие / Е.А. Авраменко, С.В. Ананич, Н.Ф. Ахраменка [и др.]; под. ред. В.В. Мороза, В.С. Яловика. – Минск: Акад. МВД Респ. Беларусь, 1999. – 93 с.";1999;;;5636;
6;"Методическая разработка по белорусскому языку для проведения практических занятий с абитуриентами / Е.В. Лексина. – Минск: Акад. МВД Респ. Беларусь, 2002. – 22 с";2002;;;5742;
6;"Организация учебного процесса в Академии МВД Республики Беларусь: сб. орг.-прав. док. / Под общ. ред. А.В. Пивоварчика, А.Л. Савенка // Сост.: Лексина Е.В. [и др.]. – Минск: Акад. МВД Респ. Беларусь, 2003. – 248 с.";2003;;;5743;
6;"Пособие для поступающих в Академию МВД по русскому языку / Е.В. Котенко. – Минск: Акад. МВД Респ. Беларусь, 2001. – 80 с.";2001;;;5764;
6;"Дапаможнік для паступаючых у Акадэмію МУС па беларускай мове / Е.В. Котенко. – Мінск: Акад. МУС Рэсп. Беларусь, 2001. – 78 с.";2001;;;5765;
6;"Криминология : учеб.-метод. пособие для студентов высших учебных заведений заочной формы обучения по специальности 1-24 01-02 «Правоведение» / Н.Ф. Ахраменка ; Белорус. гос. ун-т. – Минск : БГУ, 2009. – 103 с.";2009;;;5772;
6;"Записная книжка для молодых людей (комментарий законодательства Республики Беларусь) : науч.-метод. рекоменд. / О.П. Колченогова. – Минск: «Спектр-Диалог», 1999";1999;;;5847;
6;"Трудовое и социальное право : Типовая учебная программа для средних специальных учебных заведений по специальности Г 0901 «Правоведение» / А.А. Греченков ; М-во образования Респ. Беларусь, Респ. ин-т проф. образования. – Минск : РИПО, 1997. – 19 с.";1997;;;5908;
6;"Особенности квалификации преступлений, посягающих на установленный порядок миграции населения / О.И. Бахур // Деятельность ОВД в реализации института миграции, убежища и гражданства: учеб.-метод. пособие. – Минск, 2008. – С. 164-182";2008;;;5938;
6;"Криминология:  Альбом схем / В.А. Ананич, Н.Ф. Ахраменка, В.А. Кашевский; под ред. В.А. Ананича. – Минск: Акад. МВД Респ. Беларусь, 1999. – 142 с.";1999;;;5996;
6;"Общая теория права : учеб.-метод. пособие : для слушателей системы переподгот. / Е.В. Борщева ; М-во образования Респ. Беларусь, Белорус. гос. эконом. ун-т. – 2-е изд. – Минск : БГЭУ, 2012. – 114, [1] с. ; 21 см.";2012;;;6187;2
6;"Сборник задач по уголовному праву. Общая часть / В.Ф. Ермолович, А.И. Пилявский ; под. ред.: В.Ф. Ермоловича. – Минск : ЧУО «БИП» – Институт правоведения. 2013. – 110 с.";2013;;;6499;2
6;"Коллоквиум как вид учебной работы в Академии МВД Республики Беларусь: учеб.-метод. пособие / В.А. Мельник, Л.В. Забелова, О.З. Рыбаключева. – Минск: Акад. МВД Респ. Беларусь, 1999. – 13 с.";1999;;;6552;
6;"Руководящий документ Республики Беларусь. Образовательный стандарт. Высшее образование. Специальность 1-93 01 02 Судебная экспертиза: РД РБ 02100.5.244-2003 / О.З. Рыбаключева / В.В. Бачила (рук.) [и др.]. – Введ. 12.11.2003 постановлением М-ва образования Респ. Беларусь № 445. – Минск, 2003. – 34 с.";2003;;;6553;
6;"Образовательный стандарт Республики Беларусь. Высшее образование. Первая ступень. Специальность 1-93 01 02 Судебная экспертиза. Квалификация – Эксперт-криминалист: ОСРБ 1-93 01 02-2007 / О.З. Рыбаключева / В.В. Мелешко (рук.) [и др.]. – Введ. 02.05.2008 постановлением М-ва образования Респ. Беларусь № 40. – Минск, 2008. – 43 с.";2008;;;6554;
6;"Образовательный стандарт Республики Беларусь. Высшее образование. Первая ступень. Специальность 1-93 01 02 Судебная экспертиза. Квалификация – Юрист. Эксперт-криминалист: ОСРБ 1-93 01 02-2009 / О.З. Рыбаключева / А.Л. Савенок (рук.) [и др.]. – Введ. 15.03.2010 постановлением М-ва образования Респ. Беларусь № 35. – Минск, 2010. – 49 с.";2010;;;6555;
6;"Образовательный стандарт высшего образования. Высшее образование. Вторая ступень (магистратура). Специальность 1-93 81 01 Управление органами внутренних дел. Степень Магистр управления: ОСВО 1-93 81 01-2012 / О.З. Рыбаключева / А.Л. Савенок (рук.) [и др.]. – Введ. 24.08.2012 постановлением М-ва образования Респ. Беларусь № 108. – Минск, 2012. – 16 с.";2012;;;6556;
6;"Образовательный стандарт высшего образования. Высшее образования. Вторая ступень (магистратура). Специальность 1-93 81 03 Государственное управление органами внутренних дел. Степень Магистр управления: ОСВО 1-93 81 03-2012 / О.З. Рыбаключева / А.Л. Савенок (рук.) [и др.]. – Введ. 24.08.2012 постановлением М-ва образования Респ. Беларусь № 108. – Минск, 2012. – 17 с.";2012;;;6557;
6;"Образовательный стандарт высшего образования. Высшее образование. Первая ступень. Специальность 1-93 01 02 Судебная экспертиза. Квалификация – Юрист. Эксперт-криминалист: ОСВО 1-93 01 02-2013 / О.З. Рыбаключева / А.Л. Савенок (рук.) [и др.]. – Введ. 30.08.2013 постановлением М-ва образования Респ. Беларусь № 87. – Минск, 2013. – 32 с.";2013;;;6558;
6;"Образовательный стандарт высшего образования. Высшее образование. Первая ступень. Специальность 1-93 01 03 Правовое обеспечение оперативно-розыскной деятельности. Квалификация – Юрист: ОСВО 1-93 01 03-2013 / О.З. Рыбаключева / А.Л. Савенок (рук.) [и др.]. – Введ. 30.08.2013 постановлением М-ва образования Респ. Беларусь № 87. – Минск, 2013. – 35 с.";2013;;;6559;
6;"Образовательный стандарт высшего образования. Высшее образование. Первая ступень. Специальность 1-93 01 04 Правовое обеспечение экономической безопасности. Квалификация – Юрист: ОСВО 1-93 01 04-2013 / О.З. Рыбаключева / А.Л. Савенок (рук.) [и др.]. – Введ. 30.08.2013 постановлением М-ва образования Респ. Беларусь № 87. – Минск, 2013. – 35 с.";2013;;;6560;
6;"Образовательный стандарт высшего образования. Высшее образование. Первая ступень. Специальность 1-93 01 05 Правовое обеспечение уголовно-исполнительной деятельности. Квалификация – Юрист: ОСВО 1-93 01 05-2013 / О.З. Рыбаключева, А.Л. Савенок (рук.) [и др.]. – Введ. 30.08.2013 постановлением М-ва образования Респ. Беларусь № 87. – Минск, 2013. – 34 с.";2013;;;6561;1
6;"Уголовное право: уч. прогр. по специальностям 1-24 01 02 Правоведение; 1-24 01 03 Экономическое право / С.В. Ананич, С.М. Свило. – Минск: Акад. МВД Респ. Беларусь, 2011. – 161 с.";2011;;;6753;
6;"Методические рекомендации по заполнению раздела «Научно-исследовательская деятельность» индивидуального плана работы преподавателя Академии МВД Республики Беларусь / авт.-сост. В.Б. Шабанов, Т.А. Кокоринова, Н.С. Демьянец ; М-во внутр. дел Респ. Беларусь, учреждение образования «Акад. М-ва внутр. дел Респ. Беларусь». – Минск : Акад. МВД, 2014. – 20 с.";2014;;;6790;1
6;"Сравнительное уголовное право : учебно-метод. реком.: в 3 ч. / В.М. Воронцов // Частное учреждение образования «БИП-Институт правоведения». – Минск : ЧУО «БИП» – Институт правоведения, 2014. – Ч. 1 – 192 с.";2014;;;6878;1
6;"Философия. Идеологическая и воспитательная направленность лекций и семинарских занятий : метод. рекоменд. / Л.Е. Лойко ; Белорус. нац. техніч. ун-т ; под общ. ред А.И. Лойко. – Минск : БНТУ, 2014. – 127 с.";2014;;;7011;1
6;"Соотношение правового и нравственного воспитания в формировании правосознания : учеб.-метод. комплекс : в 3 ч. Ч.3: Общая теория государства и права. Хрестоматия : в 2 кн. Кн. 2. / Е.В. Боровая ; авт.-сост. Э.А. Калинина, А.Л. Козик. – Минск : Международный университет «МИТСО», 2014. – С. 3-13";2014;;;7229;2
6;"Педагогические тесты для текущего, рубежного и итогового контроля знаний по учебной дисциплине «Специальная техника органов внутренних дел» для курсантов дневной и слушателей заочной форм получения образования / С. В. Бородич, Э. П. Костюкович, В. Е. Козлов ; М-во внутр. дел Респ. Беларусь, учреждение образования «Акад. М-ва внутр. дел Респ. Беларусь». – Минск : Академия МВД, 2017. – 71 с.";2017;;;10408;2
