kind;outputdata;year;unused1;unused2;code;halfyear
6;"Тесты контроля уровня знаний основных положений (институтов) общей части гражданского права : учеб.-метод. пособие [для студентов] / В.Н. Паращенко, С.С. Сокол, В.В. Паращенко; под общ. ред. В.Н. Паращенко ; БИП - Институт правоведения, каф. гражданского права и процесса. – Минск : БИП-С Плюс, 2007. – 67 с.";2007;;;10;
6;"Правовое обеспечение предпринимательской деятельности : (в вопросах и ответах): учеб.-метод. пособие / Н.И. Рудович ; Частн. ин-т упр. и предпринимат. – Минск : Частн. ин-т упр. и предпринимат., 2007. – 55 с.";2007;;;63;
6;"Квалификационная характеристика специалиста-выпускника специальность 1-24 01 02 «Правоведение», специализация 1-24 01 02 14 «Экспертно-криминалистическая деятельность» / разработчики : И.А. Анищенко, О.В. Маркова ; М-во внутрен. дел Респ. Беларусь, Акад. МВД. – Минск, 2009.";2009;;;77;
6;"Квалификационная характеристика специалиста-выпускника специальность 1-93 01 02 «Судебная экспертиза» / разработчики : И.А. Анищенко, О.В. Маркова ; М-во внутрен. дел Респ. Беларусь, Акад. МВД. – Минск, 2009";2009;;;78;
6;"Криминалистическая тактика (инновационные методы проведения практических занятий) : метод. рекоменд. / О. В. Маркова ; М-во внутрен. дел Респ. Беларусь, Акад. МВД. – Минск : Акад. МВД Респ. Беларусь, 2009. – 79 с.";2009;;;84;
6;"Криминалистическая методика : метод. разработки для преподавателей по подготовке и проведению практических занятий с курсантами 3-4 курсов очного обучения факультета следственно-экспертного (экспертов), уголовно-исполнительного / Г. В. Федоров ; М-во внутрен. дел Респ. Беларусь, Акад. МВД. – Минск:  Акад. МВД Респ. Беларусь, 2008. – 48 с.";2008;;;86;
6;"Методические рекомендации по изучению дисциплины «Криминалистика» для курсантов 3-4 курсов очного обучения следственно-экспертного (эксперты) и уголовно-исполнительного факультетов / Г.В. Федоров, В.Л. Григорович ; М-во внутрен. дел Респ. Беларусь, Акад. МВД. – Минск : Акад. МВД Респ. Беларусь, 2008. – 63 с.";2008;;;88;
6;"Методические рекомендации по изучению дисциплины «Криминалистика» для курсантов 3-4 курсов следственно-экспертного и уголовно-исполнительного факультетов (специальность 1-24 01 02 «Правоведение», 1-93 01 02 «Судебная экспертиза») факультетов / Г.В. Федоров, В.Л. Григорович ; М-во внутрен. дел Респ. Беларусь, Акад. МВД. – Минск : Акад. МВД Респ. Беларусь, 2009. – 91 с.";2009;;;89;
6;"Осмотр трупа на месте происшествия или обнаружения : метод. рекоменд. / Г.В. Мережко ; М-во внутрен. дел Респ. Беларусь, Акад. МВД. – Минск : Акад.МВД Респ. Беларусь, 2009. – 48 с.";2009;;;332;
6;"Психология следственной деятельности : метод. указания / В.В. Мицкевич, И.А. Кибак, А.А. Богданов ; М-во внутрен. дел Респ. Беларусь, Акад МВД. – Минск : Акад. МВД Респ. Беларусь, 2007. – 52 с.";2007;;;393;
6;"Уголовно-исполнительное право : метод. материалы для курсантов фак. милиции и следств.-эксперт. фак. / И.И. Куценков, Е.В. Котенко, И.М. Куприенко, В.И. Степаненко ; М-во внутрен. дел Респ. Беларусь; Акад. МВД. – Минск : Акад. МВД Респ. Беларусь, 2009. – 73 с.";2009;;;574;
6;"Методические рекомендации по производству дознания в таможенных органах Республики Беларусь / В.В. Мелешко, А.П. Павлович. – Минск : ГТК, 2008. – 118 с.";2008;;;644;
6;"Деятельность органов уголовного преследования Министерства внутренних дел в стадии возбуждения уголовного дела : метод. рекоменд. / И.В. Данько, В.М. Орловский, О.Г. Шевченко ; М-во внутрен. дел Респ. Беларусь, Акад. МВД. – Минск : Акад. МВД Респ. Беларусь, 2008. – 121 с.";2008;;;725;
6;"Уголовное право : уч. прогр. для специальности 1-24 01 02 «Правоведение» / С.В. Ананич  [и др.]. – Минск : Акад. МВД Респ. Беларусь, 2008. – 185 с.";2008;;;802;
6;"Уголовное право : уч. прогр. для специальности 1-93 01 02 «Судебная экспертиза» / С.В. Ананич  [и др.]. – Минск : Акад. МВД Респ. Беларусь, 2008. – 111 с.";2008;;;803;
6;"Криминология: научно-методологические основы : уч. прогр. по специальности 12.00.08 – уголовное право и криминология, уголовно-исполнительное право / В.А. Ананич, С.М. Свило, С.Ю. Часнок. – Минск : Акад. МВД Респ. Беларусь, 2010. – 46 с.";2010;;;804;
6;"Связь между убежищем и миграцией : учеб.-метод. пособие / Л.А. Васильева (гл. 1, 2, 7; гл. 8 совм. с О.И. Бахуром), А.И. Федорако (гл. 3), Ю.О. Фёдоров, А.И. Бородич, А.З. Игнатюк (гл. 4), А.В. Селиванов (гл. 5, 6.1), Л.В. Павлова (гл. 6.2-6.3), О.И. Бахур (гл. 8 совм. с Л.А. Васильевой) ; Междунар. обществ. объединение по науч.-исслед. и информ.-образоват. программам «Развитие». – Минск : Асобны, 2007. – 239 с.";2007;;;855;
6;"Экономическая теория (вкл. Основы приватизации и реформирования экономики Республики Беларусь) : планы семинарских занятий и методические указания по их проведению / М-во внутрен. дел Респ. Беларусь, Акад. МВД ; авт.-сост. А.И. Авраменко. – Минск : Акад. МВД Респ. Беларусь, 2007. – 67 с.";2007;;;1393;
6;"Программа и методические рекомендации по организации и проведению учебной практики студентов дневной формы обучения факультета права Академии МВД Республики Беларусь (по специальности 1-24 01 03 – Экономическое право) / В.С. Гальцов, А.Г. Сачек, С.М. Тихоненко ; М-во внутрен. дел Респ. Беларусь, Акад. МВД. – Минск : Акад. МВД Респ. Беларусь, 2007. – 24 с.";2007;;;1394;
6;"Программа и методические рекомендации по организации и проведению учебной практики студентов дневной формы обучения факультета права Академии МВД Республики Беларусь (по специальности 1- 24 01 02 - Правоведение) / В.С. Гальцов, А.Г. Сачек ; М-во внутрен. дел Респ. Беларусь, Акад. МВД. – Минск : Акад. МВД Респ. Беларусь, 2007. – 22 с.";2007;;;1395;
6;"Хозяйственные споры и порядок их разрешения : метод. рекоменд. по проведению практ. занятий / Н.В. Коноплицкий ; М-во внутрен. дел Респ. Беларусь, Акад. МВД. – Минск : Акад. МВД Респ. Беларусь, 2007. – 57 с.";2007;;;1396;
6;"Финансовое право : учеб.-метод. пособие / А.А. Вишневский ; М-во внутрен. дел Респ. Беларусь, Акад. МВД. – Минск : Акад. МВД Респ. Беларусь, 2007. – 38 с.";2007;;;1401;
6;"Хозяйственное право : учеб.-метод. материалы / В.Н. Радоман, А.В. Сальникова, А.Г. Сачек ; М-во внутрен. дел Респ. Беларусь, Акад. МВД. – Минск : Акад. МВД Респ. Беларусь, 2007. – 47 с.";2007;;;1402;
6;"Правовое регулирование учета, анализа и аудита (бухгалтерское право) : учеб.-метод. комплекс / Н. Г. Цыпарков ; Минский ин-т упр. – 3-е изд., переработанное и дополненное. – Минск : Издательство МИУ, 2008. – 388 с.";2008;;;1425;
6;"Экологическое право : учеб.-метод. комплекс / Н.Г. Цыпарков ; Минский ин-т упр. – Минск : Изд-во МИУ, 2009. – 220 с.";2009;;;1465;
6;"Правовое обеспечение внешнеэкономической деятельности предприятий : метод. рекоменд. для студентов очной формы обучения / М-во внутрен. дел Респ. Беларусь, Акад. МВД ; авт.-сост. А.Н. Лепехин. – Минск : Акад. Респ. Беларусь, 2007. – 51 с.";2007;;;1498;
6;"Земельное и аграрное право : метод. рекоменд. для курсантов очной формы обучения / М-во внутрен. дел Респ. Беларусь, Акад. МВД ; авт.-сост. А.Н. Лепехин. – Минск : Акад. МВД Респ. Беларусь, 2008. – 33 с.";2008;;;1500;
6;"Огневая подготовка : метод. рекоменд. по изучению дисциплины / А.В. Долидович, А.В. Маракулин ; М-во внутрен. дел Респ. Беларусь, Акад. МВД. – Минск : Акад. МВД Респ. Беларусь, 2008. – 40 с.";2008;;;1550;
6;"Как стать водителем / В.А. Кадулин, А.Е. Цеховой, Л.К. Фармагей, М.С. Свистун, Е.Л. Карпович, Д.Г. Кузлякин, В.М. Дерман. – Минск : Тонпик, 2008. – 39 с.";2008;;;1583;
6;"История государства и права славянских народов : метод. указания / М-во внутрен. дел Респ. Беларусь, Акад. МВД ; авт.-сост. К. И. Барвинок, В. А. Данилов, А. Н. Юшкевич. – Минск : Акад. МВД Респ. Беларусь, 2007. – 80 с.";2007;;;1612;
6;"Общая теория права : учеб.-метод. пособие : для слушателей системы переподготовки / Е. В. Борщева ; М-во образования Респ. Беларусь, Белорус. гос. эконом. ун-т. – Минск : БГЭУ, 2010. – 115 с.";2010;;;1659;
6;"Культурология : материалы к лекциям / М-во внутрен. дел Респ. Беларусь, Акад. МВД, Каф. философии ; авт.-сост.: П.Г. Мартысюк, С.В. Масленченко. – Минск : Акад. МВД Респ. Беларусь, 2006. – 112 с.";2006;;;1759;
6;"Экологическое право : учеб.-метод. комплекс / Н.Г. Цыпарков ; Учреждение образования ""Мин. ин-т упр."". – Минск : Изд-во МИУ, 2004. – 216 с.";2004;;;1848;
6;"Правовое регулирование учета, анализа и аудита : бухгалтерское право : учеб.-метод. комплекс / Н.Г. Цыпарков ; Минский ин-т упр. – 2-е изд., исправленное и дополненное. – Минск : Издательство МИУ, 2006. – 336 с.";2006;;;1867;
6;"Основы права : учеб.-метод. пособие : для слушателей / Е.В. Борщева, Н.П. Вербицкий, В.И. Ноздрин-Плотницкий, К.К. Уржинский ; М-во образования Респ. Беларусь, Белорус. гос. эконом. ун-т. – Минск : БГЭУ, 2008. – 120 с.";2008;;;1869;
6;"Медицинская психология : учеб.-метод. пособие / М. Ю. Кашинский ; БИП - Институт правоведения, Каф. психологии. – Минск : БИП-С плюс, 2006. – 75 с.";2006;;;1885;
6;"Уголовно-исполнительное право : учеб.-метод. комплекс [для студентов] / Ю.Л. Сиваков, Д.В. Шаблинская ; Минский ин-т упр. – Минск : МИУ, 2007. – 259 с.";2007;;;1894;
6;"Социология права : учеб.-метод. пособие / М-во внутрен. дел Респ. Беларусь, Акад. МВД, Каф. философии ; авт.-сост.: П.И. Костюкович, А.И. Левко. – Минск : Акад. МВД Респ. Беларусь, 2006. – 147 с.";2006;;;1896;
6;"Религиоведение : учеб.-метод. пособие / М-во внутрен. дел Респ. Беларусь, Акад. МВД, каф. философии ; авт.-сост. П.И. Костюкович. – Минск : Акад. МВД Респ. Беларусь, 2006. – 58 с.";2006;;;1897;
6;"Основы медицинских знаний : метод. указания по орг. и проведению практ. занятий / А.О. Гусенцов // М-во внутрен. дел Респ. Беларусь, Акад. МВД. – Минск : Акад. МВД Респ. Бларусь, 2007. – 36 с.";2007;;;2239;
6;"Основы управления органами внутренних дел : материалы к лекциям / Ю.Л. Сиваков ; М-во внутрен. дел Респ. Беларусь, Акад. МВД. – Минск : Акад. МВД Респ. Беларусь, 2007. – 108 с.";2007;;;2242;
6;"Психолого-педагогические аспекты профилактики правонарушений среди несовершеннолетних / П.В. Горонин, О.Э. Схопчик; М-во внутрен. дел. Респ. Беларусь, Акад. МВД. – Минск: Акад. МВД Респ. Беларусь, 2006. – 55 с.";2006;;;2273;
6;"Судебная бухгалтерия : материалы к лекции / Н.Г. Цыпарков, И.В. Сауткин, А.А. Малышко ; предисл. А.В. Окунея. – Минск : Акад. МВД Респ. Беларусь, 2006. – 132 с.";2006;;;2279;
6;"Международное право : типовая учеб. программа по специальности 1 – 93 01 02 «Судебная экспертиза» / А.А. Подупейко, А.И. Курак ; М-во внутрен. дел Респ. Беларусь, Акад. МВД. – Минск : Акад. МВД Респ. Беларусь, 2008.";2008;;;2470;
6;"Конституционное право : учеб.-метод. пособие для слушателей и студентов заочной формы обучения / М-во внутрен. дел Респ. Беларусь, Акад. МВД ; авт.-сост.: А.А. Подупейко, И.А. Канашевич. – Минск : Акад. МВД Респ. Беларусь, 2002. – 40 с.";2002;;;2471;
6;"Конституционное право : учеб.-метод. пособие / М-во внутрен. дел Респ. Беларусь, Акад. МВД ; авт.-сост.: А.А. Подупейко, И.А. Канашевич. – Минск : Акад. МВД Респ. Беларусь, 2002. – 68 с.";2002;;;2472;
6;"Конституционное право : типовая учеб. программа для вузов по специальности 1 – 93 01 02 «Судебная экспертиза» / А.А. Подупейко ; М-во внутрен. дел Респ. Беларусь, Акад. МВД. – Минск : Акад. МВД Респ. Беларусь, 2008";2008;;;2474;
6;"Конституционное право Республики Беларусь : учеб.-метод. пособие для слушателей очной формы обучения / П.Л. Богданович, А.В. Гайдаров, А.А. Подупейко ; М-во внутрен. дел Респ. Беларусь, Акад. МВД. – Минск : Акад. МВД Респ. Беларусь, 1997. – 52 с.";1997;;;2475;
6;"Конституционное право Республики Беларусь : учеб.-метод. пособие для слушателей заочного обучения / П.Л. Богданович, А.А. Подупейко ; М-во внутрен. дел Респ. Беларусь, Акад. МВД. – Минск : Акад. МВД Респ. Беларусь, 1997. – 44 с.";1997;;;2476;
6;"Конституционное право Республики Беларусь : учеб. программа / П.Л. Богданович, А.В. Гайдаров, А.А. Подупейко ; М-во внутрен. дел Респ. Беларусь, Акад. МВД. – Минск : Акад. МВД Респ. Беларусь, 1997. – 24 с.";1997;;;2477;
6;"Конституционное право зарубежных стран : учеб. программа / М-во внутрен. дел Респ. Беларусь, Акад. МВД ; авт.-сост.: С.П. Чигринов, А.А. Подупейко, М.Г. Головач. – Минск : Акад. МВД Респ. Беларусь, 2002. – 24 с.";2002;;;2478;
6;"Конституционное право зарубежных стран : учеб.-метод. пособие для слушателей и студентов заочной формы обучения / М-во внутрен. дел Респ. Беларусь, Акад. МВД ; авт.-сост.: С.П. Чигринов, А.А. Подупейко, М.Г. Головач, П.В. Агеенков, Р.А. Середа. – Минск : Акад. МВД Респ. Беларусь, 2003. – 39 с.";2003;;;2479;
6;"Конституционное право зарубежных стран : типовая учебная программа по специальности 1-93 01 02 «Судебная экспертиза» / А.А. Подупейко ; М-во внутрен. дел Респ. Беларусь, Акад. МВД. – Минск : Акад. МВД Респ. Беларусь, 2009";2009;;;2480;
6;"Гражданское и семейное право: материалы университетского учебного курса по специальности “правоведение” для обучающихся, имеющих высшее неюридическое образование : учеб.-метод. пособие / А.В. Долидович – Минск : Акад. МВД Респ. Беларусь, 2000. – 27 с.";2000;;;2483;
6;"Земельное и аграрное право : материалы университетского учебного курса по специальности “правоведение” для обучающихся, имеющих высшее неюридическое образование : учеб.-метод. пособие / А.В. Долидович. – Минск : Акад. МВД Респ. Беларусь, 2000. – 25 с.";2000;;;2484;
6;"Основы экологии: материалы университетского учебного курса по специальности “правоведение” для обучающихся, имеющих высшее неюридическое образование : учеб.-метод. пособие / А.В. Долидович. – Минск : Акад. МВД Респ. Беларусь, 2000. – 20 с.";2000;;;2485;
6;"Актуальные вопросы информационного права : учеб. программа по специальности 1-24 80 01 «Юриспруденция» / М-во внутрен. дел Респ. Беларусь, Акад. МВД ; авт.-сост. А.Н. Лепехин. – Минск : Акад. МВД Респ. Беларусь, 2010. – 13 с.";2010;;;2497;
6;"Земельное право : метод. рекоменд. для слушателей заочной формы обучения по подготовке контрольных работ / М-во внутрен. дел Респ. Беларусь, Акад. МВД ; авт.-сост. А.Н. Лепехин. – Минск : Акад. МВД Респ. Беларусь, 2009. – 17 с.";2009;;;2499;
6;"Уголовное право Республики Беларусь. Общая часть : учеб.-метод. комплекс для курсантов и студентов 2-х курсов факультетов Акад. МВД Респ. Беларусь / М-во внутрен. дел Респ. Беларусь, Акад. МВД, Каф. уголовного права и криминологии ; авт.-сост.: В.В. Мороз, О.В. Мороз. – Минск : Акад. МВД Респ. Беларусь, 2004. – 87 с.";2004;;;2507;
6;"Уголовно-исполнительное право : научно-методологические основы : базов. учеб. программа для адъюнктов науч.-пед. фак. Акад. МВД Респ. Беларусь по специальности 24 01 02 ""Правоведение"" / А.В. Шарков, В.Б. Шабанов, В.С. Красиков ; М-во внутрен. дел Респ. Беларусь, Акад. МВД. – Минск : Акад. МВД Респ. Беларусь, 2003. – 64 с.";2003;;;2535;
6;"Специальная техника органов внутренних дел : базовая учеб. программа по курсу / Под ред. В.В. Бачилы. – Минск : Акад. МВД Респ. Беларусь, 2002. – 23 с.";2002;;;2536;
6;"Оперативное обслуживание подразделениями уголовного розыска ГО(РУ)РОВД административных территорий : базовая учеб. программа по спецкурсу / Под ред. В.В. Бачилы. – Минск : Акад. МВД Респ. Беларусь, 2002. – 19 с.";2002;;;2537;
6;"Образовательный стандарт. Высшее образование. Специальность: 1– 93 01 02 Судебная экспертиза / В.В. Бачила, В.Ф. Бурейко, В.П. Егоров [и др.]; ред. Г.П. Карповская. – Минск : М-во образования Респ. Беларусь, 2003. – 35 с.";2003;;;2538;
6;"Основы оперативно-розыскной деятельности : базовая учеб. программа  по специальности 1-24 01 02 «Правоведение» / Сост. В.В. Бачила, И.В. Ломоть. – Минск : Акад. МВД Респ. Беларусь, 2004. – 27 с.";2004;;;2539;
