kind;outputdata;year;unused1;unused2;code;halfyear
14;"Криминологическая типология взяточничества / В.А. Ананич, А.М. Клим // Вопросы криминологии, криминалистики и судебной экспертизы : сб. науч. тр. / Государственное учреждение “Центр судебной экспертизы и криминалистики М-ва юстиции Респ. Беларусь”; редкол.: А.В. Дулов (гл. ред.) [и др.]. – Минск : Право и экономика, 2011. – № 2(30). – С. 67-71";2011;;;4065;2
14;"Территориальный мониторинг ситуации (оперативной обстановки) в сфере противодействия преступности / И.И. Басецкий, А.В. Скалдин // Вопросы криминологии, криминалистики и судебной экспертизы : сб. науч. тр. / Государственное учреждение “Центр судебной экспертизы и криминалистики М-ва юстиции Респ. Беларусь”; редкол.: А.В. Дулов (гл. ред.) [и др.]. – Минск : Право и экономика, 2011. – № 2(30). – С. 87-90";2011;;;4066;2
14;"О сущности защиты и безопасности, гарантируемых государством лицам, оказывающим конфиденциальное содействие оперативным подразделениям / А.В. Башан, С.А. Горшенков // Вопросы криминологии, криминалистики и судебной экспертизы : сб. науч. тр. / Государственное учреждение “Центр судебной экспертизы и криминалистики М-ва юстиции Респ. Беларусь”; редкол.: А.В. Дулов (гл. ред.) [и др.]. – Минск : Право и экономика, 2011. – № 2(30). – С. 91-94";2011;;;4067;2
14;"Даследаванне міжнародных адносін у Беларусі у кантэксце развіцця гістарычнай навукі (1980–1990-я гг.) / А.В. Гурин // Научные труды Академии управления при Президенте Республики Беларусь. – Минск, 2011. – Вып. 13. – С. 150-160";2011;;;4076;2
14;"Определение величины криминалистического риска при принятии решений в сфере уголовного судопроизводства / В.Б. Шабанов, Г.А. Зорин // Вестник Воронежского института МВД России : всерос. науч.-практ. журн. – Воронеж, 2012. – № 1. – С. 13-16";2012;;;4125;1
14;"Соотношение криминалистической характеристики преступлений со следственными ситуациями, предметом доказывания, версиями и задачами расследования преступления / В.Б. Шабанов, В.Ф. Ермолович // Вестник Калининградского юридического института МВД России : науч.-теорет. журн. – Калининград, 2012. – Вып. № 1(27). – С. 79-84";2012;;;4126;1
14;"Анализ положений Конвенции Совета Европы по борьбе с киберпреступностью в целях противодействия детской порнографии в сети Интернет / П.Л. Боровик // Проблемы укрепления законности и правопорядка: наука, практика, тенденции: сб. науч. тр. / редкол.: В.М. Хомич [и др.] ; НПЦ проблем укрепления законности и правопорядка Ген. прокуратуры Респ. Беларусь. – Минск : БГУФК, 2011. – Вып. 4. – С. 276-283";2011;;;4268;2
14;"Процессуальный статус несовершеннолетних, снимающихся при изготовлении порнографической продукции / Г.В. Федоров, П.Л. Боровик // Судовы веснік : часоп. / Вярхоўны Суд Рэсп. Беларусь. – Минск, 2012. – № 1. – С. 68-73";2012;;;4269;1
14;"Соотношение способов «распространение», «рекламирование» и «демонстрация» в ст. 343, 343-1 Уголовного кодекса Республики Беларусь / Г.В. Фёдоров, П.Л. Боровик // Юстыцыя Беларусі : юрыд. навук.-практ. часоп. / Администрация Президента Респ. Беларусь, М-во юстиции Респ. Беларусь, Респ. коллегия адвокатов. – Минск, 2012. – № 4. – С. 33-37";2012;;;4270;1
14;"Залог как альтернатива заключению под стражу / Т.Л. Щерба, Л.И. Кукреш // Юстыцыя Беларусі : юрыд. навук.-практ. часоп. / Администрация Президента Респ. Беларусь, М-во юстиции Респ. Беларусь, Респ. коллегия адвокатов. – Минск, 2012. – № 2. – С. 42-45";2012;;;4276;1
14;"К вопросу о сущности и правовой природе права граждан Республики Беларусь на жилище / Н.Н. Ермолкевич // Юстыцыя Беларусі : юрыд. навук.-практ. часоп. / Администрация Президента Респ. Беларусь, М-во юстиции Респ. Беларусь, Респ. коллегия адвокатов. – Минск, 2011. – № 12. – С. 42-45";2011;;;4277;2
14;"Право на получение жилого помещения социального пользования как обеспечительная мера / Н.Н. Ермолкевич // Юстыцыя Беларусі : юрыд. навук.-практ. часоп. / Администрация Президента Респ. Беларусь, М-во юстиции Респ. Беларусь, Респ. коллегия адвокатов. – Минск, 2012. – № 2. – С. 49-52";2012;;;4278;1
14;"Содержание конституционного права граждан Республики Беларусь на жилище / Н.Н. Ермолкевич // Веснік Канстытуцыйнага Суда Рэспублікі Беларусь Вестник = Конституционного Суда Республики Беларусь = Bulletin of the Constitutional Courf of the Republic of Belarus / Конст. Суд Респ. Беларусь. – Минск. – 2011. – № 2. – С. 123-134";2011;;;4279;1
14;"Примирение c потерпевшим как основание освобождения от уголовной ответственности: уголовно-правовой и уголовно-процессуальный аспекты / Э.А. Саркисова, Л.И. Кукреш // Юстыцыя Беларусі : юрыд. навук.-практ. часоп. / Администрация Президента Респ. Беларусь, М-во юстиции Респ. Беларусь, Респ. коллегия адвокатов. – Минск, 2012. – № 3. – С. 26-30";2012;;;4280;1
14;"Упрощение или упрощенчество в уголовном судопроизводстве? / И.В. Данько // Юстыцыя Беларусі : юрыд. навук.-практ. часоп. / Администрация Президента Респ. Беларусь, М-во юстиции Респ. Беларусь, Респ. коллегия адвокатов. – Минск, 2012. – № 3. – С. 31-34";2012;;;4281;1
14;"Особенности расследования преступлений в исправительных учреждениях: проблемы и перспективы / В.Б. Шабанов // Научный вестник Омской академии МВД России. – Омск, 2012. – № 2(46). – С. 71-75";2012;;;4361;1
14;"Об исполнении постановлений о наложении административных взысканий / С.В. Добриян // Вестник Академии МВД Республики Беларусь : науч.-практ. журн. – Минск, 2012. – № 1(23). – С. 4-7";2012;;;4363;1
14;"Некоторые аспекты сущности права в гражданском обществе и правовом государстве / Л.М. Рябцев, Д.В. Гвоздев // Вестник Академии МВД Республики Беларусь : науч.-практ. журн. – Минск, 2012. – № 1(23). – С. 20-25";2012;;;4364;1
14;"Интеллектуальные технологии в управленческой деятельности руководящего состава ОВД по обеспечению гражданско-правовой и морально-психологической устойчивости сотрудников / Ю.Л. Сиваков // Вестник Академии МВД Республики Беларусь : науч.-практ. журн. – Минск, 2012. – № 1(23). – С. 25-29";2012;;;4365;1
14;"Основные направления и пути развития оперативно-розыскной практики ОВД, законодательства и соответствующей теории / И.И. Басецкий // Вестник Академии МВД Республики Беларусь : науч.-практ. журн. – Минск, 2012. – № 1(23). – С. 30-33";2012;;;4366;1
14;"Формирование теоретических основ прогнозирования в судебной экспертизе / Е.Ю. Горошко // Вестник Академии МВД Республики Беларусь : науч.-практ. журн. – Минск, 2012. – № 1(23). – С. 34-37";2012;;;4367;1
14;"Особенности отражения последствий общественно опасного деяния, предусмотренного уголовным законом при установлении факта причинения морального вреда / А.В. Яскевич, М.А. Кравцова // Вестник Академии МВД Республики Беларусь : науч.-практ. журн. – Минск, 2012. – № 1(23). – С. 49-52";2012;;;4368;1
14;"Терроризм: криминологические и уголовно-правовые меры противодействия / С.В. Ананич, Н.А. Легенченко // Вестник Академии МВД Республики Беларусь : науч.-практ. журн. – Минск, 2012. – № 1(23). – С. 53-57";2012;;;4369;1
14;"Способы изготовления порнографии как обстоятельства, подлежащие доказыванию / П.Л. Боровик // Вестник Академии МВД Республики Беларусь : науч.-практ. журн. – Минск, 2012. – № 1(23). – С. 57-61";2012;;;4370;1
14;"Возможности применения системного подхода в исследовании проблем противодействия организованной преступности в Республике Беларусь / Н.А. Легенченко // Вестник Академии МВД Республики Беларусь : науч.-практ. журн. – Минск, 2012. – № 1(23). – С. 65-68";2012;;;4371;1
14;"Методико-правовой механизм международного розыска, ареста и конфискации денежных средств и имущества, полученных преступным путем / В.В. Меркушин // Вестник Академии МВД Республики Беларусь : науч.-практ. журн. – Минск, 2012. – № 1(23). – С. 69-73";2012;;;4372;1
14;"Правосознание и эффективность уголовного закона / А.Л. Савенок // Вестник Академии МВД Республики Беларусь : науч.-практ. журн. – Минск, 2012. – № 1(23). – С. 73-80";2012;;;4373;1
14;"Исторические и правовые тенденции преступности женщин в Российской империи в конце XIX в. / В.Б. Шабанов // Вестник Академии МВД Республики Беларусь : науч.-практ. журн. – Минск, 2012. – № 1(23). – С. 84-86";2012;;;4374;1
14;"О системе и компетенции органов дознания Республики Беларусь / Ю.М. Юбко // Вестник Академии МВД Республики Беларусь : науч.-практ. журн. – Минск, 2012. – № 1(23). – С. 87-90";2012;;;4375;1
14;"Тактические особенности производства выемки при расследовании уголовных дел, возбужденных по фактам нарушения авторских и смежных прав, когда объектом преступного посягательства является программный продукт / Ю.М. Юбко, И.А. Судникович // Вестник Академии МВД Республики Беларусь : науч.-практ. журн. – Минск, 2012. – № 1(23). – С. 90-93";2012;;;4376;1
14;"Некоторые теоретические и практические проблемы применения неустойки и удержания / Н.Л. Бондаренко // Вестник Академии МВД Республики Беларусь : науч.-практ. журн. – Минск, 2012. – № 1(23). – С. 94-98";2012;;;4377;1
14;"Крупные сделки хозяйственных обществ / Л.М. Орлова // Вестник Академии МВД Республики Беларусь : науч.-практ. журн. – Минск, 2012. – № 1(23). – С. 102-105";2012;;;4379;1
14;"Сделки с участием несовершеннолетних: особенности и правовые проблемы / И.В. Савина // Вестник Академии МВД Республики Беларусь : науч.-практ. журн. – Минск, 2012. – № 1(23). – С. 110-113";2012;;;4380;1
14;"Правовые презумпции в теории права / Е.В. Борщева // Вестник Академии МВД Республики Беларусь : науч.-практ. журн. – Минск, 2012. – № 1(23). – С. 127-133";2012;;;4381;1
14;"Дискретность в истории развития права Беларуси / А.Ф. Вишневский, Д.В. Щербик // Вестник Академии МВД Республики Беларусь : науч.-практ. журн. – Минск, 2012. – № 1(23). – С. 138-144";2012;;;4382;1
14;"Формы и методы ресоциализации несовершеннолетних правонарушителей в исправительных учреждениях НКВД–МВД Беларуси в послевоенные годы (1944–1953 гг.) / В.А. Данилов // Вестник Академии МВД Республики Беларусь : науч.-практ. журн. – Минск, 2012. – № 1(23). – С. 144-148";2012;;;4383;1
14;"Предмет и теоретическая конструкция философии права / А.А. Козел // Вестник Академии МВД Республики Беларусь : науч.-практ. журн. – Минск, 2012. – № 1(23). – С. 152-159";2012;;;4384;1
14;"Человек как исходный пункт новой методологии белорусской юриспруденции / В.П. Шиенок // Вестник Академии МВД Республики Беларусь : науч.-практ. журн. – Минск, 2012. – № 1(23). – С. 163-168";2012;;;4385;1
14;"Специальная комплексная проверка комитета государственного контроля Республики Беларусь деятельности юридического лица, индивидуального предпринимателя / В.Ф. Ермолович, А.В. Денисевич // Вестник Академии МВД Республики Беларусь : науч.-практ. журн. – Минск, 2012. – № 1(23). – С. 179-184";2012;;;4386;1
14;"О некоторых международно-правовых аспектах защиты персональных данных в информационных сетях / О.В. Кипченко А.Н. Лепехин // Вестник Академии МВД Республики Беларусь : науч.-практ. журн. – Минск, 2012. – № 1(23). – С. 184-188";2012;;;4387;1
14;"Новые подходы к содержанию ОРД / И.И. Басецкий, В.Ч. Родевич // Вестник Академии МВД Республики Беларусь : науч.-практ. журн. – Минск, 2012. – № 1(23). – С. 194-197";2012;;;4388;1
14;"М.В. Ломоносов о государстве и праве (к 300-летию со дня рождения М.В. Ломоносова) / Н.И. Порубов // Вестник Академии МВД Республики Беларусь : науч.-практ. журн. – Минск, 2012. – № 1(23). – С. 203-206";2012;;;4389;1
14;"Понятие и основные признаки субъекта государственного контроля и надзора / И.И. Мах // Вестник Академии МВД Республики Беларусь : науч.-практ. журн. – Минск, 2012. – № 1(23). – С. 15-20";2012;;;4390;1
14;"Совершенствование индивидуального криминологического прогнозирования как условие оптимизации уголовной ответственности / Н.А. Аникеева // Юстыцыя Беларусi : юрыд. навук.-практ.часоп. / Администрация Президента Респ. Беларусь, М-во юстиции Респ. Беларусь, Респ. коллегия адвокатов. – Минск, 2012. − № 5(122). − С. 70-72";2012;;;4403;1
14;"Предпосылки зарождения, становления и развития правового регулирования проблемы противодействия детской порнографии / П.Л. Боровик // Вестник Полоцкого государственного университета = Веснік Полацкага дзяржаўнага універсітэта : науч.-теорет. ежемес. журн. – Серия D: Экономические и юридические науки = Серыя D: Эканамічныя і юрыдычныя навукі. – Новополоцк : ПГУ, 2012. – № 6. – С. 178-185";2012;;;4404;1
14;"Правовые средства противодействия детской порнографии / Г.В. Фёдоров, П.Л. Боровик // Юстыцыя Беларусi : юрыд. навук.-практ.часоп. / Администрация Президента Респ. Беларусь, М-во юстиции Респ. Беларусь, Респ. коллегия адвокатов. – Минск, 2012. – № 6. – С. 28-32";2012;;;4405;1
14;"Аспекты проблемы криминализации приобретения и сбыта порнографической продукции с изображением несовершеннолетних / П.Л. Боровик // Вестник Полоцкого государственного университета = Веснік Полацкага дзяржаўнага універсітэта : науч.-теорет. ежемес. журн. – Серия D: Экономические и юридические науки = Серыя D: Эканамічныя і юрыдычныя навукі. – Новополоцк : ПГУ, 2012. – № 6. – С. 200-204";2012;;;4406;1
14;"Структура личности и классификация лиц, совершающих преступления в сфере оборота детской порнографии / П.Л. Боровик // Вопросы криминологии, криминалистики и судебной экспертизы: сб. науч. тр. / Вопросы криминологии, криминалистики и судебной экспертизы : сб. науч. тр. / Государственное учреждение “Центр судебной экспертизы и криминалистики М-ва юстиции Респ. Беларусь”; редкол.: А.В. Дулов (гл. ред.) [и др.]. – Минск : Право и экономика, 2012. – № 1(31). – С. 98-103";2012;;;4407;1
14;"Комплексный контроль в процессе специальной подготовки спортсменов пятиборцев / А.В. Селецкий // Мир спорта : ежекв. науч.-теорет. журн. / М-во спорта и туризма Респ. Беларусь, Нац. олимп. комитет Респ. Беларусь. – Мінск, 2011. – № 4(45). – С. 3-8";2011;;;4410;2
14;"Учет психомоторных качеств в процессе подготовки юных пятиборцев 15-18 лет / А.В. Селецкий, Е.В. Мельник // Молода спортивна наука України: зб. наук. праць з галузі фізичноговиховання, спорту i здоров’я людини. – Вип. 16 : в 4-х т. – Львів: ЛДУФК, 2012. – Т. 1. – С. 281-286";2012;;;4411;1
14;"Теоретико-методическое обоснование использования комплексного контроля в процессе подготовки спортсменов в современном пятиборье / А.В. Селецкий, Е.В. Мельник // Спортивный психолог : науч.-практ. журн. / Рос. гос. ун-т физ. культуры спорта, молодежи и туризма. – М., 2012. – № 1(25). – С. 17-21";2012;;;4412;1
14;"Опыт организации научных мероприятий в формате телеконференции с применением средств видеоконференцсвязи в ведомственном юридическом вузе (на материалах кафедры информатики и математики ВИПЭ ФСИН России и кафедры правовой информатики Академии МВД Республики Беларусь) / В.Б. Шабанов, О.А. Шахов, А.А. Бабкин, Б.А. Садельников, П.Л. Боровик // Вестник института : преступление, наказание, исправление : науч.-практ. журн. / Вологод. ин-т права и экономики Федер. службы исполн. наказаний России. – Вологда, 2012. – № 1(18). – С. 79-83";2012;;;4413;1
14;"Концептуальные подходы к классификации и систематизации способов совершения преступлений / В.Ф. Ермолович, Д.В. Ермолович // Проблемы управления : науч.-практ. журн. / Акад. упр. при Президенте Респ. Беларусь. – Минск, 2012. – № 1(42). – С. 147-153";2012;;;4416;1
