kind;outputdata;year;unused1;unused2;code;halfyear
8;"Об обязательном государственном социальном страховании осужденных к лишению свободы / А.А. Греченков // Вестник молодежного научного общества. – 2000. – № 5–6. – С. 121–123";2000;;;6769;
8;"Концептуальные вопросы времени отдыха: современные научные подходы и отражение в трудовых кодексах государств – участников Содружества Независимых Государств / А.А. Греченков // Трудовое право в России и за рубежом : Федер. науч.-практ. и информ. журн. / Изд. группа «Юрист». – М., 2013. – № 4. – С. 49-52";2013;;;6779;2
8;"Субъективная сторона юридического конфликта как наиболее значимый элемент его структуры [Електронний ресурс] / В. И. Павлов // Вісник Хмельницького інституту регіонального управління та права . - 2004. - № 4. - С. 39-46. - Режим доступу: http://nbuv.gov.ua/j-pdf/Unzap_2004_4_7.pdf. - Дата доступа: 13.06.2014";2004;;;6787;
8;"Особистість у праві в посткласичній перспективі: абрис концепції [Електронний ресурс] / В. Павлов // Філософія права і загальна теорія права . - 2012. - № 2. - С. 166–177. - Режим доступу: http://nbuv.gov.ua/j-pdf/filpr_2012_2_18.pdf1298. - Дата доступа: 13.06.2014";2012;;;6788;
8;"Компрометирующие материалы как один из мотивов привлечения лиц к негласному сотрудничеству / А.Н. Тукало // Вестник главного управления уголовного розыска МВД Респ. Беларусь. – 2013. – № 20. – С. 30-37";2013;;;6858;2
8;"Проблемные аспекты «А» работы подразделений уголовного розыска в Республике Беларусь / В.Ч. Родевич // Вестник главного управления уголовного розыска  МВД Респ. Беларусь. – 2013. – № 20. – С. 17-22";2013;;;6859;2
8;"Внутрикамерная «А» работа, осуществляемая при раскрытии уличных грабежей / А.А. Дедковский  // Вестник главного управления уголовного розыска  МВД Респ. Беларусь. – 2013. – № 20. – С. 23-29";2013;;;6860;2
8;"Что нужно делать, чтобы судебный эксперт перестал быть судьей факта или еще раз о возможности и необходимости оценки достоверности судебных экспертиз / А.С. Рубис // Эксперт-криминалист : федер. науч.-практ. журн. / Изд. гр. ""Юрист"". – М., 2014. – № 2.  – С. 36-40";2014;;;6870;1
8;"Организационные основы проведения экспертизы продукции, имеющей признаки порнографии с изображением несовершеннолетнего / П.Л. Боровик // Ученые труды Алматинской академии МВД Республики Казахстан: науч. журн. – Алматы, 2014. – №1(38). – С. 133-138";2014;;;6874;1
8;"О некоторых вопросах совершенствования УК Беларуси / В.В. Марчук // Правотворчество и правоприменение в условиях инновационного развития общества : сб. науч. ст.: в 2 ч.  / редкол.: Н.В. Сильченко (гл. ред.) [и др.] – Гродно : ГрГМУ, 2014. – Ч. 2.  –  С. 233-237";2014;;;6899;1
8;"Социально-правовой контроль преступности в контексте новелл уголовного и уголовно-исполнительного законодательства / В.М. Хомич // Теоретические и прикладные проблемы социально-правового контроля и предупреждения преступности : сб. науч. ст. / Вит. гос. ун-т ; редкол.: А.А.Бочков (отв. ред.) [и др.]. – Витебск : ВГУ и. П.М. Машерова, 2014. – С. 28-31";2014;;;6900;1
8;"Ответственность: правовые формы обеспечения правопослушного взаимодействия субъектов (на основе законодательства РФ и Беларуси) / А.А. Примаченок // Законодательство стран-участниц ЕвроАзЭС : сравнительно-правовой анализ и перспективы гармонизации : сб. науч. ст. –  СПб.: МИЭП, 2013. –  С. 109-119";2013;;;6902;2
8;"Правонарушения несовершеннолетних и иных лиц молодежного возраста / А.И. Лукашов, О.Г. Лукашова // Консультант Плюс : Беларусь. Технология 3000 [Электронный ресурс] / ООО “ЮрСпектр”, Нац. центр правовой информ. Респ. Беларусь. – Минск, 2014";2014;;;6905;1
8;"Об обращении с персональными данными лица, участвующего в проведении клинических испытаний лекарственных средств  / А.И. Лукашов // Консультант Плюс : Беларусь. Технология 3000 [Электронный ресурс] / ООО “ЮрСпектр”, Нац. центр правовой информ. Респ. Беларусь. – Минск, 2014";2014;;;6906;1
8;"Уголовная ответственность: понятие, содержание, признаки в контексте законодательной регламентации / Э.А. Саркисова // Консультант Плюс : Беларусь. Технология 3000 [Электронный ресурс] / ООО “ЮрСпектр”, Нац. центр правовой информ. Респ. Беларусь. – Минск, 2014";2014;;;6907;1
8;"Цели уголовной ответственности  и средства их обеспечения в контексте современных реалий уголовной политики / Э.А. Саркисова // Консультант Плюс : Беларусь. Технология 3000 [Электронный ресурс] / ООО “ЮрСпектр”, Нац. центр правовой информ. Респ. Беларусь. – Минск, 2014";2014;;;6908;1
8;"Civil legislation stability and principles providind it (by the example of the Russian Federation and the Republic of Belarus) / N.L. Bondarenko (Н.Л. Бондаренко), V.G. Golubtsov (В.Г. Голубцов) // World Applied Sciences Journal, 2013. Research 24(1). – P. 126-129";2013;;;6941;2
8;"Социальная защита лиц, работающих на основе гибких форм занятости / И.А. Комоцкая, Е.В. Касьянова // Осуществление страхования от несчастных случаев на производстве и профессиональных заболеваний: правовые, экономические и социальные аспекты : сб. науч. ст. / Гомель. гос. техн. ун-т им. П.О. Сухого [и др.] ; под ред. С.П. Кацубо. – Гомель, 2014. – С. 105-108";2014;;;6947;1
8;"Принцип надлежащего исполнения обязательств и его проявления в гражданском законодательстве Республики Беларусь / Н.Л. Бондаренко // Актуальные проблемы гражданского права : ежегод. сб. науч. тр. – Минск : Междунар. ун-т «МИТСО», 2014. – Вып. 3. – С. 5-13";2014;;;6950;1
8;"Некоторые закономерности закрепления принципов гражданского права в качестве основных начал гражданского законодательства / Н.Л. Бондаренко // Вести Института предпринимательской деятельности : науч.-практ. журн. – Минск, 2014. – № 1(10). – С. 69-74";2014;;;6951;1
8;"К вопросу о защите детей в вооруженных конфликтах / С.Г. Луговский // Теоретические и прикладные проблемы социально-правового контроля и предупреждения преступности : сб. науч. ст. / Вит. гос. ун-т им. П.М. Машерова ; редкол.: А.А. Бочков (отв. ред.) [и др.]. – Витебск : УО «ВГУ им. П.М. Машерова», 2014. – С. 165-166";2014;;;6975;1
8;"Конституционность как основополагающий принцип правотворчества в Республике Беларусь / А.И. Курак // Правотворчество и правоприменение в условиях инновационного развития общества : сб. науч. ст. : в 2 ч. / М-во образования Респ. Беларусь, учреждение образования «Гродн. гос. ун-т им. Янки Купалы» ; редкол.: Н.В. Сильченко (гл. ред.) [и др.]. – Ч. 1. – С. 227-231";2014;;;6976;1
8;"Экономическая свобода и экономическая безопасность / А.И. Авраменко // Вестник БарГУ : науч.-практ. журн. / учреждение образования «Барановичский государственный университет». – Минск, 2014. – № 1(37). – С. 46-56";2014;;;6994;1
8;"Нравственные структуры здравого смысла и дискуссии о морально-аксиологических основаниях современной культуры / Л.Е. Лойко // Философские традиции и современность: филос.-просветит. журн. / Тамбовский гос. ун-т им. Г.Р. Державина, Тамбовское регион. отд. Рос. филос. общества (РФО). – Тамбов, 2013. – № 2(4). – С. 121-129";2013;;;7007;2
8;"Влияние e-commerce на экономическую безопасность государства / С.В. Масленченко // Актуальные проблемы в области гуманитарных наук: от теории к практике: сб. ст. / Нижегородская акад. МВД России. – Н. Новгород : Нижегородская акад. МВД России, 2014. – Вып. 9 : Экономическая безопасность государства : социокультурное и антропологическое измерение. – С. 108-123";2014;;;7008;1
8;"Деятельность Витебской общины сестер милосердия в начале ХХ в. / О.Л. Помалейко // Беларусь у пачатку ХХ ст. Да 100-годдзя БДПУ : зб. навук. арт. / Беларус. дзярж. пед. ун-т імя Максіма Танка ; рэдкал.: А.І. Андарала, М.М. Забаўскі, А.М. Люты [і інш.]. – Мінск : БДПУ, 2014. – С. 190-197";2014;;;7009;1
8;"Женские монастыри Могилевской епархии в начале ХХ в. / О.Л. Помалейко // Беларусь у пачатку ХХ ст. Да 100-годдзя БДПУ : зб. навук. арт. / Беларус. дзярж. пед. ун-т імя Максіма Танка ; рэдкал.: А.І. Андарала, М.М. Забаўскі, А.М. Люты [і інш.]. – Мінск: БДПУ, 2014. – С. 213-220";2014;;;7010;1
8;"Методические основы профессионально ориентированного обучения иностранным языкам / С.С. Денисова // Профессионально ориентированное обучение гуманитарным дисциплинам в Вузах силовых структур: теория и практика : сб. науч.-метод. ст. / Воен. акад. Респ. Беларусь. – Минск, 2014. – С. 32-38";2014;;;7055;1
8;"Критерии эффективности правовых норм и оценка законопроекта / И.А. Кибак // Вестник Краснодарского университета МВД России: науч.-практ. журн. – 2014. – № 1. – С. 19-24";2014;;;7087;1
8;"Общественное мнение о деятельности органов внутренних дел: проблемы и перспективы / И.А. Кибак // Вестник Всероссийского института повышения квалификации сотрудников МВД России : науч.-практ. журн. – 2014. – № 1(29). – С. 22-27";2014;;;7088;1
8;"Характеристика представлений о явлениях социально-правовой действительности несовершеннолетних с различными типами правосознания  / О.Э. Схопчик // Психология, социология и педагогика : науч.-практ. журн. / ООО ""Междунар. науч.-инновац. Центр"".
. – 2014. – № 4(31). – С. 23-28";2014;;;7089;1
8;"Профессионально важные качества психолога, как фактор определяющий эффективность парламентского психологического сопровождения депутатов / И.А. Кибак // Психологическое сопровождение образовательного процесса : сб. науч. ст. / редкол.: О.С. Попова (отв. ред.) [и др.]. – Минск, 2014. – С. 33-37";2014;;;7090;1
8;"Судебное правотворчество в контексте теории интерпретации и антропологической концепции права / В.И. Павлов, Н.М. Дубрава // Юридическая техника : ежегодник / Нижегородская акад. МВД России. – Н. Новгород, 2014. – № 8. – Ч. 2 : Демократизация правотворчества: доктрина, практика, техника. – С. 553-560";2014;;;7096;1
8;"Шляхта Новагародскага павета ў паспалітым рушэнні ВКЛ 1567 года / А. Радаман, А. Янушкевіч (А.А. Радоман) // Studia z dziejów Wielkiego Księstwa Litews¬kiego (XVI–XVIII w.) / Instytut historii PAN, Polskie towarzystwo heraldyczne ; red. S. Górzyński, M. Nagielski. – Warszawa : DiG, 2014. – S. 337–381";2014;;;7097;1
8;"Загальні основні напрями трансформації вищої педагогічної освіти Білорусі, Росії, України в пострадянський період [Електронний ресурс] / М.А. Бутько (М.А. Андарало) // Гілея: науковий вісник : зб. наук. пр. / Укр. акад. наук, Нац. пед. ун-т ім. М. П. Драгоманова. – К., 2013. –  № 72. – С. 730-735. – Режим доступу: http://nbuv.gov.ua/j-pdf/gileya_2013_72_141.pdf";2013;;;7099;2
8;"Личные неимщественные права акционеров по законодательству Республики Беларусь: общая характеристика / Н. Л. Бондаренко // Теория и практика применения гражданского и трудового законодательства в деятельности органов внутренних дел Республики Беларусь : сб. науч. ст. / учреждение образования «Акад М-ва внутр. дел Респ. Беларусь» ; редкол. : Д. А. Колбасин / отв. ред. [и др.]. – Минск : Акад. МВД, 2014. – С. 32-41";2014;;;7142;2
8;"Некоторые аспекты совершенствования порядка уплаты алиментов в пользу несовершенонлетних детей / Е. В. Боровая // Теория и практика применения гражданского и трудового законодательства в деятельности органов внутренних дел Республики Беларусь : сб. науч. ст. / учреждение образования «Акад М-ва внутр. дел Респ. Беларусь» ; редкол. : Д. А. Колбасин / отв. ред. [и др.]. – Минск : Акад. МВД, 2014. – С. 41-47";2014;;;7143;2
8;"Возмещение вреда в процессе реабилитации лиц, постадавших от незаконных действий органов уголовного преследования и суда / А. В. Войтюль // Теория и практика применения гражданского и трудового законодательства в деятельности органов внутренних дел Республики Беларусь : сб. науч. ст. / учреждение образования «Акад М-ва внутр. дел Респ. Беларусь» ; редкол. : Д. А. Колбасин / отв. ред. [и др.]. – Минск : Акад. МВД, 2014. – С. 57-63";2014;;;7144;2
8;"Ипотека как один из способов обеспечения исполнения кредитных обязательств в Республике Беларусь / А. В. Гоев // Теория и практика применения гражданского и трудового законодательства в деятельности органов внутренних дел Республики Беларусь : сб. науч. ст. / учреждение образования «Акад М-ва внутр. дел Респ. Беларусь» ; редкол. : Д. А. Колбасин / отв. ред. [и др.]. – Минск : Акад. МВД, 2014. – С. 64-69";2014;;;7145;2
8;"Правовое регулирование рабочего времени в трудовых кодексах государств – участников Содружества Независимых Государств: состояние и возможности совершенствования / А. А. Греченков // Теория и практика применения гражданского и трудового законодательства в деятельности органов внутренних дел Республики Беларусь : сб. науч. ст. / учреждение образования «Акад М-ва внутр. дел Респ. Беларусь» ; редкол. : Д. А. Колбасин / отв. ред. [и др.]. – Минск : Акад. МВД, 2014. – С. 69-80";2014;;;7146;2
8;"Государственные правовые гарантии в случае причинения вреда жизни или здоровью сотруднирка органов внутренних дел: права и возможности их реализации / Н. Н. Ермолкевич // Теория и практика применения гражданского и трудового законодательства в деятельности органов внутренних дел Республики Беларусь : сб. науч. ст. / учреждение образования «Акад М-ва внутр. дел Респ. Беларусь» ; редкол. : Д. А. Колбасин / отв. ред. [и др.]. – Минск : Акад. МВД, 2014. – С. 80-90";2014;;;7147;2
8;"Значение юридических конструкций в гражданском праве для правопременительной деятельности / Е. М. Ефременко // Теория и практика применения гражданского и трудового законодательства в деятельности органов внутренних дел Республики Беларусь : сб. науч. ст. / учреждение образования «Акад М-ва внутр. дел Респ. Беларусь» ; редкол. : Д. А. Колбасин / отв. ред. [и др.]. – Минск : Акад. МВД, 2014. – С. 90-94";2014;;;7148;2
8;"Состав, общая характеристика обязательств вследствие причинения вреда (теретико-правовой аспект) / Д. А. Колбасин // Теория и практика применения гражданского и трудового законодательства в деятельности органов внутренних дел Республики Беларусь : сб. науч. ст. / учреждение образования «Акад М-ва внутр. дел Респ. Беларусь» ; редкол. : Д. А. Колбасин / отв. ред. [и др.]. – Минск : Акад. МВД, 2014. – С. 95-109";2014;;;7149;2
8;"Гражданско-правовое положение осужденных к лишению свободы / Д. А. Колбасин, А. А. Песникевич // Теория и практика применения гражданского и трудового законодательства в деятельности органов внутренних дел Республики Беларусь : сб. науч. ст. / учреждение образования «Акад М-ва внутр. дел Респ. Беларусь» ; редкол. : Д. А. Колбасин / отв. ред. [и др.]. – Минск : Акад. МВД, 2014. – С. 109-117";2014;;;7150;2
8;"Сделки в деятельности органов внутренних дел / Л. М. Орлова // Теория и практика применения гражданского и трудового законодательства в деятельности органов внутренних дел Республики Беларусь : сб. науч. ст. / учреждение образования «Акад М-ва внутр. дел Респ. Беларусь» ; редкол. : Д. А. Колбасин / отв. ред. [и др.]. – Минск : Акад. МВД, 2014. – С. 128-137";2014;;;7151;2
8;"Вещественные доказательства как средства доказывания в гражданском процесс / М. А. Пашкеев, О. В. Пашкеева // Теория и практика применения гражданского и трудового законодательства в деятельности органов внутренних дел Республики Беларусь : сб. науч. ст. / учреждение образования «Акад М-ва внутр. дел Респ. Беларусь» ; редкол. : Д. А. Колбасин / отв. ред. [и др.]. – Минск : Акад. МВД, 2014. – С. 137-146";2014;;;7152;2
8;"Применение отдельных норм семейного законодательства в деятельности органов внутренних дел / В. И. Пенкрат // Теория и практика применения гражданского и трудового законодательства в деятельности органов внутренних дел Республики Беларусь : сб. науч. ст. / учреждение образования «Акад М-ва внутр. дел Респ. Беларусь» ; редкол. : Д. А. Колбасин / отв. ред. [и др.]. – Минск : Акад. МВД, 2014. – С. 146-153";2014;;;7153;2
