kind;outputdata;year;unused1;unused2;code;halfyear
8;"Действие уголовно-процессуального закона в пространстве, по лицам и во времени / П.В. Мытник, Г.Л. Козел // Вестник Академии МВД Республики Беларусь : науч.-практ. журн. – Минск, 2005. – № 1(9). – С. 89-94";2005;;;3737;
8;"Институт восстановления нарушенных прав, прописанный в УПК / П.В. Мытник // Актуальные проблемы повышения эффективности правового регулирования на современном этапе : межвуз. сб. науч. ст. / М-во образования Респ. Беларусь, Гродн. гос. ун-т им. Я. Купалы, Юрид. фак. ; редкол.: О.Н. Толочко (отв. ред.) [и др.]. – Гродно : ГрГУ, 2005. – С. 325-334";2005;;;3738;
8;"К вопросу об обеспечении прав и законных интересов жертв преступлений / П.В. Мытник // Судовы веснік : часоп. / Вярхоўны Суд Рэсп. Беларусь. – Минск, 2005. – № 2. – С. 50-52";2005;;;3739;
8;"О судебном контроле при производстве по материалам и уголовным делам / П.В. Мытник // Юстыцыя Беларусі : юрыд. навук.-практ. часоп. / Администрация Президента Респ. Беларусь, М-во юстиции Респ. Беларусь, Респ. коллегия адвокатов. – Минск, 2005. – № 1. – С. 39-41; № 2. – С. 54-56";2005;;;3740;
8;"Поддержание потерпевшим обвинения: право или обязанность? / П.В. Мытник // Закон и жизнь : Междунар. науч.-практ. журн. / М-во юстиции Респ. Молдова. – Кишинев, 2005. – № 9. – С. 33-36";2005;;;3741;
8;"Понятие «участники уголовного процесса», их классификация / П.В. Мытник, И.М. Князев // Вестник Академии МВД Республики Беларусь : науч.-практ. журн. – Минск, 2005. – № 2(10). – С. 89-92";2005;;;3742;
8;"Потерпевший в уголовном процессе (исторический экскурс: 1864-2001 гг.) / П.В. Мытник // Вестник Академии МВД Республики Беларусь : науч.-практ. журн. – Минск, 2005. – № 2(10). – С. 56-61";2005;;;3743;
8;"Производство по делам частного обвинения (об имеющихся проблемах) / П.В. Мытник // Вестник Академии МВД Республики Беларусь : науч.-практ. журн. – Минск, 2005. – № 1(9). – С. 85-89";2005;;;3744;
8;"Прослушивание и запись переговоров / П.В. Мытник // Проблемы криминалистики : сб. науч. тр. / М-во внутрен. дел Респ. Беларусь, Акад. МВД ; редкол.: Г.Н. Мухин (отв. ред.) [и др.]. – Минск : Акад. МВД Респ. Беларусь, 2005. – Вып. 3. – С. 116-125";2005;;;3745;
8;"Свидетель в уголовном процессе: круг лиц, не подлежащих допросу, свидетельский иммунитет / П.В. Мытник // Юстыцыя Беларусі : юрыд. навук.-практ. часоп. / Администрация Президента Респ. Беларусь, М-во юстиции Респ. Беларусь, Респ. коллегия адвокатов. – Минск, 2005. – № 7. – С. 48-51";2005;;;3746;
8;"Свидетель в уголовном процессе: понятие, круг лиц, не подлежащих допросу / П.В. Мытник // Юстыцыя Беларусі: юрыд. навук.-практ. часоп. / Администрация Президента Респ. Беларусь, М-во юстиции Респ. Беларусь, Респ. коллегия адвокатов. – Минск, 2005. – № 6. – С. 49-52";2005;;;3747;
8;"Сравнительно-правовой анализ понятия «освидетельствование» / П.В. Мытник // Проблемы криминалистики : сб. науч. тр. / М-во внутрен. дел Респ. Беларусь, Акад. МВД ; редкол.: Г.Н. Мухин (отв. ред.) [и др.]. – Минск : Акад. МВД Респ. Беларусь, 2005. – Вып. 2. – С. 177-186";2005;;;3748;
8;"Ходатайства в уголовном процессе: понятие, классификация и значение / П.В. Мытник // Труды Института национальной безопасности Республики Беларусь : сб. науч. тр. – Минск, 2005. – № 20. – С. 107-111";2005;;;3749;
8;"О некоторых проблемах прекращения производства по уголовному делу с освобождением от уголовной ответственности / П.В. Мытник // Право и демократия : межвуз. сб. науч. тр. / Белорус. гос. ун-т, Гродн. гос. ун-т им. Я. Купалы, Гомел. гос. ун-т им. Ф. Скорины, Акад. милиции МВД Респ. Беларусь. – Минск : Універсітэцкае, 2006. – Вып. 17. – С. 238-256";2006;;;3750;
8;"Обстоятельства, исключающие производство по уголовному делу (ст. 29 УПК): иллюзия общеизвестности? / П.В. Мытник // Юстыцыя Беларусі : юрыд. навук.-практ. часоп. / Администрация Президента Респ. Беларусь, М-во юстиции Респ. Беларусь, Респ. коллегия адвокатов. – Минск, 2005. – № 12. – С. 39-43; 2006. – № 1. – С. 47-51";2006;;;3751;
8;"Прекращение производства по уголовному делу (ст. 30 УПК Республики Беларусь) как альтернатива уголовному преследованию / П.В. Мытник // Судебная практика в контексте принципов законности и права : сб. науч. тр. / Институт переподготовки и повышения квалификации судей, работников прокуратуры, судов и учреждений юстиции БГУ ; редкол.: В.М. Хомич (гл. ред.) [и др.]. – Минск : Тесей, 2006. – С. 331-339";2006;;;3752;
8;"Процессуальное положение потерпевшего в национальном законодательстве / П.В. Мытник // Юридический журнал : ежекв. науч. и произв.-практ. журн. / Минский ин-т упр. – Минск, 2006. – № 3. – С. 58-62";2006;;;3753;
8;"Судебные прения и последнее слово обвиняемого / П.В. Мытник // Юстыцыя Беларусі : юрыд. навук.-практ. часоп. / Администрация Президента Респ. Беларусь, М-во юстиции Респ. Беларусь, Респ. коллегия адвокатов. – Минск, 2006. – № 9. – С. 53-57";2006;;;3754;
8;"Процессуальное положение потерпевшего в уголовном процессе  Республики Беларусь и Украины (в соответствии с общепризнанными принципами и нормами международного права) / П. Мытник, Н. Карпов // Закон и жизнь : Междунар. науч.-практ. журн. / М-во юстиции Респ. Молдова. – Кишинев, 2007. – № 4. – С. 32-37";2007;;;3755;
8;"Legal and Psychological Aspects of Non-custodial Penalties for Young Offenders in the Republic of Belarus / Viacheslav Shabanov (В.Б. Шабанов) // Internal security : semiannual journal / Publishers of the Police Academy in Szczytno. – Szczytno, 2011 (January-june). – V. 3. – Is. 1. – С. 231-237";2011;;;3768;1
8;"Компетентностный подход к переподготовке управленческих кадров органов внутренних дел / А.П. Леонов // Информ. бюл. МВД Респ. Беларусь. – Минск, 2010. – № 47. – С. 114-127";2010;;;3772;
8;"Подсистема «Административная практика» как инструмент контроля административной деятельности на местах / А.А. Сушко, В.В. Апанович // Сборник передового опыта организации оперативно-служебной деятельности подразделений милиции общественной безопасности / М-во внутрен. дел Респ. Беларусь. – Минск : Полиграф. центр МВД, 2010. – № 4. – С. 39-41";2010;;;3774;
8;"Технические резервы для выполнения программы «Минус 100» в период 2011–2015 гг. / А.А. Сушко, В.В. Бульбенков // Сборник передового опыта организации оперативно-служебной деятельности подразделений милиции общественной безопасности / М-во внутрен. дел Респ. Беларусь. – Минск : Полиграф. центр МВД, 2010. – № 2. – С. 39-45";2010;;;3775;
8;"Сравнительный анализ концептуально-программных документов, определяющих развитие педагогического образования Беларуси, России, Украины в постсоветский период / М.А. Андарало // Науковi записки : зб. наук. ст. / М-во освiти i науки Украiни ; Нац. пед. ун-т iм. М.П. Драгоманова ; укл. Л.Л. Макаренко. – К.: Вид-во НПУ iм. М.П. Драгоманова, 2011. – Вип. LХХХХIII (93). – С. 3-12";2011;;;3776;2
8;"Инновационные тенденции постсоветского развития систем высшего педагогического образования Беларуси, России, Украины / М.А. Андарало // Образование и наука в Беларуси: актуальные проблемы и перспективы развития в ХХІ веке : сб. науч. ст.: материалы докл. IV науч.-практ. конф. молодых ученых БГПУ (20 мая 2011 г.) / редкол.: В.В. Бущик (отв. ред.) [и др.] / Белорус. гос. пед. ун-т им. Максима Танка ; редкол. В.В. Бущик (отв. ред.), Д.И. Наумов, А.А. Корзюк [и др.] – Минск : БГПУ, 2011. – С. 15-16";2011;;;3778;1
8;"Современное состояние высшей педагогической школы Украины / М.А. Андарало // Актуальные вопросы современной науки : сб. науч. раб. / редкол.: В.В. Бущик (отв. ред.), Д.И. Наумов, Г.А. Космач [и др.] – Минск : БГПУ, 2011. – С. 34-36";2011;;;3779;2
8;"Случаи несовместимости глагольной семантики и значений временных форм в современном испанском языке / С.Е. Серегина // Гуманитарная наука сегодня : науч. журн. – Караганда, 2011. – № 3(3). – С. 17-23";2011;;;3782;2
8;"Цель в уголовном законе / А.Л. Савенок // Теоретические и прикладные проблемы применения уголовного закона : сб. науч. тр. / М-во внутр. дел Респ. Беларусь, учреждение образования «Акад. М-ва внутр. дел Респ. Беларусь» ; под ред. Э.А. Саркисовой. – Минск : Акад. МВД, 2011. – С. 4-9";2011;;;3787;2
8;"О подходах к оценке преступлений, совершаемых по неосторожности / Э.А. Саркисова // Теоретические и прикладные проблемы применения уголовного закона : сб. науч. тр. / М-во внутр. дел Респ. Беларусь, учреждение образования «Акад. М-ва внутр. дел Респ. Беларусь» ; под ред. Э.А. Саркисовой. – Минск : Акад. МВД, 2011. – С. 67-79";2011;;;3788;2
8;"Вопросы реформирования системы мер уголовной ответственности / С.В. Ананич // Теоретические и прикладные проблемы применения уголовного закона : сб. науч. тр. / М-во внутр. дел Респ. Беларусь, учреждение образования «Акад. М-ва внутр. дел Респ. Беларусь» ; под ред. Э.А. Саркисовой. – Минск : Акад. МВД, 2011. – С. 79-87";2011;;;3789;2
8;"Основные направления повышения эффективности уголовных наказаний, применяемых в отношении женщин / С.М. Свило // Теоретические и прикладные проблемы применения уголовного закона : сб. науч. тр. / М-во внутр. дел Респ. Беларусь, учреждение образования «Акад. М-ва внутр. дел Респ. Беларусь» ; под ред. Э.А. Саркисовой. – Минск : Акад. МВД, 2011. – С. 87-91";2011;;;3790;2
8;"Рабство – глобальная проблема современности / Н.И. Ретнёва // Теоретические и прикладные проблемы применения уголовного закона : сб. науч. тр. / М-во внутр. дел Респ. Беларусь, учреждение образования «Акад. М-ва внутр. дел Респ. Беларусь» ; под ред. Э.А. Саркисовой. – Минск : Акад. МВД, 2011. – С. 109-116";2011;;;3791;2
8;"Посягательства на установленный порядок миграции населения в Республике Беларусь: проблемы квалификации / О.И. Бахур // Теоретические и прикладные проблемы применения уголовного закона : сб. науч. тр. / М-во внутр. дел Респ. Беларусь, учреждение образования «Акад. М-ва внутр. дел Респ. Беларусь» ; под ред. Э.А. Саркисовой. – Минск : Акад. МВД, 2011. – С. 153-164";2011;;;3792;2
8;"Проблемные вопросы правовой оценки провокации и инсценировки совершения преступления / А.А. Сёмин // Теоретические и прикладные проблемы применения уголовного закона : сб. науч. тр. / М-во внутр. дел Респ. Беларусь, учреждение образования «Акад. М-ва внутр. дел Респ. Беларусь» ; под ред. Э.А. Саркисовой. – Минск : Акад. МВД, 2011. – С. 164-174";2011;;;3793;2
8;"Прикосновенность к преступлению: новые формы / С.Д. Пахомчик // Теоретические и прикладные проблемы применения уголовного закона : сб. науч. тр. / М-во внутр. дел Респ. Беларусь, учреждение образования «Акад. М-ва внутр. дел Респ. Беларусь» ; под ред. Э.А. Саркисовой. – Минск : Акад. МВД, 2011. – С. 174-181";2011;;;3794;2
8;"Взаимообусловленность принципов законности и социальной справедливости в контексте уголовной ответственности за преступления против интересов службы / А.А. Примаченок, Э.Ф. Мичулис // Теоретические и прикладные проблемы применения уголовного закона : сб. науч. тр. / М-во внутр. дел Респ. Беларусь, учреждение образования «Акад. М-ва внутр. дел Респ. Беларусь» ; под ред. Э.А. Саркисовой. – Минск : Акад. МВД, 2011. – С. 182-189";2011;;;3795;2
8;"Коррупция по законодательству Республики Беларусь и правовое обеспечение борьбы с ней / В.В. Мороз // Теоретические и прикладные проблемы применения уголовного закона : сб. науч. тр. / М-во внутр. дел Респ. Беларусь, учреждение образования «Акад. М-ва внутр. дел Респ. Беларусь» ; под ред. Э.А. Саркисовой. – Минск : Акад. МВД, 2011. – С. 190-206";2011;;;3796;2
8;"Правовые презумпции в контексте общих начал гражданского законодательства / Е.М. Ефременко // Конституционно-правовое регулирование общественных отношений в Республике Беларусь и других европейских государствах : сб. науч. ст. / Гродн. гос. ун-т им. Янки Купалы; редкол.: Н.В. Сильченко (отв. ред.) [и др.]. – Гродно : ГрГУ, 2011. – С. 308-311";2011;;;3951;2
8;"Институт гражданства (подданства) в зарубежных странах: сравнительно-правовой анализ / Н.М. Кондратович // Консультант Плюс : Беларусь. Технология 3000 [Электронный ресурс] / ООО «Юрспектр», Нац. центр правовой информ. Респ. Беларусь. – Минск, 2011";2011;;;3956;2
8;"Некоторые особенности участия сотрудников оперативно-розыскных подразделений органов внутренних дел  в производстве проверки показаний на месте / В.М. Логвин // Вестник Главного управления уголовного розыска МВД Респ. Беларусь. – 2011. – № 18. – С. 57-69";2011;;;3962;2
8;"Собирание и исследование доказательств голографическими средствами и методами / В.Л. Григорович // Вестник Сибирского юридического института МВД России : науч.-практ. журн. – Красноярск, 2011. – № 1(9). – С. 169-176";2011;;;3971;1
8;"О совершенствовании правового обеспечения розыска обвиняемых в Республике Беларусь / В.Ч. Родевич, А.Н. Толочко // Консультант Плюс : Беларусь. Технология 3000 [Электронный ресурс] / ООО «Юрспектр». – Минск, 2011";2011;;;3986;2
8;"Специальные профилактические меры предупреждения психологических ошибок в законотворческой деятельности / И.А Кибак // Вестник Казанского юридического института МВД России : науч.-теорет. журн. – Казань, 2011. − № 2(4). – С. 88-93";2011;;;3993;1
8;"Профессионально-психологические и моральные факторы в парламентской деятельности и их стрессово-кризисный потенциал / И.А. Кибак // Вестник Сибирского юридического института МВД России : науч.-практ. журн. – Красноярск, 2011. − № 2(9). – С. 177-182";2011;;;3994;1
8;"Методологические основания вузовского психологического сопровождения курсантов учебных заведений МВД / И.А. Кибак // Психологическое сопровождение образовательного процесса : сб. науч. ст. (по материалам Междунар. науч.-практ. конф. «Психологическое сопровождение образовательного процесса», Минск, 30 июня 2011 г.) / Учреждение образования «Респ. ин-т проф. образования»; редкол.: О.С. Попова (отв. ред.) [и др.]. – Минск : РИПО, 2011. – С. 33-37";2011;;;3998;2
8;"Проведение экспертизы в международном арбитражном процессе / А.С. Рубис, И.А. Мороз // Юрист в строительстве : профессиональный практ. журн. / Информац. правовое агентство Гревцова. – Минск, 2011. – № 5. – С. 60-62";2011;;;4006;2
8;"Нравственная культура молодежи – важный духовный ресурс общества / В.Т. Коновалов, В.И. Пачинин // Системная трансформация общества: инновации и традиции : сб. науч. тр. кафедр соц.-гум. наук / М-во обр. Респ. Беларусь, Учреждение образования ""Брестский государственный технический университет"" ;под общ. ред. проф. Л.Г. Титоренко. – Вып. VIII. – Брест : «БрГУ», 2011. – С. 94-97";2011;;;4015;2
8;"Реализация наказания в виде лишения свободы в отношении женщин (на примере Республики Беларусь) / С.М. Свило // Вестник Казанского юридического института МВД России : науч.-теорет. журн. – Казань, 2011. – № 3(5). – С. 42-47";2011;;;4022;2
8;"Понятие, содержание и основные направления прокурорского надзора Республики Беларусь на современном этапе развития / В.В. Меркушин // Консультант Плюс: Беларусь. Технология 3000 [Электронный ресурс] / ООО «Юрспектр». – Минск, 2011";2011;;;4035;2
8;"Арест в административном и уголовном праве: о соотношении взыскания и наказания / В.В. Меркушин // Консультант Плюс: Беларусь. Технология 3000 [Электронный ресурс] / ООО «Юрспектр». – Минск, 2011";2011;;;4036;2
8;"Специфика организации и деятельности органов военной прокуратуры в Республике Беларусь Беларусь / В.В. Меркушин // Консультант Плюс: Беларусь. Технология 3000 [Электронный ресурс] / ООО «Юрспектр». – Минск, 2011";2011;;;4039;2
8;"Правовые основы прохождения службы в органах прокуратуры в Республике Беларусь Беларусь / В.В. Меркушин // Консультант Плюс: Беларусь. Технология 3000 [Электронный ресурс] / ООО «Юрспектр». – Минск, 2011";2011;;;4040;2
