kind;outputdata;year;unused1;unused2;code;halfyear
10;"Методическая разработка для проведения семинарского занятия по дисциплине «Конституционное право зарубежных стран» на примере темы «Глава государства в зарубежных странах» / М.Г. Головач // Организация образовательного процесса : информ.-метод. сб. / М-во внутрен. дел Респ. Беларусь, Акад. МВД. – Минск : Акад. МВД Респ. Беларусь, 2008. – № 4(2). – С. 113-121";2008;;;53;
10;"Программа педагогической практики адъюнктов Академии МВД Республики Беларусь (для адъюнктов 2-го года обучения) / Е.И. Климова ; М-во внутрен. дел Респ. Беларусь, Акад. МВД. – Минск : Акад. МВД Респ. Беларусь, 2009. – 18 с.";2009;;;60;
10;"Методика расследования поджогов и преступных нарушений правил пожарной безопасности : лекция / И.В. Капустина ; М-во внутрен. дел Респ. Беларусь, Акад. МВД, каф. криминалистики. – Минск : Акад. МВД Респ. Беларусь, 2007. – 36 с.";2007;;;74;
10;"Особенности расследования хищений денежных средств с использованием банковских пластиковых карточек : лекция / Н.И. Лагун, О.Ю. Шпак ; М-во внутрен. дел Респ. Беларусь, Акад. МВД. – Минск : Акад. МВД Респ. Беларусь, 2009. – 31 с.";2009;;;75;
10;"Современные возможности криминалистического обеспечения органов уголовного преследования : лекция / В.М. Логвин ; М-во внутрен. дел Респ. Беларусь, Акад. МВД ; каф. криминалистики. – Минск : Акад. МВД Респ. Беларусь, 2007. – 56 с.";2007;;;76;
10;"Методика расследования криминальных взрывов : лекция / М.В. Галезник; М-во внутрен. дел Респ. Беларусь, Акад. МВД, каф. криминалистики. – Минск : Акад. МВД Респ. Беларусь, 2007. – 39 с.";2007;;;79;
10;"Расследование преступлений, связанных с воспрепятствованием законной предпринимательской деятельности : лекция / О.Ю. Шпак, Н.И. Лагун ; М-во внутрен. дел Респ. Беларусь, Акад. МВД, каф. криминалистики. – Минск : Акад. МВД Респ. Беларусь, 2007. – 28 с.";2007;;;80;
10;"Методика расследования легализации (отмывания) материальных ценностей, приобретенных преступным путем : лекция / О.В. Маркова ; М-во внутрен. дел Респ. Беларусь, Акад. МВД, каф. криминалистики.  – Минск : Акад. МВД Респ. Беларусь, 2007. – 42 с.";2007;;;81;
10;"Следователь – профессия необычная / Н.И. Порубов // Организация образовательного процесса : информ.-метод. сб. / М-во внутрен. дел Респ. Беларусь, Акад. МВД. – Минск : Акад. МВД Респ. Беларусь, 2007. – № 1(1). – С. 123-127";2007;;;162;
10;"Современные возожности технико-криминалистического обеспечения предварительного следствия : лекция / Г.Б. Дергай ; М-во внутрен. дел Респ. Беларусь, Акад. МВД. – Минск : Акад. МВД Респ. Беларусь, 2008. – 27 с.";2008;;;287;
10;"Тактико-криминалистическое обеспечение проведения судебной экспертизы. Современные возможности судебно-экспертных учреждений : лекция / В.Ф. Бурейко, Г.Б. Дергай ; М-во внутрен. дел Респ. Беларусь, Акад. МВД, каф. криминалистики. – Минск : Акад. МВД Респ. Беларусь, 2007. – 45 с.";2007;;;288;
10;"Основы служебной культуры сотрудников ОВД : лекция [для слушателей факультета повышения квалификации и переподготовки руководящих кадров] / М.Ю. Узгорок, И.А. Андарало ; М-во внутрен. дел Респ. Беларусь, Акад. МВД. – Минск : Акад. МВД Респ. Беларусь, 2009. − 31 с.";2009;;;388;
10;"Служебная этика сотрудников ОВД : лекция / М.Ю. Узгорок, И.А. Андарало ; М-во внутрен. дел Респ. Беларусь, Акад. МВД, каф. психологии и педагогики. – Минск : Акад. МВД Респ. Беларусь, 2009. − 47 с.";2009;;;389;
10;"Милицейская риторика. Или как мы говорим / В.Л. Голубев // Милиция Беларуси : правовой литер.-публиц. журн. / МВД Респ. Беларусь. – 2010. – № 1. – С. 20-23";2010;;;390;
10;"Формирование положительного имиджа о деятельности органов внутренних дел Республики Беларусь (методические рекомендации) / И.А. Кибак, В.А. Гончаров // Организация образовательного процесса : информ.-метод. сб. / М-во внутрен. дел Респ. Беларусь, Акад. МВД. – Минск : Акад. МВД Респ. Беларусь, 2008. – № 4(2). – С. 121-129";2008;;;392;
10;"Может ли вузовская лекция быть разной? / В. Л. Голубев // Организация образовательного процесса : информ.-метод. сб. / М-во внутрен. дел Респ. Беларусь, Акад. МВД. – Минск : Акад. МВД Респ. Беларусь, 2007. – № 2(2). – С. 51-54";2007;;;395;
10;"Активизация познавательной деятельности обучаемых – залог их профессиональной компетентности / П. Д. Горбарук // Организация образовательного процесса : информ.-метод. сб. / М-во внутрен. дел Респ. Беларусь, Акад. МВД. – Минск : Акад. МВД Респ. Беларусь, 2007. – № 1(1). – С. 112-118";2007;;;396;
10;"Возможности и задачи учебного заведения в воспитательном процессе / П. Д. Горбарук // Организация образовательного процесса: информ.-метод. сб. / М-во внутрен. дел Респ. Беларусь, Акад. МВД. – Минск: Акад. МВД Респ. Беларусь, 2007. – № 2(2). – С. 54-60";2007;;;397;
10;"Повышение роли эстетизации и художественной содержательности познавательной деятельности курсантов / П. Д. Горбарук // Организация образовательного процесса : информ.-метод. сб. / М-во внутрен. дел Респ. Беларусь, Акад. МВД. – Минск : Акад. МВД Респ. Беларусь, 2010. – № 6(1). – С. 76-83";2010;;;398;
10;"Пути и методы повышения качества педагогического процесса в высшей школе / П.Д. Горбарук // Организация образовательного процесса : информ.-метод. сб. / М-во внутрен. дел Респ. Беларусь, Акад. МВД. – Минск : Акад. МВД Респ. Беларусь, 2008. – № 3(1). – С. 161-166";2008;;;399;
10;"Лекция как ведущая форма учебных занятий в вузе. Основные требования к лекции / А. А. Урбанович // Организация образовательного процесса : информ.-метод. сб. / М-во внутрен. дел Респ. Беларусь, Акад. МВД. – Минск : Акад. МВД Респ. Беларусь, 2009. – № 5(1). – С. 77-81";2009;;;400;
10;"Лекция как ведущая форма учебных занятий в вузе. Методика подготовки лекции / А.А. Урбанович // Организация образовательного процесса : информ.-метод. сб. / М-во внутрен. дел Респ. Беларусь, Акад. МВД. – Минск : Акад. МВД Респ. Беларусь, 2010. – № 6(1). – С. 61-64";2010;;;401;
10;"Особенности мотивации обучаемых при изучении психолого-педагогических дисциплин на основе рейтинговой системы / А.А. Урбанович // Организация образовательного процесса : информ.-метод. сб. / М-во внутрен. дел Респ. Беларусь, Акад. МВД. – Минск : Акад. МВД Респ. Беларусь, 2008. – № 3(1). – С. 182-189";2008;;;402;
10;"Психологические особенности деятельности преподавателя / А.А. Урбанович // Организация образовательного процесса : информ.-метод. сб. / М-во внутрен. дел Респ. Беларусь, Акад. МВД. – Минск : Акад. МВД Респ. Беларусь, 2008. – № 4(2). – С. 103-108";2008;;;403;
10;"Профессора и студенты Полоцкой иезуитской академии / В.Л. Голубев // Организация образовательного процесса : информ.-метод. сб. / М-во внутрен. дел Респ. Беларусь, Акад. МВД. – Минск : Акад. МВД Респ. Беларусь, 2008. – № 4(2). – С. 133-136";2008;;;404;
10;"Имидж сотрудника органов внутренних дел как фактор формирования позитивного общественного мнения о работе органов внутренних дел Республики Беларусь / И. А. Кибак // Организация образовательного процесса : информ.-метод. сб. / М-во внутрен. дел Респ. Беларусь, Акад. МВД. – Минск : Акад. МВД Респ. Беларусь, 2009. – № 5(1). – С. 92-104";2009;;;405;
10;"Задачи практических занятий по психологическим дисциплинам и их реализация / А. Н. Пастушеня // Организация образовательного процесса : информ.-метод. сб. / М-во внутрен. дел Респ. Беларусь, Акад. МВД. – Минск : Акад. МВД Респ. Беларусь, 2009. – № 5(1). – С. 69-76";2009;;;428;
10;"Некоторые аспекты дополнительной практики курсантов уголовно-исполнительного факультета Академии МВД Республики Беларусь / И.М. Куприенко // Организация образовательного процесса : информ.-метод. сб. / М-во внутрен. дел Респ. Беларусь, Акад. МВД. – Минск : Акад. МВД Респ. Беларусь, 2008. – № 3(1). – С. 173-177";2008;;;575;
10;"Приостановление и возобновление предварительного расследования : лекция / И.В. Данько ; М-во внутрен. дел Респ. Беларусь, Акад. МВД. – Минск : Акад. МВД Респ. Беларусь, 2009. – 19 с.";2009;;;642;
10;"Уголовно-процессуальные документы, сроки и издержки : лекция / И.В. Данько ; М-во внутрен. дел Респ. Беларусь, Акад. МВД. – Минск : Акад. МВД Респ. Беларусь, 2008. – 24 с.";2008;;;643;
10;"Педагогические условия формирования компетенции студента в области интерактивного обучения / В.В. Мелешко, Ю.В. Гуща // Организация образовательного процесса : информ.-метод. сб. / М-во внутрен. дел Респ. Беларусь, Акад. МВД. – Минск : Акад. МВД Респ. Беларусь,  2010. – № 6(1). – С. 83-88.";2010;;;659;
10;"Горыч гiстарычнай праўды / Э.А. Саркісава (Э.А. Саркисова) // Лiтаратура i мастацтва. – 2009. – 28 авг.";2009;;;853;
10;"Криминалистическое исследование документов, изготовленных с использованием средств полиграфии : лекция / Н.В. Ефременко, О.С. Бочарова ; М-во внутрен. дел Респ. Беларусь, Акад. МВД. – Минск : Акад. МВД Респ. Беларусь, 2008. – 63 с.";2008;;;1275;
10;"Некоторые особенности осуществления иностранных инвестиций в Республике Беларусь / Н.В. Коноплицкий. – Минск : Проектное и научно-исследовательское республиканское предприятие «Гопросвязь», 2007. – 3 с.";2007;;;1391;
10;"Информационно-справочные материалы как фактор повышения успеваемости курсантов, студентов и слушателей Академии МВД / А.И. Авраменко, Ю.Р. Тихонов, А.Я. Коховец // Организация образовательного процесса : информ.-метод. сб. / М-во внутрен. дел Респ. Беларусь, Акад. МВД. – Минск : Акад. МВД Респ. Беларусь, 2007. – № 1(1). – С. 83-100";2007;;;1404;
10;"О формировании здорового образа жизни / Ю.С. Тихонов, П.Л. Боровик // Здоровье и успех : попул. мед. журн. / Изд.: Ред. газ. ""Вечер. Минск"". –  2008. – № 11(151). – С. 19-20";2008;;;1421;
10;"Потребности и ресурсы. Проблема выбора в экономике : лекция / И.Н. Бобкова ; М-во внутрен. дел Респ. Беларусь, Акад. МВД. – Минск : Акад. МВД Респ. Беларусь, 2010. – 23 с.";2010;;;1482;
10;"Экономические системы. Рыночная система хозяйствования : лекция / И.Н. Бобкова ; М-во внутрен. дел Респ. Беларусь, Акад. МВД. – Минск : Акад. МВД Респ. Беларусь, 2010. – 39 с.";2010;;;1483;
10;"Экономическая теория : предмет и метод : лекция / И.Н. Бобкова ; М-во внутрен. дел Респ. Беларусь, Акад. МВД. – Минск : Акад. МВД Респ. Беларусь, 2010. – 27 с.";2010;;;1484;
10;"Разрешение земельных споров. Ответственность за нарушение земельного законодательства : лекция / А.Н. Лепехин ; М-во внутрен. дел Респ. Беларусь, Акад МВД. – Минск : Акад. МВД Респ. Беларусь, 2009. – 27 с.";2009;;;1496;
10;"Совершенствование практических навыков компьютерного набора текстовых документов курсантами Академии МВД Республики Беларусь / Н.М. Бобович, А.П. Жалов // Организация образовательного процесса : информ.-метод. сб. / М-во внутрен. дел Респ. Беларусь, Акад. МВД. – Минск : Акад. МВД Респ. Беларусь, 2008. – № 3(1). – С. 153-155";2008;;;1505;
10;"Об интенсификации управляемой самостоятельной работы курсантов за счет использования электронных курсов обучения / Н.М. Бобович, П.Л. Боровик // Организация образовательного процесса : информ.-метод. сб. / М-во внутрен. дел Респ. Беларусь, Акад. МВД. – Минск : Акад. МВД Респ. Беларусь, 2008. – № 4(2). – С. 109-112";2008;;;1506;
10;"Использование тестовых форм контроля в дистанционном обучении / Н. М. Бобович // Организация образовательного процесса : информ.-метод. сб. / М-во внутрен. дел Респ. Беларусь, Акад. МВД. – Минск : Акад. МВД Респ. Беларусь, 2009. – № 5(1). – С. 82-84";2009;;;1509;
10;"Компьютерное тестирование по информатике курсантов первых курсов Академии МВД Республики Беларусь / Н.М. Бобович, Е.П. Синькова // Организация образовательного процесса:  информ.-метод. сб. / М-во внутрен. дел Респ. Беларусь, Акад. МВД. – Минск : Акад. МВД Респ. Беларусь, 2007. – № 1(1). – С. 100-102";2007;;;1513;
10;"Внедрение энергосберегающих технологий в процессе проектирования и эксплуатации ПАСТ / Б.Л. Кулаковский, В.И. Маханько, А.В. Кузнецов, С.Л. Томчук. – Минск : КИИ МЧС Республики Беларусь, 2008. – 36 с.";2008;;;1548;
10;"Основы учения о правовых отношениях : лекция / В.А. Кучинский ; М-во внутрен. дел Респ. Беларусь, Акад. МВД, каф. теории и истории гос-ва и права. – Минск : Акад. МВД Респ. Беларусь, 2008. – 27 с.";2008;;;1607;
10;"История создания и деятельности службы по борьбе с экономическими преступлениями (ОБХСС – БЭП) Беларуси : лекция / С.Ф. Лапанович ; М-во внутрен. дел Респ. Беларусь, Акад. МВД. – Минск : Акад. МВД Респ. Беларусь, 2010. – 39 с.";2010;;;1609;
10;"История органов внутренних дел (из истории становления и деятельности уголовного розыска в Беларуси) : лекция / С.А. Семенова ; М-во внутрен. дел Респ. Беларусь, Акад. МВД. – Минск : Акад. МВД Респ. Беларусь, 2010. – 40 с.";2010;;;1610;
10;"Белорусская история : науч.-попул. очерк / П.Г. Чигринов. – Минск : Современная школа, 2010. – 928 с.";2010;;;1716;
10;"Тайна Великого князя : [исторический остросюжетный роман] / П. Чигринов. – Минск : Современная школа, печ. 2009 (макет 2010). – 382 c.";2010;;;1717;
10;"Особенности тестирования как способа контроля знаний / Ф.В. Пекарский // Организация образовательного процесса : информ.-метод. сб. / М-во внутрен. дел Респ. Беларусь, Акад. МВД. – Минск : Акад. МВД Респ. Беларусь, 2007. – № 1(1). – С. 119-122";2007;;;1747;
10;"Преимущества и недостатки модульно-рейтинговой модели образования / Ф.В. Пекарский // Организация образовательного процесса : информ.-метод. сб. / М-во внутрен. дел Респ. Беларусь, Акад. МВД. – Минск : Акад. МВД Респ. Беларусь, 2010. – № 6(1). – С. 90-9.";2010;;;1748;
10;"Трудных детей не бывает / авт.-сост.: В.И. Пенкрат, Л.В. Пенкрат, Н.В. Самусева. – Минск : Красико-Принт, 2010. – 173 с. – (Школа и семья)";2010;;;1855;
10;"Методика подготовки компьютерных презентаций / А. Я. Коховец // Организация образовательного процесса : информ.-метод. сб. / М-во внутрен. дел Респ. Беларусь, Акад. МВД. – Минск : Акад. МВД Респ. Беларусь, 2009. – № 5(1). – С. 104-107";2009;;;1881;
10;"Теория и практика создания электронных учебников / П.Л. Боровик // Организация образовательного процесса : информ.-метод. сб. / М-во внутрен. дел Респ. Беларусь, Акад. МВД. – Минск : Акад. МВД Респ. Беларусь, 2009. – № 5(1). – С. 85-91";2009;;;1886;
10;"Производство по уголовным делам о преступлениях, совершенных лицами в возрасте до 18 лет : лекция / П.В. Мытник ; М-во внутрен. дел Респ. Беларусь, Акад. МВД, каф. уголов. процесса. – Минск : Акад. МВД Респ. Беларусь, 2010. – 62 с.";2010;;;2001;
10;"Гражданский иск в уголовном процессе : лекция / И.В. Данько ; М-во внутрен. дел Респ. Беларусь, Акад. МВД, каф. уголовного процесса. – Минск : Акад. МВД Респ. Беларусь, 2010. – 23 с.";2010;;;2007;
10;"Анализ качества автоматизированных тестов контроля знаний, реализованных в модульной объектно-ориентированной динамической обучающей среде ""МOODLE"" / П.Л. Боровик // Организация образовательного процесса : информ.-метод. сб. / М-во внутрен. дел Респ. Беларусь, Акад. МВД. – Минск : Акад. МВД Респ. Беларусь, 2010. – № 6(1). – С. 65-68";2010;;;2008;
10;"Подготовка курсовых работ студентами вузов гуманитарного профиля в контексте совершенствования контроля за качеством образования / Е.М. Ефременко // Организация образовательного процесса : информ.-метод. сб. / М-во внутрен. дел Респ. Беларусь, Акад. МВД. – Минск : Акад. МВД Респ. Беларусь, 2010. – № 6(1). – С. 88-89";2010;;;2009;
10;"Коллоквиум как форма контроля знаний / С.М. Свило, Н.В. Крынская (Платонова) // Организация образовательного процесса : информ.-метод. сб. / М-во внутрен. дел Респ. Беларусь, Акад. МВД. – Минск : Акад. МВД Респ. Беларусь, 2010. – № 6(1). – С. 92-93";2010;;;2010;
