kind;outputdata;year;unused1;unused2;code;halfyear
8;"Юридическая конфликтология как новое научное направление и ее место в системе традиционного юридического знания / В.И. Павлов // Вестник Полоцкого государственного университета = Веснік Полацкага дзяржаўнага універсітэта : науч.-теорет. ежемес. журн. – Серия D: Экономические и юридические науки = Серыя D: Эканамічныя і юрыдычныя навукі. – Полоцк, 2009. – № 4. – С. 95-99";2009;;;1626;
8;"Проблема доступности законодательства в контексте развития национальной правовой системы (общетеоретический аспект) / В.И. Павлов // Право в современном белорусском обществе: сб. науч. тр. / Нац. центр законодательства и правовых исследований Респ. Беларусь; редкол.: В.И. Семенков (гл. ред.), Г.А. Василевич (зам. гл. ред.) [и др.]. – Минск : Право и экономика, 2009. – Вып. 4. – С. 72-89";2009;;;1627;
8;"Государство, личность и общество в Российском либерализме / А.Ф. Вишневский // Сацыяльна-эканамічныя і прававыя даследаванні : навук.-практ. і інфарм.-метадыч. часоп. / Прыватная ўстанова адукацыі ""БІП – Інстытут правазнаўства"". – Минск, 2007. – № 2. – С. 124-141";2007;;;1628;
8;"Организационно-правовые основы становления альтернативной службы граждан в первые годы советской власти / А.Ф. Вишневский, К.В. Стволыгин // Вестник Академии МВД Республики Беларусь : науч.-практ. журн. – Минск, 2007. – № 1(13). – С. 8-12";2007;;;1629;
8;"Прававыя асновы пазасудовых паўнамоцтваў спецыяльных органаў савецкай дзяржавы (1917–1922 гг.) / А.Ф. Вішнеўскі (А.Ф. Вишневский) // Сацыяльна-эканамічныя і прававыя даследаванні : навук.-практ. і інфарм.-метадыч. часоп. / Прыватная ўстанова адукацыі ""БІП – Інстытут правазнаўства"". – Минск, 2007. – № 3. – С. 107-124";2007;;;1630;
8;"Развитие учения о юридических фактах как основаниях возникновения правоотношений / А.Ф. Вишневский // Современные проблемы правовых отношений : сб. науч. тр. / М-во внутрен. дел Респ. Беларусь, Акад. МВД ; под ред. В.А. Кучинского и Э.А. Саркисовой. – Минск : Акад. МВД Респ. Беларусь, 2008. – С. 34-51";2008;;;1631;
8;"Юрыдычная палітыка царызму ў кантэксце фарміравання і дзейнасці органаў палітычнай юстыціі савецкай дзяржавы / А.Ф. Вішнеўскі (А.Ф. Вишневский) // Вестник Академии МВД Республики Беларусь : науч.-практ. журн. – Минск, 2007. – № 1(13). – С. 3-7";2007;;;1632;
8;"Право в современном белорусском обществе / В.А. Кучинский // Сборник научных трудов института государства и права НАН Беларуси. – Минск: НООО ""Право и экономика"", 2007. –  Вып. 2. – С. 91-107";2007;;;1633;
8;"Содержание правоотношений: права и обязанности или поведение сторон? / В.А. Кодавбович, В.А. Кучинский // Юридический журнал : ежекв. науч. и произв.-практ. журн. / Минский ин-т упр. – Минск, 2007. – № 2(10). – С. 47-51";2007;;;1634;
8;"Проблемы теории правотворчества в классической политико-правовой мысли Нового времени: Томас Гоббс / С.В. Липень // История государства и права: федер. науч.-практ. журн. / Изд. гр. «Юрист». – М., 2007. – № 10. – С. 33-35";2007;;;1636;
8;"Абсолютное добро, личная свобода и смертная казнь: историко-философский анализ / В.И. Павлов // Сацыяльна-эканамічныя і прававыя даследаванні : навук.-практ. і інфарм.-метадыч. часоп. / Прыватная ўстанова адукацыі ""БІП – Інстытут правазнаўства"". – Минск, 2007. – № 3(9). – С. 81-93";2007;;;1638;
8;"Проблема интеграции западноевропейских правовых институтов в национальную правовую систему с позиции социокультурных различий (общие положения) / В.И. Павлов // Национальная государственность и европейские интеграционные процессы. В 2 т. - Т.1. Национальное законодательство и его гармонизация с правом Европейского Союза: сб. науч. тр. / Белорус. гос. ун-т, юрид. фак.; редкол.; С.А. Балашенко [и др.]. – Минск: Изд. центр БГУ, 2008. – С. 128-135";2008;;;1642;
8;"Юридический конфликт и правоотношение: теоретико-методологические вопросы соотношения / В.И. Павлов // Современные проблемы правовых отношений : сб. науч. тр. / М-во внутрен. дел Респ. Беларусь, Акад. МВД ; под ред. В.А. Кучинского и Э.А. Саркисовой. – Минск : Акад. МВД Респ. Беларусь, 2008. – С. 153-169";2008;;;1643;
8;"Вайсковыя шляхецкія з’езды (попісы і зборы паспалітага рушэння) Новагародскага павета ў другой палове XVI ст. / А.А. Радоман // Парламенцкія структуры ўлады ў сістэме дзяржаўнага кіравання Вялікага княства Літоўскага, Рускага і Жамойцкага і Рэчы Паспалітай у XV-XVIII стагоддзях: стан і перспектывы даследаванняў : матэр. Міжнар. навук. канф., прысвеч. 500-ым угодкам правядзення першага вальнага сойма ВКЛ з удзелам шляхецкіх прадстаўнікоў (Мінск, 23-24 лістапада 2007 г.) / БІП – Інстытут правазнаўства; навук. рэд. С.Ф. Сокал, А.М. Янушкевіч. – Мінск : БІП-С Плюс, 2008. – С. 220-231";2008;;;1644;
8;"Земскія ўраднікі Менскага ваяводства ў другой палове XVI – першай палове XVII стст. / А. Радаман (А. Радоман), Д. Вілімас, В. Галубовіч // Полацкія гістарычныя запіскі = Commentarii polocenses historici: навуковы часопіс. – Наваполацк, 2006. – Том III. – С. 65-69. (Вступительная статья)";2006;;;1645;
8;"Участие милиции Беларуси в организации и развитии патроната детей-сирот в послевоенные годы (1944-1950 гг.) / В.А. Данилов // Вестник Академии МВД Республики Беларусь : науч.-практ. журн. – Минск, 2009. – № 1(17). – С. 7-11";2009;;;1646;
8;"Методологический анализ Всеобщей декларации прав человека и возможность ее реализации в современном мире / В.П. Шиенок // Балтийский Юридический Журнал : науч.-практ. изд. / Балтийская Междунар. Акад. – Рига, 2009. – № 2(16). – С. 52-58";2009;;;1649;
8;"Возможность реализации целей Всеобщей декларации прав человека в современном мире / В.П. Шиенок // Всеобщей декларации прав человека 60 лет : генезис, эволюция и проблемы современного прочтения : сб. науч. тр. / М-во внутрен. дел Респ. Беларусь, Акад. МВД ; под ред. А.Ф. Вишневского (отв. ред.), В.А. Кучинского и С.Е. Данилюка. – Минск : Акад. МВД Респ. Беларусь, 2009. – С. 212-222";2009;;;1650;
8;"Нравственные основы правоприменительной деятельности / Е.В. Борщева // Теоретические и практические проблемы правоприменения : сб. науч. тр. / под ред. В.А. Кучинского ; М-во внутрен. дел Респ. Беларусь, учреждение образования «Акад. М-ва внутрен. дел Респ. Беларусь». – Минск : Акад. МВД, 2010. – С. 118-127";2010;;;1652;
8;"Необходимо ли взаимодействие богословского и юридического дискурсов или о возможности синергийно-антропологической концепции права / В.И. Павлов // Институт синергийной антропологии [Электронный ресурс]. – Режим доступа : http://www.synergia-isa.ru/?page_id=9#P. – Дата доступа : 25.05.2010";2010;;;1654;
8;"Гуманистический потенциал белорусской философии / А.А. Козел // Чалавек. Грамадства. Свет : штокв. навук.-метад. часоп. / Рэд. часоп. ""Адукацыя і выхаванне"". – Минск, 2007. – № 4. – С. 9-13";2007;;;1718;
8;"Западнорусизм и белорусская национальная идея / А. А. Козел // Чалавек. Грамадства. Свет : штокв. навук.-метад. часоп. / Рэд. часоп. ""Адукацыя і выхаванне"". – Минск, 2009. – № 5. – С. 8-12";2009;;;1719;
8;"Духовность и ее измерение в пространстве права и государства (к пониманию духовности) (статья первая) / А.А. Козел, В.И. Павлов // Вестник Академии МВД Республики Беларусь : науч.-практ. журн. – Минск, 2008. – № 2(16). – С. 13-17";2008;;;1721;
8;"Актуальные проблемы формирования исторической памяти у курсантов Академии МВД Республики Беларусь / Л.Е. Лойко // Вестник Академии МВД Республики Беларусь : науч.-практ. журн. – Минск, 2008. – № 2(16). – С. 17-23";2008;;;1722;
8;"Идея вечного возвращения как феномен сакральной культуры / П. Г. Мартысюк // Вестник Московского государственного университета культуры и искусств = Вестник МГУКИ: науч. журн. – Химки (Моск. обл.), 2008. – № 1. – С. 27-32";2008;;;1724;
8;"Идея вечного возвращения как феномен культуры / П. Г. Мартысюк // Чалавек. Грамадства. Свет : штокв. навук.-метад. часоп. / Рэд. часоп. ""Адукацыя і выхаванне"". – Минск, 2007. – № 1. – С. 10-17";2007;;;1725;
8;"Культура личности / П.Г. Мартысюк // Чалавек. Грамадства. Свет: штокв. навук.-метад. часоп. / Рэд. часоп. ""Адукацыя і выхаванне"". – Минск, 2009. – № 4. – С. 50";2009;;;1727;
8;"Культура речи / П.Г. Мартысюк // Чалавек. Грамадства. Свет: штокв. навук.-метад. часоп. / Рэд. часоп. ""Адукацыя і выхаванне"". – Минск, 2009. – № 4. – С. 49";2009;;;1728;
8;"Миф / П.Г. Мартысюк // Чалавек. Грамадства. Свет: штокв. навук.-метад. часоп. / Рэд. часоп. ""Адукацыя і выхаванне"". – Минск, 2009. – № 3. – С. 60";2009;;;1729;
8;"Мифологема начала в культуре Авангарда / П. Г. Мартысюк // Чалавек. Грамадства. Свет: штокв. навук.-метад. часоп. / Рэд. часоп. ""Адукацыя і выхаванне"". – Минск, 2007. – № 3. – С. 37-42";2007;;;1730;
8;"Мифологические основания культуротворчества / П.Г. Мартысюк // Вопросы культурологии: науч.-практ. и метод. журн. / Издательский Дом «Панорама». – М., 2007. – № 12. – С. 75-78";2007;;;1731;
8;"Место мифа в экологической культуре / П.Г. Мартысюк // Вестник Московского государственного университета культуры и искусств = Вестник МГУКИ: науч. журн. – Химки (Моск. обл.), 2007. – № 6(20). – С. 15-19";2007;;;1732;
8;"Проблема культуры в творчестве Ф. Ницше / П.Г. Мартысюк // Чалавек. Грамадства. Свет: штокв. навук.-метад. часоп. / Рэд. часоп. ""Адукацыя і выхаванне"". – Минск, 2008. – № 4. – С. 29-32";2008;;;1735;
8;"Феномен восполнения утраченных благ как источник формирования этнокультурных архетипов восточнославянской культуры / П.Г. Мартысюк // Вопросы культурологии: науч.-практ. и метод. журн. / Издательский Дом «Панорама». – М., 2007. – № 8. – С. 65-68";2007;;;1736;
8;"Феномен восполнения утраченных благ как источник формирования этнокультурных архетипов восточнославянской культуры / П.Г. Мартысюк // МИТС-НАУКА: междунар. науч. вестник: сетевое электр. науч. изд. [Электронный ресурс]. – 2007. – № 2. – Режим доступа: http://www.giop.ru/REOS/nauka.nsf/0/879DBAE17CB343D7C3257291003EF569/$FILE/23%20Мартысюк%20Павел%20Григорьевич%20статья.pdf . – Дата доступа: 28.09.2010";2007;;;1737;
8;"Анализ социальных ролей в субкультуре хакеров / С.В. Масленченко // Аналитика культурологии: электронное научное издание. – 2008. – № 1(10). – Режим доступа: http://www.analiculturolog.ru/index.php?module =subjects&func=viewpage&pageid=456, свободный – Загл. с экрана";2008;;;1738;
8;"Духовность в условиях цикличности экономических кризисов / С.В. Масленченко // Управление защитой информации : ежекв. рос.-белорус. науч.-практ. журн. / МАРФИ. – Минск, 2008. – Том 12. – № 4. – С. 477-483";2008;;;1739;
8;"Киберкультура и молодежь: потенциальные векторы взаимовлияния / С.В. Масленченко // Управление защитой информации : ежекв. рос.-белорус. науч.-практ. журн. / МАРФИ. – Минск, 2007. – № 2. – С. 245-249";2007;;;1740;
8;"Контент-анализ субкультуры хакеров в рамках изучения социально-гуманитарных дисциплин / С.В. Масленченко // Юрист-онлайн: сетевое науч. электр. изд.; № 1(10), 2008. – Режим доступа: http://www.shkolny.com/kontent-analiz-subkulturyi-hakerov-v-ramkah-izucheniya-sotsialno-gumanitarnyih-distsiplin/, свободный – Загл. с экрана.";2008;;;1741;
8;"Многомерность культуры: обзор, тестовые задания / С.В. Масленченко // Чалавек. Грамадства. Свет: штокв. навук.-метад. часоп. / Рэд. часоп. ""Адукацыя і выхаванне"". – Минск, 2007. – № 4. – С. 26-30";2007;;;1742;
8;"Социальные роли субкультуры хакеров / С.В. Масленченко // Известия Российского государственного педагогического университета имени А.И. Герцена. – Серия: Аспирантские тетради. – СПб., 2008. – № 27(61). – С. 65-68";2008;;;1743;
8;"Субкультура хакеров / С.В. Масленченко // Социология : науч.-теорет. журн. / Белорус. гос. ун-т. – Минск, 2009. – № 4. – С. 111-119";2009;;;1744;
8;"Субкультура хакеров как порождение информатизации общества / С.В. Масленченко // Управление защитой информации : ежекв. рос.-белорус. науч.-практ. журн. / МАРФИ. – Минск, 2009. – Т. 13. – № 1. – С. 71-77";2009;;;1745;
8;"Особенности профессионального становления специалиста в системе ведомственного образования / Е.Н. Мисун // Труд. Профсоюзы. Общество = Labour. Trade union. Society: ежекв. науч.-практ. журн. / Федерация профсоюзов Беларуси, Междунар. ин-т трудовых и социальных отношений. – Минск, 2008. – № 4(22). – С. 32-34";2008;;;1746;
8;"Общественная деятельность женщин Витебской губернии в начале ХХ века / О.Л. Помалейко // Научные труды Республиканского института высшей школы. Исторические и психолого-педагогические науки : cб. науч. ст. / Респ. ин-т высшей школы ; под ред. В.Ф. Беркова. – Минск : РИВШ, 2007. – Вып. 4(9). – С. 145-150";2007;;;1750;
8;"Характерные особенности правового положения женщин Беларуси в браке в начале ХХ в. / О.Л. Помалейко // Вестник Академии МВД Республики Беларусь : науч.-практ. журн. – Минск, 2008. – № 1(15). – С. 27-31";2008;;;1751;
8;"Выбор путей общественного и национального развития России и Беларуси в 1917 г. партией эсеров / Е.Н. Сувалова // Вестник Академии МВД Республики Беларусь : науч.-практ. журн. – Минск, 2007. – № 2(14). – С. 20-24";2007;;;1752;
8;"Меньшевики и большевики: выбор путей общественного развития в 1917 году / Е.Н. Сувалова // Научные труды Республиканского института высшей школы. Исторические и психолого-педагогические науки : cб. науч. ст. / Респ. ин-т высшей школы ; под ред. В.Ф. Беркова. – Минск : РИВШ, 2007. – Вып. 4(9). – С. 189-195";2007;;;1754;
8;"Формирование стратегических приоритетов белорусских консервативных организаций по национальному вопросу в 1917 г. / Е.Н. Сувалова // Вестник Академии МВД Республики Беларусь : науч.-практ. журн. – Минск, 2007. – № 1(13). – С. 29-32";2007;;;1755;
8;"Пространственная и предметная сфера деятельности региональных организаций коллективной безопасности (правовые аспекты) / И.С. Кузнецова // Вестник Академии МВД Республики Беларусь : науч.-практ. журн. – Минск, 2007. – № 1(13). – С. 53-57";2007;;;1826;
8;"Социальные аспекты правоприменительной деятельности / Е.М. Ефременко // Теоретические и практические проблемы правоприменения : сб. науч. тр. / под ред. В.А. Кучинского ; М-во внутрен. дел Респ. Беларусь, учреждение образования «Акад. М-ва внутрен. дел Респ. Беларусь». – Минск : Акад. МВД, 2010. – С. 127-132";2010;;;1839;
8;"Подростковая преступность в Республике Беларусь : анализ и особенности социолого-психологического изучения / А.Г. Солодовников // Праблемы выхавання: штокв. навук.-метад. часоп. / Рэд. часоп. ""Адукацыя і выхаванне"". – Минск, 2009. – № 1. – С. 39-43";2009;;;1840;
8;"Особенности взаимодействия следователей со службами органов внутренних дел при расследовании преступлений в сфере экономики и коррупции / Е.И. Климова, А.А. Климов // Бюл. предварительного расследования МВД Респ. Беларусь. – Минск, 2009. – № 30. – С. 140-148";2009;;;1883;
8;"Оценка материалов проверки заявлений и сообщений о преступлениях в сфере экономики (методические рекомендации) / Е.И. Климова, А.А. Климов // Бюл. главного управления предварительного расследования МВД Респ. Беларусь. – Минск, 2008. – № 27-28. – С. 196-209";2008;;;1884;
8;"Вучэнне аб дыктатуры пралетарыяту – iдэалагiчная аснова палiтыка-прававога рэжыму савецкай дзяржавы (1917-1936 гг.) / А.Ф. Вішнеўскі (А.Ф. Вишневский) // Вестник Академии МВД Республики Беларусь : науч.-практ. журн. – Минск, 2007. – № 2(14). – С. 12-17";2007;;;1899;
8;"Некоторые вопросы организации раскрытия тяжких телесных повреждений / А.В. Малахов // Вестник Академии МВД Республики Беларусь : науч.-практ. журн. – Минск, 2007. – № 2(14). – С. 110-113";2007;;;1901;
8;"Факторный анализ и факторная модель свободного времяпровождения несовершеннолетних осужденных / Т.В. Казак // Вестник Академии МВД Республики Беларусь : науч.-практ. журн. – Минск, 2007. – № 2(14). – С. 216-220";2007;;;1908;
