kind;outputdata;year;unused1;unused2;code;halfyear
10;"Памятка начинающему преподавателю / С.М. Казакевич / Организация образовательного процесса : информ.-метод. сб. / М-во внутрен. дел Респ. Беларусь, Акад. МВД. – Минск : Акад. МВД Респ. Беларусь, 2012. – № 8. – С. 43-47";2012;;;5845;
10;"[Введение] / А.А. Греченков // Введение к учеб. пособию : Волков, А.Я. Социально-правовая защита личного состава органов внутренних дел. – Минск : Акад. МВД Респ. Беларусь, 1997. – С. 3-4";1997;;;5903;
10;"Криминологический анализ и профилактика правонарушений в регионе, подвергшемуся радиоактивному загрязнению (по материалам Респ. Беларусь об аварии на Чернобыльской АЭС): лекция / В.А. Кашевский. – М.: МВШ МВД РФ, 1993. – 42 с.";1993;;;5995;
10;"Прокуроры и адвокаты: знаменитые процессы / Сост.: В.А. Кашевский, В.В. Мороз. – Минск :  Литература, 1998. – 608 с.";1998;;;5997;
10;"Прощание славянки / А.С. Жмуровский // Милиция Беларуси : правовой литер.-публиц. журн. / МВД Респ. Беларусь. – 2013. – № 2. – С. 46-47";2013;;;6120;1
10;"Из истории ликвидации института протопресвитерства в Русской Армии / А.С. Жмуровский // Минские епархиальные ведомости : журн. / Белорус. Правосл. Церковь. – 2013. – № 2. – С. 62-68";2013;;;6121;1
10;"Риторическая культура как стратегия успеха / В.Л. Голубев // Организация образовательного процесса : информ.-метод. сб. / М-во внутр. дел Респ. Беларусь, учреждение образования «Акад. М-ва внутр. дел Респ. Беларусь». – Минск : Акад. МВД, 2014. – № 11. – С. 38-41";2014;;;6791;1
10;"Проблемное обучение – необходимое условие методического обеспечения второй ступени высшего образования (магистратуры) / В.А. Кучинский // Организация образовательного процесса : информ.-метод. сб. / М-во внутр. дел Респ. Беларусь, учреждение образования «Акад. М-ва внутр. дел Респ. Беларусь». – Минск : Акад. МВД, 2014. – № 11. – С. 41-44";2014;;;6792;1
10;"Психолого-педагогические условия эффективного обучения: возможности совершенствования / А.Н. Пастушеня // Организация образовательного процесса : информ.-метод. сб. ; М-во внутр. дел Респ. Беларусь, учреждение образования «Акад. М-ва внутр. дел Респ. Беларусь». – Минск : Акад. МВД, 2014. – № 11. – С. 45-62";2014;;;6793;1
10;"Межкурсовые общеакадемические практикоориентированные учения как новая форма обучения в Академии МВД Республики Беларусь / А.Л. Федорович // Организация образовательного процесса : информ.-метод. сб. ; М-во внутр. дел Респ. Беларусь, учреждение образования «Акад. М-ва внутр. дел Респ. Беларусь». – Минск : Акад. МВД, 2014. – № 11. – С. 64-67";2014;;;6795;1
10;"Высшие военные награды СССР / А.С. Жмуровский // Милиция Беларуси : правовой литер.-публиц. журн. / МВД Респ. Беларусь. – 2014. – №. 2. –  С. 31-32";2014;;;7065;1
10;"Оперативно-техническое обеспечение предупреждения и раскрытия хищений грузов на железнодорожном транспорте (По материалам Республики Беларусь) : дис. … канд. юрид. наук : 12.00.09 / В.В. Бачила. – М.: МВШМ МВД РФ, 1994. – 204 с.";1994;;;7168;
10;"Акты совершенствования методики преподавания учебной дисциплины «Гражданское право» на семинарских занятиях / И.Н. Яхновец // Организация образовательного процесса : информ.-метод. сб. / учреждение образования «Акад. М-ва внутр. дел Респ. Беларусь» ; редкол. А.Л. Савенок [и др.]. – Минск : Акад. МВД Респ. Беларусь, 2014. – № 12. – С. 62-68";2014;;;7223;2
10;"Инновационные технологии в преподавании учебной дисциплины «Социология» в рамках интегрированного модуля «Экономика» / Е.Н. Мисун // Организация образовательного процесса : инф.-метод. сб. / Акад. М-ва внутр. дел Респ. Беларусь ; редкол.: А.Л. Савенок, О.З. Рыбаключева, И.Н. Бобкова, В.Л. Голубев. – Минск, 2014. –  № 12. – С. 51-54";2014;;;7266;2
10;"Финансовая поддержка молодых специалистов, направленных на работу по распределению / Н.А. Швед // Ветеринарное дело. – 2014. – № 8. – С. 39-40";2014;;;7272;2
10;"О содержании учебных дисциплин «Экологическое право» и «Природоресурсное право» / А.Н. Сапогин // Организация образовательного процесса : информ.-метод. сб. / учреждение образования «Акад. М-ва внутр. дел Респ. Беларусь» ; редкол. А.Л. Савенок [и др.]. – Минск : Акад. МВД Респ. Беларусь, 2014. – № 11. – С. 62–64";2014;;;7355;2
10;"Разработка и использование в образовательном процессе тренажерных комплексов по учебной дисциплине «Криминалистика»  / М.В. Галезник //  Организация образовательного процесса : информ.-метод. сб. ; учреждение образования «Акад. М-ва внутр. дел Респ. Беларусь». – Минск : Акад. МВД, 2014. –  № 12. – С. 26–51";2014;;;7367;2
10;"В погоне за «живым товаром»  / М.П. Шруб //  Содружество : журнал Совета Министров внутренних дел государств – участников СНГ. – М., 2014. – № 3. – С. 32–37";2014;;;7372;2
10;"Своеобразие и специфика профессиональной деятельности педагога высшей школы / В.Л. Голубев // Организация образовательного процесса : информ.-метод. сб. / учреждение образования «Акад. М-ва внутр. дел Респ. Беларусь» ; редкол. А.Л. Савенок [и др.]. – Минск : Акад. МВД Респ. Беларусь, 2014. – № 12. – С.40-42";2014;;;7446;2
10;"Применение средств фото- видеофиксации нарушений ПДД в обеспечении безопасности дорожного движения / В.В. Зиновенко // Сборник передового опыта обеспечения общественной безопасности / М-во внутр. дел Респ. Беларусь. – Минск : Полиграф. центр МВД, 2014 – № 4 (28) – С. 33–50";2014;;;7519;2
10;"Зарубежный опыт ограничения скорости движения транспортных средств в обеспечении безопасности пешеходов / В.В. Зиновенко // Сборник передового опыта обеспечения общественной безопасности / М-во внутр. дел Респ. Беларусь. – Минск : Полиграф. центр МВД, 2014 – № 1 (25) – С. 33–44";2014;;;7520;1
10;"О формировании системы сыска в Республике Беларусь : науч. докл. / И.И. Басецкий, В.Ч. Родевич ; учреждение образования «Акад. М-ва внутр. дел Респ. Беларусь». – Минск : Акад. МВД, 2015. – 28 с.";2015;;;7719;1
10;"Инновационная образовательная среда Академии МВД: состояние и перспективы / А.В. Башан // Организация образовательного процесса : информ.-метод. сб. ; редкол.: А.В. Башан [и др.] ; учреждение образования «Акад. М-ва внутр. дел Респ. Беларусь». – Минск : Акад. МВД, 2015. – № 13. – С. 61–64";2015;;;7721;1
10;"Мобильные средства коммуникации в системе служебного и внеслужебного общения (по результатам опроса) / В.Л. Голубев // Организация образовательного процесса : информ.-метод. сб. ; редкол.: А.В. Башан [и др.] ; учреждение образования «Акад. М-ва внутр. дел Респ. Беларусь». – Минск : Акад. МВД, 2015. – № 13. – С. 65–67";2015;;;7722;1
10;"Нетрадиционные формы лекций по историко-правовым дисциплинам с использованием инновационных методик и информационных технологий (на примере учебной дисциплины «История государства и права Беларуси») / С.Ф. Лапанович // Организация образовательного процесса : информ.-метод. сб. ; редкол.: А.В. Башан [и др.] ; учреждение образования «Акад. М-ва внутр. дел Респ. Беларусь». – Минск : Акад. МВД, 2015. – № 13. – С. 71–76";2015;;;7723;1
10;"Проведение показательных занятий в Академии МВД Республики Беларусь с использованием инновационных методов преподавания / Е.В. Лексина // Организация образовательного процесса : информ.-метод. сб. ; редкол.: А.В. Башан [и др.] ; учреждение образования «Акад. М-ва внутр. дел Респ. Беларусь». – Минск : Акад. МВД, 2015. – № 13. – С. 76–77";2015;;;7724;1
10;"Использование активных методов обучения в процессе проведения занятий по учебной дисциплине «Криминология» / Т.Г. Терещенко, В.И. Степаненко // Организация образовательного процесса : информ.-метод. сб. ; редкол.: А.В. Башан [и др.] ; учреждение образования «Акад. М-ва внутр. дел Респ. Беларусь». – Минск : Акад. МВД, 2015. – № 13. – С. 78–84";2015;;;7725;1
10;"Право на деловой риск или запрет рисковать / А.И. Лукашов // Экономическая газета. – 2015. – № 30. – С. 13–16";2015;;;7832;1
10;"Досудебное соглашение о сотрудничестве как междисциплинарный правовой институт / А. И. Лукашов // Юридический мир : произв.-практ. журн. / Информ.-прав. агентство ""Регистр"". – Минск, 2015. – № 3. – С. 17 – 24";2015;;;8286;2
10;"Досудебное соглашение о сотрудничестве как междисциплинарный правовой институт / А. И. Лукашов // Юридический мир : произв.-практ. журн. / Информ.-прав. агентство ""Регистр"". – Минск, 2015. – № 4. – С. 35 – 43";2015;;;8287;2
10;"Использование инновационных технологий в преподавании / И. А. Анищенко // Организация образовательного процесса : информ.-метод. сб. ; редкол.: А. В. Башан [и др.] ; учреждение образования «Акад. М-ва внутр. дел Респ. Беларусь». – Минск, 2016. – № 14. – С. 105–108";2016;;;8698;1
10;"Использование метода визуализации информации при обучении дисциплинам психологического профиля / С. Л. Бураков // Организация образовательного процесса : информ.-метод. сб. ; редкол.: А. В. Башан [и др.] ; учреждение образования «Акад. М-ва внутр. дел Респ. Беларусь». – Минск, 2016. – № 14. – С. 109–111";2016;;;8699;1
10;"Сочетание традиционных и инновационных методов обучения в преподавании международного права / В. Н. Вежновец // Организация образовательного процесса : информ.-метод. сб. ; редкол.: А. В. Башан [и др.] ; учреждение образования «Акад. М-ва внутр. дел Респ. Беларусь». – Минск, 2016. – № 14. – С. 111–115";2016;;;8700;1
10;"Профессионально-нравственное развитие курсантов Академии МВД Республики Беларусь / В. Л. Голубев // Организация образовательного процесса : информ.-метод. сб. ; редкол.: А. В. Башан [и др.] ; учреждение образования «Акад. М-ва внутр. дел Респ. Беларусь». – Минск, 2016. – № 14. – С. 115–117";2016;;;8701;1
10;"Перспективы создания и развития современной лаборатории полицейского профайлинга / Д. В. Ермолович, Ю. И. Селятыцкий // Организация образовательного процесса : информ.-метод. сб. ; редкол.: А. В. Башан [и др.] ; учреждение образования «Акад. М-ва внутр. дел Респ. Беларусь». – Минск, 2016. – № 14. – С. 118–120";2016;;;8702;1
10;"Совершенствование методики подготовки и проведения семинарских занятий в учреждениях высшего образования / С. Г. Луговский // Организация образовательного процесса : информ.-метод. сб. ; редкол.: А. В. Башан [и др.] ; учреждение образования «Акад. М-ва внутр. дел Респ. Беларусь». – Минск, 2016. – № 14. – С. 120–123";2016;;;8703;1
10;"Использование метода опорных положений при чтении лекций по юридическим дисциплинам / О. З. Рыбаключева, Н. И. Орловская // Организация образовательного процесса : информ.-метод. сб. ; редкол.: А. В. Башан [и др.] ; учреждение образования «Акад. М-ва внутр. дел Респ. Беларусь». – Минск, 2016. – № 14. – С. 123–126";2016;;;8704;1
10;"Семинарские занятия по учебной дисциплине «Гражданский процесс»: особенности и специфика проведения / А. В. Чигилейчик // Организация образовательного процесса : информ.-метод. сб. ; редкол.: А. В. Башан [и др.] ; учреждение образования «Акад. М-ва внутр. дел Респ. Беларусь». – Минск, 2016. – № 14. – С. 127–129";2016;;;8705;1
10;"Особенности формирования управленческой компетентности у курсантов в ходе семинарских занятий по учебной дисциплине «Юридическая психология» / А. А. Урбанович // Организация образовательного процесса : информ.-метод. сб. ; редкол.: А. В. Башан [и др.] ; учреждение образования «Акад. М-ва внутр. дел Респ. Беларусь». – Минск, 2016. – № 14. – С. 129–132";2016;;;8706;1
10;"Сборник материалов рабочей встречи членов Научно-консультативного совета при Совете министров внутренних дел государств – участников Содружества Независимых Государств, Москва, 15 дек. 2015 г. / учреждение образования «Акад. М-ва внутр. дел Респ. Беларусь» ; сост.: А. В. Ковальчук, В. В. Кушнирык. – Минск : Академия МВД, 2016. – 157 с.";2016;;;8712;1
10;"Выявление поставок наркотиков / Д. Л. Харевич // Бюллетень Главного управления уголовного розыска МВД Республики Беларусь. – 2015. – № 22. – С.46–54.";2015;;;8754;2
10;"Реализация отдельных прав и законных интересов осужденных: опыт России и зарубежных государств : науч.-аналит. обзор. / Н. В. Кийко, И. А. Давыдова, Э. В. Лядов. – Рязань : Изд-во Коняхин Александр Викторович, 2016. – 88 с.";2016;;;8832;1
10;"Обзор новой версии международного стандарта ISO 9001:2015 системы менеджмента качества. Требования / Н. И. Орловская // Организация образовательного процесса : информ.-метод. сб. ; редкол.: А. В. Башан [и др.] ; учреждение образования «Акад. М-ва внутр. дел Респ. Беларусь». – Минск, 2016. – № 15. – С. 22–26.";2016;;;8957;1
10;"О методике преподавания учебной дисциплины «Международное право» / А. И. Бородич, В. Н. Вежновец // Организация образовательного процесса : информ.-метод. сб. ; редкол.: А. В. Башан [и др.] ; учреждение образования «Акад. М-ва внутр. дел Респ. Беларусь». – Минск, 2016. – № 15. – С. 26–38.";2016;;;8958;1
10;"Использование межпредметных связей в процессе интеллектуальной игры / В. Н. Вежновец, О. В. Рожко // Организация образовательного процесса : информ.-метод. сб. ; редкол.: А. В. Башан [и др.] ; учреждение образования «Акад. М-ва внутр. дел Респ. Беларусь». – Минск, 2016. – № 15. – С. 38–43.";2016;;;8959;1
10;"Использование метода натурного моделирования при проведении практических занятий на криминалистическом полигоне / Р. В. Скачек // Организация образовательного процесса : информ.-метод. сб. ; редкол.: А. В. Башан [и др.] ; учреждение образования «Акад. М-ва внутр. дел Респ. Беларусь». – Минск, 2016. – № 15. – С. 43–48.";2016;;;8960;1
10;"Применение интерактивного метода обучения курсантов на основе деловой игры с использованием учебного полигона «Оперативно-дежурная служба» / А. Л. Федорович // Организация образовательного процесса : информ.-метод. сб. ; редкол.: А. В. Башан [и др.] ; учреждение образования «Акад. М-ва внутр. дел Респ. Беларусь». – Минск, 2016. – № 15. – С. 48–57.";2016;;;8961;1
10;"О внедрении современных интерактивных технологий в образовательном процессе / Д. В. Ермолович // Организация образовательного процесса : информ.-метод. сб. ; редкол.: А. В. Башан [и др.] ; учреждение образования «Акад. М-ва внутр. дел Респ. Беларусь». – Минск, 2016. – № 15. – С. 63–65.";2016;;;8962;1
10;"Методологическое обеспечение творческой инициативы магистрантов: опыт Академии МВД Республики Беларусь / Л. Е. Лойко // Организация образовательного процесса : информ.-метод. сб. ; редкол.: А. В. Башан [и др.] ; учреждение образования «Акад. М-ва внутр. дел Респ. Беларусь». – Минск, 2016. – № 15. – С. 65–67.";2016;;;8963;1
10;"Формирование интринсивной мотивационной направленности курсантов в учебной деятельности / В. Л. Голубев // Организация образовательного процесса : информ.-метод. сб. ; редкол.: А. В. Башан [и др.] ; учреждение образования «Акад. М-ва внутр. дел Респ. Беларусь». – Минск, 2016. – № 15. – С. 68–69.";2016;;;8964;1
10;"Психологические механизмы установления педагогического контакта / В. В. Мицкевич // Организация образовательного процесса : информ.-метод. сб. ; редкол.: А. В. Башан [и др.] ; учреждение образования «Акад. М-ва внутр. дел Респ. Беларусь». – Минск, 2016. – № 15. – С. 69–71.";2016;;;8965;1
10;"О Льве Давидовиче Гаухмане / А. В. Ковальчук // Гаухман Л.Д. Избранные труды / Состав.: В.П. Морозова, С.В. Максимов. – СПб.: Издательство Юридический центр, 2016. – С. 30-34";2016;;;9086;2
10;"Советское государство и право в период Великой Отечественной войны (1941-1945 гг.): лекция / А. С. Жмуровский, В. А. Данилов, О. Н. Сувалов, С. В. Архипов // Акад. ФСИН России, Акад. МВД Респ. Беларусь – Рязань, Минск, 2015. – 37 с.";2015;;;9237;2
