kind;outputdata;year;unused1;unused2;code;halfyear
8;"Криминологическая характеристика рецидивной и профессиональной преступности / С.Ю. Часнок // Вестник Академии МВД Республики Беларусь : науч.-практ. журн. – Минск, 2008. – № 1(15). – С. 116-120";2008;;;21;
8;"Причины рецидивной преступности в Республике Беларусь / С.Ю. Часнок // Вестник Академии МВД Республики Беларусь : науч.-практ. журн. – Минск, 2007. – № 2(14). – С. 195-198";2007;;;22;
8;"Некоторые особенности профилактики бытовых преступлений среди лиц, ранее судимых за совершение преступлений / С.Ю. Часнок // Вестник Академии МВД Республики Беларусь : науч.-практ. журн. – Минск, 2008. – № 2 (16). – С. 112-116";2008;;;32;
8;"Особенности предупреждения бытовых преступлений, совершаемых рецидивистами / С.Ю. Часнок // Безопасность уголовно-исполнительной системы : журн. / Псков. юрид. ин-т Федер. службы исполн. наказаний России. – Псков, 2009. – № 2(6). – С. 33-36";2009;;;33;
8;"Некоторые особенности обеспечения общественной безопасности пожилых людей / С.Ю. Часнок // Вестник Академии МВД Республики Беларусь : науч.-практ. журн. – Минск, 2009. – № 1(17). – С. 128-132";2009;;;34;
8;"Отдельные аспекты правового регулирования защиты государственных секретов при осуществлении оперативно-розыскной деятельности / В.С. Гайдельцов // Труды Института национальной безопасности Республики Беларусь: сб. науч. тр. – Минск, 2007. – № 24. – С. 4";2007;;;35;
8;"Сущность и особенности оперативно-розыскных правоотношений / В.С. Гайдельцов // Современные проблемы правовых отношений : сб. науч. тр. / М-во внутрен. дел Респ. Беларусь, Акад. МВД ; под ред. В.А. Кучинского и Э.А. Саркисовой. – Минск : Акад. МВД Респ. Беларусь, 2008. – С. 87-95";2008;;;41;
8;"Имплементация норм международного права в таможенной сфере в контексте обеспечения национальной безопасности Республики Беларусь / В.С. Гайдельцов // Труды Института национальной безопасности Республики Беларусь : сб. науч. тр. – Минск, 2008. – № 2. – С. 10";2008;;;42;
8;"Таможенный кодекс Республики Беларусь в контексте соответствия международным правовым стандартам / В.С. Гайдельцов // Общество в условиях трансформации социально-экономической системы: проблемы экономики и права: сб. науч. ст. / Моск. ин-т правовой экономики. – М.: ИПЭ, 2008. – Вып. 13. – С. 5";2008;;;43;
8;"О юридической сущности понятия негласности оперативно-розыскной деятельности / В.С. Гайдельцов // Вестник Академии МВД Республики Беларусь : науч.-практ. журн. – Минск, 2008. – № 1с(4). – С. 25-28";2008;;;44;
8;"Унификация оперативно-розыскного законодательства как один из факторов обеспечения безопасности Союзного государства / В.С. Гайдельцов // Актуальные проблемы обеспечения безопасности Союзного государства: сб. науч. тр. – Вып. 1. – М., Минск, 2008. –  С. 59-63";2008;;;45;
8;"Юридические проблемы содействия граждан органам, осуществляющим  оперативно-розыскную деятельность / В.С. Гайдельцов // Труды Института национальной безопасности Республики Беларусь: сб. науч. тр. – Минск, 2009. – № 27. – С. 210-219";2009;;;47;
8;"К вопросу об имплементации международно-правовых норм о транзите в национальное таможенное законодательство в контексте обеспечения экономической безопасности Республики Беларусь / В.С. Гайдельцов // Общество в условиях трансформации социально-экономической системы: проблемы экономики и права: сб. науч. ст. / Моск. ин-т правовой экономики. – М.: ИПЭ, 2009. – Ч. XV. – С. 35-41";2009;;;49;
8;"Государственно-правовой механизм обеспечения прав и свобод человека в Республике Беларусь / А.А. Подупейко, М.Г. Головач  // Всеобщей декларации прав человека 60 лет: генезис, эволюция и проблемы современного прочтения : сб. науч. тр. / М-во внутрен. дел Респ. Беларусь, Акад. МВД ; под ред. А.Ф. Вишневского (отв. ред.), В.А. Кучинского и С.Е. Данилюка. – Минск : Акад. МВД Респ. Беларусь, 2009. – С. 200-212";2009;;;57;
8;"Комиссия по делам несовершеннолетних как субъект административно-юрисдикционного процесса / Н.В. Дударева // Вестник Академии МВД Республики Беларусь : науч.-практ. журн. – Минск, 2007. – № 2(14). – С. 186-190";2007;;;59;
8;"Правовая сущность услуги в гражданском праве / Н.И. Рудович. – Минск : МГЭИ, 2008. – С. 166-168";2008;;;66;
8;"[Рецензия] / Н.И. Порубов // Вопросы криминологии, криминалистики и судебной экспертизы : сб. науч. тр. / Центр судебной экспертизы и криминалистики М-ва юстиции Респ. Беларусь. – Минск, 2009. – № 1(25). – С. 259-262. – Рец. на моногр.: Федоров, Г.В. Криминалистические средства противодействия преступности : теоретические аспекты / Г. В. Федоров; М-во внутрен. дел Респ. Беларусь, Акад. МВД. – Минск : Акад. МВД Респ. Беларусь, 2008. – 185, [2] c.";2009;;;82;
8;"Результаты изучения общественного мнения населения о работе органов внутренних дел Республики Беларусь в 2006 году / В.Л. Григорович,  И.А. Кибак, А.М. Малиновский // Информ. бюл. МВД Респ. Беларусь. – Минск, 2007. –  № 40. – С. 9-19";2007;;;101;
8;"Квалификация разбоя на стадии возбуждения уголовного дела / Г.В. Федоров, А.В. Дроздов // Право.by : науч.-практ. журн. / Нац. центр правовой информ. Респ. Беларусь. –  Минск, 2008. – № 1. – С. 132-135";2008;;;102;
8;"Особенности проведения задержания в условиях исправительных учреждений / В.Л. Григорович,  С.В. Кузьменкова // Безопасность уголовно-исполнительной системы : журн. / Псков. юрид. ин-т Федер. службы исполн. наказаний России. – Псков, 2009. – № 2(6). – С. 24-26";2009;;;106;
8;"Исследование криминалистических объектов методами голографической интерферометрии / В.Л. Григорович // Вестник Полоцкого государственного университета = Веснік Полацкага дзяржаўнага універсітэта : науч.-теорет. ежемес. журн. – Серия D: Экономические и юридические науки = Серыя D: Эканамічныя і юрыдычныя навукі. – Полоцк, 2008. – № 10. – С. 181-183";2008;;;107;
8;"Криминалистическая фотография и голография: сравнительный анализ / В.Л. Григорович // Информ. бюл. МВД Респ. Беларусь. – Минск, 2007.– № 40. – С. 142-149";2007;;;108;
8;"Особенности использования голографии в уголовном судопроизводстве / В.Л. Григорович // Вопросы криминологии, криминалистики и судебной экспертизы : сб. науч. тр. / Центр судебной экспертизы и криминалистики М-ва юстиции Респ. Беларусь. – Минск, 2009. – № 1(25). – С. 96-100";2009;;;109;
8;"Перспективное использование оптической голографии в криминалистической регистрации / В.Л. Григорович // Вопросы криминологии, криминалистики и судебной экспертизы : сб. науч. тр. / Науч.-исслед. ин-т криминалистики и судебной экспертизы М-ва юстиции Респ. Беларусь. – Минск, 2008. – № 1(23). – С. 50-54";2008;;;110;
8;"Предъявление для опознания по особенностям голоса и речи при расследовании разбоев / В.Л. Григорович // Проблемы криминалистики : сб. науч. тр. / М-во внутрен. дел Респ. Беларусь, Акад. МВД ; редкол.: Г.Н. Мухин (отв. ред.) [и др.]. – Минск : Акад. МВД Респ. Беларусь, 2009. – Вып. 7. – С. 113-119";2009;;;111;
8;"Применение методов голографической интерферометрии для исследования криминалистических объектов / В.Л. Григорович // Вестник Академии МВД Республики Беларусь : науч.-практ. журн. – Минск, 2009. – № 1(17). – С. 37-40";2009;;;112;
8;"Применение оптической голографии в криминалистической регистрации  / В.Л. Григорович // Вестник Полоцкого государственного университета = Веснік Полацкага дзяржаўнага універсітэта : науч.-теорет. ежемес. журн. – Серия D: Экономические и юридические науки = Серыя D: Эканамічныя і юрыдычныя навукі. – Полоцк, 2009. – № 10. – С. 183-186";2009;;;113;
8;"Принципы криминалистической голографии / В.Л. Григорович // Вестник Полоцкого государственного университета = Веснік Полацкага дзяржаўнага універсітэта : науч.-теорет. ежемес. журн. – Серия D: Экономические и юридические науки = Серыя D: Эканамічныя і юрыдычныя навукі. – Полоцк, 2009. – № 4. – С. 166-170";2009;;;114;
8;"Современное состояние голографии в криминалистике / В.Л. Григорович // Вопросы криминологии, криминалистики и судебной экспертизы : сб. науч. тр. / Науч.-исслед. ин-т криминалистики и судебной экспертизы М-ва юстиции Респ. Беларусь. – Минск, 2008. – № 2(24). – С. 114-119";2008;;;115;
8;"Технико-криминалистическое исследование голограмм поддельных акцизных марок / В.Л. Григорович // Вестник Академии МВД Республики Беларусь : науч.-практ. журн. – Минск, 2008. – № 2(16). – С. 120-126";2008;;;116;
8;"Осмотр места происшествия по делам о разбоях / А.В. Дроздов // Вестник Академии МВД Республики Беларусь : науч.-практ. журн. – Минск, 2009. – № 1(17). – С. 40-44";2009;;;117;
8;"Правовые основы криминализации и расследования разбоев в Республике Беларусь / А.В. Дроздов // Вопросы криминологии, криминалистики и судебной экспертизы : сб. науч. тр. / Центр судебной экспертизы и криминалистики М-ва юстиции Респ. Беларусь. – Минск, 2009. – № 1(25). – С. 65-74";2009;;;119;
8;"Некоторые аспекты языка криминалистической техники / Д.В. Исютин-Федотков // Ученые записки Таврического национального университета им. В.И. Вернадского: науч. журн. – Серия: Юридические науки. – Симферополь, 2007. – Том 20(59). – № 2. – С. 136-140";2007;;;120;
8;"О проблемах соотношения языка закона и языка криминалистической науки / Д.В. Исютин-Федотков, О.В. Колесникова // Вестник Самарской гуманитарной академии. – Серия «Право». – Самара, 2009. – № 2(6). – С. 11-14";2009;;;121;
8;"О проблемах экспертного эксперимента при проведении судебно-медицинских экспертиз / Д.В. Исютин-Федотков // Эксперт-криминалист: федер. науч.-практ. журн. / Изд. гр. ""Юрист"". – М., 2009. – № 4. – С. 42-46";2009;;;122;
8;"Синонимы в языке закона и языке криминалистики / Д.В. Исютин-Федотков // Вісник Луганського державного університету внутрішніх справ імені Е.О. Дідоренка: наук.-теорет. журн. / Луганський держ. ун-т внутріш. справ імені Е.О. Дідоренка. – Луганск, 2008. – № 5: у 3-х ч. – Ч. 3. – С. 3-11";2008;;;123;
8;"Тенденции развития языка криминалистики (активные процессы в современном языке криминалистики) / Д.В. Исютин-Федотков // Вісник Луганського державного університету внутрішніх справ імені Е.О. Дідоренка: наук.-теорет. журн. / Луганський держ. ун-т внутріш. справ імені Е.О. Дідоренка. – Луганск, 2009. – № 3: у 2-х ч. – Ч. 1. – С. 218-225";2009;;;124;
8;"Тенденция использования заимствованной (иноязычной) лексики в языке криминалистики / Д.В. Исютин-Федотков // Вісник Академії адвокатури України : наук. журн. / ТОВ “Академія адвокатури України”. – Киïв, 2007. – Вип. 1(8). – С. 107-111";2007;;;125;
8;"Исторический аспект проблемы посягательств на информацию о частной жизни, составляющую личную или семейную тайну / И.В. Капустина // Проблемы криминалистики: сб. науч. тр. / М-во внутрен. дел Респ. Беларусь, Акад. МВД; редкол.: Г.Н. Мухин (отв. ред.) [и др.]. – Минск: Акад. МВД Респ. Беларусь, 2007. – Вып. 5. – C. 176-182";2007;;;126;
8;"Особенности возбуждения уголовных дел о незаконном собирании либо распространении информации о частной жизни / И.В. Капустина // Проблемы криминалистики: сб. науч. тр. / М-во внутрен. дел Респ. Беларусь, Акад. МВД ; редкол.: Г.Н. Мухин (отв. ред.) [и др.]. – Минск : Акад. МВД Респ. Беларусь, 2008. – Вып. 6. – С. 153-156";2008;;;127;
8;"О некоторых недостатках нормативной правовой терминологии в сфере раскрытия и расследования преступлений / О.Г. Каразей, Д.В. Исютин-Федотков // Вісник Луганського державного університету внутрішніх справ імені Е.О. Дідоренка: наук.-теорет. журн. / Луганський держ. ун-т внутріш. справ імені Е.О. Дідоренка. – Луганск, 2008. – № 5: у 3-х ч. – Ч. 3. – С. 90-98";2008;;;128;
8;"О некоторых недостатках проекта закона Республики Беларусь «Об основах судебно-экспертной деятельности» / О.Г. Каразей, Д.В. Исютин-Федотков, О.В. Колесникова, Г.А. Якубович // Эксперт-криминалист : федер. науч.-практ. журн. / Изд. гр. ""Юрист"". – М., 2009. – № 3. – С. 35-38";2009;;;129;
8;"Освидетельствование: процессуальные и криминалистические проблемы и возможные пути их решения / В.М. Логвин, М.Ю. Кашинский, Ю.А. Матвейчев // Юстыцыя Беларусі : юрыд. навук.-практ. часоп. / Администрация Президента Респ. Беларусь, М-во юстиции Респ. Беларусь, Респ. коллегия адвокатов. – Минск, 2009. – № 7(89). – С. 43-48";2009;;;130;
8;"Новые издания по криминалистике / В.К. Кирвель, Г.Н. Мухин // Проблемы криминалистики: сб. науч. тр. / М-во внутрен. дел Респ. Беларусь, Акад. МВД; редкол.: Г.Н. Мухин (отв. ред.) [и др.]. – Минск: Акад. МВД Респ. Беларусь, 2007. – Вып. 5. – C. 223-227";2007;;;131;
8;"Судебно-экспертные учреждения Республики Беларусь: система, правовые основы деятельности, задачи, структура и современные возможности (статья первая) / В.К. Кирвель // Вестник Академии МВД Республики Беларусь : науч.-практ. журн. – Минск, 2009. – № 2(18). – С. 10-13";2009;;;132;
8;"Особенности выдвижения версий и планирования расследования хищений в сфере экономики, совершенных путем мошенничества / Н. И. Лагун // Проблемы криминалистики: сб. науч. тр. / М-во внутрен. дел Респ. Беларусь, Акад. МВД ; редкол.: Г.Н. Мухин (отв. ред.) [и др.]. – Минск : Акад. МВД Респ. Беларусь, 2008. – Вып. 6. – С. 194-199";2008;;;133;
8;"Некоторые процессуальные вопросы осмотра места происшествия / В.М. Логвин, Ю. Матвейчев // Судовы веснік : часоп. / Вярхоўны Суд Рэсп. Беларусь. – Минск, 2008. – № 1. – С. 67-70";2008;;;134;
8;"Оценка деятельности следственно-оперативных групп / В.М. Логвин, Ю.А. Матвейчев // Вестник Академии МВД Республики Беларусь : науч.-практ. журн. – Минск, 2007. – № 2(14). – С. 173-177";2007;;;136;
8;"Планирование работы группы следователей и оперативных сотрудников / В.М.Логвин, Ю.А. Матвейчев // Вестник Академии МВД Республики Беларусь : науч.-практ. журн. – Минск, 2007. – № 1(13). – С. 110-114";2007;;;137;
8;"Тактические особенности проведения некоторых следственных действий по делам о торговле людьми с целью сексуальной эксплуа-тации / В.М. Логвин, М.П. Шруб // Проблемы криминалистики : сб. науч. тр. / М-во внутрен. дел Респ. Беларусь, Акад. МВД ; редкол.: Г.Н. Мухин (отв. ред.) [и др.]. – Минск : Акад. МВД Респ. Беларусь, 2009. – Вып. 7. – С. 119-127";2009;;;138;
8;"Участие специалиста-криминалиста в следственных действиях : процессуальные и организационные аспекты / В.М. Логвин // Проблемы криминалистики : сб. науч. тр. / М-во внутрен. дел Респ. Беларусь, Акад. МВД ; редкол.: Г.Н. Мухин (отв. ред.) [и др.]. – Минск : Акад. МВД Респ. Беларусь, 2007. – Вып. 5. – C. 87-98";2007;;;139;
8;"Фиксация доказательственной информации с использованием цифровой фотосъемки / В. Логвин, Г. Мухин // Судовы веснік : часоп. / Вярхоўны Суд Рэсп. Беларусь. – Минск, 2007. – № 3. – С. 63-65";2007;;;140;
8;"Научная категория механизма преступного поведения в теории криминалистики и практике раскрытия преступлений / Г.Н. Мухин // Проблемы криминалистики : сб. науч. тр. / М-во внутрен. дел Респ. Беларусь, Акад. МВД ; редкол.: Г.Н. Мухин (отв. ред.) [и др.]. – Минск : Акад. МВД Респ. Беларусь, 2009. – Вып. 7. – С. 29-37";2009;;;141;
8;"Проблемы совершенствования научно-методических основ раскрытия и расследования преступлений / Г. Мухин // Судовы веснік : часоп. / Вярхоўны Суд Рэсп. Беларусь. – Минск, 2009. – № 3. – С. 55-58";2009;;;142;
8;"Генезис научных представлений о дерматоглифике, ее сущности и свойствах / Г.Н. Мухин, О.Г. Каразей, Д.В. Исютин-Федотков // Веснік Гродзенскага дзяржаўнага універсітэта імя Янкі Купалы : навук.-тэарэт. часоп. – Серыя 4: Правазнаўства, псіхалогія. – Гродно, 2007. – № 50. – С. 63-67";2007;;;143;
